No.     Time           Source                Destination           Protocol Length Info
      1 0.000000000    10.2.73.5             10.73.14.5            TCP      74     49200 → 22 [SYN] Seq=0 Win=64240 Len=0 MSS=1460 SACK_PERM=1 TSval=3519096905 TSecr=0 WS=128

Frame 1: 74 bytes on wire (592 bits), 74 bytes captured (592 bits) on interface enp0s3, id 0
    Interface id: 0 (enp0s3)
        Interface name: enp0s3
    Encapsulation type: Ethernet (1)
    Arrival Time: Oct 26, 2022 20:40:27.952914135 EEST
    [Time shift for this packet: 0.000000000 seconds]
    Epoch Time: 1666806027.952914135 seconds
    [Time delta from previous captured frame: 0.000000000 seconds]
    [Time delta from previous displayed frame: 0.000000000 seconds]
    [Time since reference or first frame: 0.000000000 seconds]
    Frame Number: 1
    Frame Length: 74 bytes (592 bits)
    Capture Length: 74 bytes (592 bits)
    [Frame is marked: False]
    [Frame is ignored: False]
    [Protocols in frame: eth:ethertype:ip:tcp]
    [Coloring Rule Name: TCP SYN/FIN]
    [Coloring Rule String: tcp.flags & 0x02 || tcp.flags.fin == 1]
Ethernet II, Src: PcsCompu_57:5f:a0 (08:00:27:57:5f:a0), Dst: PcsCompu_9f:a5:ba (08:00:27:9f:a5:ba)
    Destination: PcsCompu_9f:a5:ba (08:00:27:9f:a5:ba)
        Address: PcsCompu_9f:a5:ba (08:00:27:9f:a5:ba)
        .... ..0. .... .... .... .... = LG bit: Globally unique address (factory default)
        .... ...0 .... .... .... .... = IG bit: Individual address (unicast)
    Source: PcsCompu_57:5f:a0 (08:00:27:57:5f:a0)
        Address: PcsCompu_57:5f:a0 (08:00:27:57:5f:a0)
        .... ..0. .... .... .... .... = LG bit: Globally unique address (factory default)
        .... ...0 .... .... .... .... = IG bit: Individual address (unicast)
    Type: IPv4 (0x0800)
Internet Protocol Version 4, Src: 10.2.73.5, Dst: 10.73.14.5
    0100 .... = Version: 4
    .... 0101 = Header Length: 20 bytes (5)
    Differentiated Services Field: 0x10 (DSCP: Unknown, ECN: Not-ECT)
        0001 00.. = Differentiated Services Codepoint: Unknown (4)
        .... ..00 = Explicit Congestion Notification: Not ECN-Capable Transport (0)
    Total Length: 60
    Identification: 0xf8fa (63738)
    Flags: 0x40, Don't fragment
        0... .... = Reserved bit: Not set
        .1.. .... = Don't fragment: Set
        ..0. .... = More fragments: Not set
    ...0 0000 0000 0000 = Fragment Offset: 0
    Time to Live: 64
    Protocol: TCP (6)
    Header Checksum: 0xd65c [validation disabled]
    [Header checksum status: Unverified]
    Source Address: 10.2.73.5
    Destination Address: 10.73.14.5
Transmission Control Protocol, Src Port: 49200, Dst Port: 22, Seq: 0, Len: 0
    Source Port: 49200
    Destination Port: 22
    [Stream index: 0]
    [Conversation completeness: Incomplete, DATA (15)]
    [TCP Segment Len: 0]
    Sequence Number: 0    (relative sequence number)
    Sequence Number (raw): 3735242597
    [Next Sequence Number: 1    (relative sequence number)]
    Acknowledgment Number: 0
    Acknowledgment number (raw): 0
    1010 .... = Header Length: 40 bytes (10)
    Flags: 0x002 (SYN)
        000. .... .... = Reserved: Not set
        ...0 .... .... = Nonce: Not set
        .... 0... .... = Congestion Window Reduced (CWR): Not set
        .... .0.. .... = ECN-Echo: Not set
        .... ..0. .... = Urgent: Not set
        .... ...0 .... = Acknowledgment: Not set
        .... .... 0... = Push: Not set
        .... .... .0.. = Reset: Not set
        .... .... ..1. = Syn: Set
            [Expert Info (Chat/Sequence): Connection establish request (SYN): server port 22]
                [Connection establish request (SYN): server port 22]
                [Severity level: Chat]
                [Group: Sequence]
        .... .... ...0 = Fin: Not set
        [TCP Flags: ··········S·]
    Window: 64240
    [Calculated window size: 64240]
    Checksum: 0x6b83 [unverified]
    [Checksum Status: Unverified]
    Urgent Pointer: 0
    Options: (20 bytes), Maximum segment size, SACK permitted, Timestamps, No-Operation (NOP), Window scale
        TCP Option - Maximum segment size: 1460 bytes
            Kind: Maximum Segment Size (2)
            Length: 4
            MSS Value: 1460
        TCP Option - SACK permitted
            Kind: SACK Permitted (4)
            Length: 2
        TCP Option - Timestamps: TSval 3519096905, TSecr 0
            Kind: Time Stamp Option (8)
            Length: 10
            Timestamp value: 3519096905
            Timestamp echo reply: 0
        TCP Option - No-Operation (NOP)
            Kind: No-Operation (1)
        TCP Option - Window scale: 7 (multiply by 128)
            Kind: Window Scale (3)
            Length: 3
            Shift count: 7
            [Multiplier: 128]
    [Timestamps]
        [Time since first frame in this TCP stream: 0.000000000 seconds]
        [Time since previous frame in this TCP stream: 0.000000000 seconds]

0000  08 00 27 9f a5 ba 08 00 27 57 5f a0 08 00 45 10   ..'.....'W_...E.
0010  00 3c f8 fa 40 00 40 06 d6 5c 0a 02 49 05 0a 49   .<..@.@..\..I..I
0020  0e 05 c0 30 00 16 de a3 47 65 00 00 00 00 a0 02   ...0....Ge......
0030  fa f0 6b 83 00 00 02 04 05 b4 04 02 08 0a d1 c1   ..k.............
0040  28 49 00 00 00 00 01 03 03 07                     (I........

No.     Time           Source                Destination           Protocol Length Info
      2 0.001061343    10.73.14.5            10.2.73.5             TCP      74     22 → 49200 [SYN, ACK] Seq=0 Ack=1 Win=28960 Len=0 MSS=1460 SACK_PERM=1 TSval=494204 TSecr=3519096905 WS=128

Frame 2: 74 bytes on wire (592 bits), 74 bytes captured (592 bits) on interface enp0s3, id 0
    Interface id: 0 (enp0s3)
        Interface name: enp0s3
    Encapsulation type: Ethernet (1)
    Arrival Time: Oct 26, 2022 20:40:27.953975478 EEST
    [Time shift for this packet: 0.000000000 seconds]
    Epoch Time: 1666806027.953975478 seconds
    [Time delta from previous captured frame: 0.001061343 seconds]
    [Time delta from previous displayed frame: 0.001061343 seconds]
    [Time since reference or first frame: 0.001061343 seconds]
    Frame Number: 2
    Frame Length: 74 bytes (592 bits)
    Capture Length: 74 bytes (592 bits)
    [Frame is marked: False]
    [Frame is ignored: False]
    [Protocols in frame: eth:ethertype:ip:tcp]
    [Coloring Rule Name: TCP SYN/FIN]
    [Coloring Rule String: tcp.flags & 0x02 || tcp.flags.fin == 1]
Ethernet II, Src: PcsCompu_9f:a5:ba (08:00:27:9f:a5:ba), Dst: PcsCompu_57:5f:a0 (08:00:27:57:5f:a0)
    Destination: PcsCompu_57:5f:a0 (08:00:27:57:5f:a0)
        Address: PcsCompu_57:5f:a0 (08:00:27:57:5f:a0)
        .... ..0. .... .... .... .... = LG bit: Globally unique address (factory default)
        .... ...0 .... .... .... .... = IG bit: Individual address (unicast)
    Source: PcsCompu_9f:a5:ba (08:00:27:9f:a5:ba)
        Address: PcsCompu_9f:a5:ba (08:00:27:9f:a5:ba)
        .... ..0. .... .... .... .... = LG bit: Globally unique address (factory default)
        .... ...0 .... .... .... .... = IG bit: Individual address (unicast)
    Type: IPv4 (0x0800)
Internet Protocol Version 4, Src: 10.73.14.5, Dst: 10.2.73.5
    0100 .... = Version: 4
    .... 0101 = Header Length: 20 bytes (5)
    Differentiated Services Field: 0x00 (DSCP: CS0, ECN: Not-ECT)
        0000 00.. = Differentiated Services Codepoint: Default (0)
        .... ..00 = Explicit Congestion Notification: Not ECN-Capable Transport (0)
    Total Length: 60
    Identification: 0x0000 (0)
    Flags: 0x40, Don't fragment
        0... .... = Reserved bit: Not set
        .1.. .... = Don't fragment: Set
        ..0. .... = More fragments: Not set
    ...0 0000 0000 0000 = Fragment Offset: 0
    Time to Live: 63
    Protocol: TCP (6)
    Header Checksum: 0xd067 [validation disabled]
    [Header checksum status: Unverified]
    Source Address: 10.73.14.5
    Destination Address: 10.2.73.5
Transmission Control Protocol, Src Port: 22, Dst Port: 49200, Seq: 0, Ack: 1, Len: 0
    Source Port: 22
    Destination Port: 49200
    [Stream index: 0]
    [Conversation completeness: Incomplete, DATA (15)]
    [TCP Segment Len: 0]
    Sequence Number: 0    (relative sequence number)
    Sequence Number (raw): 2287526184
    [Next Sequence Number: 1    (relative sequence number)]
    Acknowledgment Number: 1    (relative ack number)
    Acknowledgment number (raw): 3735242598
    1010 .... = Header Length: 40 bytes (10)
    Flags: 0x012 (SYN, ACK)
        000. .... .... = Reserved: Not set
        ...0 .... .... = Nonce: Not set
        .... 0... .... = Congestion Window Reduced (CWR): Not set
        .... .0.. .... = ECN-Echo: Not set
        .... ..0. .... = Urgent: Not set
        .... ...1 .... = Acknowledgment: Set
        .... .... 0... = Push: Not set
        .... .... .0.. = Reset: Not set
        .... .... ..1. = Syn: Set
            [Expert Info (Chat/Sequence): Connection establish acknowledge (SYN+ACK): server port 22]
                [Connection establish acknowledge (SYN+ACK): server port 22]
                [Severity level: Chat]
                [Group: Sequence]
        .... .... ...0 = Fin: Not set
        [TCP Flags: ·······A··S·]
    Window: 28960
    [Calculated window size: 28960]
    Checksum: 0x971a [unverified]
    [Checksum Status: Unverified]
    Urgent Pointer: 0
    Options: (20 bytes), Maximum segment size, SACK permitted, Timestamps, No-Operation (NOP), Window scale
        TCP Option - Maximum segment size: 1460 bytes
            Kind: Maximum Segment Size (2)
            Length: 4
            MSS Value: 1460
        TCP Option - SACK permitted
            Kind: SACK Permitted (4)
            Length: 2
        TCP Option - Timestamps: TSval 494204, TSecr 3519096905
            Kind: Time Stamp Option (8)
            Length: 10
            Timestamp value: 494204
            Timestamp echo reply: 3519096905
        TCP Option - No-Operation (NOP)
            Kind: No-Operation (1)
        TCP Option - Window scale: 7 (multiply by 128)
            Kind: Window Scale (3)
            Length: 3
            Shift count: 7
            [Multiplier: 128]
    [Timestamps]
        [Time since first frame in this TCP stream: 0.001061343 seconds]
        [Time since previous frame in this TCP stream: 0.001061343 seconds]
    [SEQ/ACK analysis]
        [This is an ACK to the segment in frame: 1]
        [The RTT to ACK the segment was: 0.001061343 seconds]
        [iRTT: 0.001111753 seconds]

0000  08 00 27 57 5f a0 08 00 27 9f a5 ba 08 00 45 00   ..'W_...'.....E.
0010  00 3c 00 00 40 00 3f 06 d0 67 0a 49 0e 05 0a 02   .<..@.?..g.I....
0020  49 05 00 16 c0 30 88 58 e1 28 de a3 47 66 a0 12   I....0.X.(..Gf..
0030  71 20 97 1a 00 00 02 04 05 b4 04 02 08 0a 00 07   q ..............
0040  8a 7c d1 c1 28 49 01 03 03 07                     .|..(I....

No.     Time           Source                Destination           Protocol Length Info
      3 0.001111753    10.2.73.5             10.73.14.5            TCP      66     49200 → 22 [ACK] Seq=1 Ack=1 Win=64256 Len=0 TSval=3519096906 TSecr=494204

Frame 3: 66 bytes on wire (528 bits), 66 bytes captured (528 bits) on interface enp0s3, id 0
    Interface id: 0 (enp0s3)
        Interface name: enp0s3
    Encapsulation type: Ethernet (1)
    Arrival Time: Oct 26, 2022 20:40:27.954025888 EEST
    [Time shift for this packet: 0.000000000 seconds]
    Epoch Time: 1666806027.954025888 seconds
    [Time delta from previous captured frame: 0.000050410 seconds]
    [Time delta from previous displayed frame: 0.000050410 seconds]
    [Time since reference or first frame: 0.001111753 seconds]
    Frame Number: 3
    Frame Length: 66 bytes (528 bits)
    Capture Length: 66 bytes (528 bits)
    [Frame is marked: False]
    [Frame is ignored: False]
    [Protocols in frame: eth:ethertype:ip:tcp]
    [Coloring Rule Name: TCP]
    [Coloring Rule String: tcp]
Ethernet II, Src: PcsCompu_57:5f:a0 (08:00:27:57:5f:a0), Dst: PcsCompu_9f:a5:ba (08:00:27:9f:a5:ba)
    Destination: PcsCompu_9f:a5:ba (08:00:27:9f:a5:ba)
        Address: PcsCompu_9f:a5:ba (08:00:27:9f:a5:ba)
        .... ..0. .... .... .... .... = LG bit: Globally unique address (factory default)
        .... ...0 .... .... .... .... = IG bit: Individual address (unicast)
    Source: PcsCompu_57:5f:a0 (08:00:27:57:5f:a0)
        Address: PcsCompu_57:5f:a0 (08:00:27:57:5f:a0)
        .... ..0. .... .... .... .... = LG bit: Globally unique address (factory default)
        .... ...0 .... .... .... .... = IG bit: Individual address (unicast)
    Type: IPv4 (0x0800)
Internet Protocol Version 4, Src: 10.2.73.5, Dst: 10.73.14.5
    0100 .... = Version: 4
    .... 0101 = Header Length: 20 bytes (5)
    Differentiated Services Field: 0x10 (DSCP: Unknown, ECN: Not-ECT)
        0001 00.. = Differentiated Services Codepoint: Unknown (4)
        .... ..00 = Explicit Congestion Notification: Not ECN-Capable Transport (0)
    Total Length: 52
    Identification: 0xf8fb (63739)
    Flags: 0x40, Don't fragment
        0... .... = Reserved bit: Not set
        .1.. .... = Don't fragment: Set
        ..0. .... = More fragments: Not set
    ...0 0000 0000 0000 = Fragment Offset: 0
    Time to Live: 64
    Protocol: TCP (6)
    Header Checksum: 0xd663 [validation disabled]
    [Header checksum status: Unverified]
    Source Address: 10.2.73.5
    Destination Address: 10.73.14.5
Transmission Control Protocol, Src Port: 49200, Dst Port: 22, Seq: 1, Ack: 1, Len: 0
    Source Port: 49200
    Destination Port: 22
    [Stream index: 0]
    [Conversation completeness: Incomplete, DATA (15)]
    [TCP Segment Len: 0]
    Sequence Number: 1    (relative sequence number)
    Sequence Number (raw): 3735242598
    [Next Sequence Number: 1    (relative sequence number)]
    Acknowledgment Number: 1    (relative ack number)
    Acknowledgment number (raw): 2287526185
    1000 .... = Header Length: 32 bytes (8)
    Flags: 0x010 (ACK)
        000. .... .... = Reserved: Not set
        ...0 .... .... = Nonce: Not set
        .... 0... .... = Congestion Window Reduced (CWR): Not set
        .... .0.. .... = ECN-Echo: Not set
        .... ..0. .... = Urgent: Not set
        .... ...1 .... = Acknowledgment: Set
        .... .... 0... = Push: Not set
        .... .... .0.. = Reset: Not set
        .... .... ..0. = Syn: Not set
        .... .... ...0 = Fin: Not set
        [TCP Flags: ·······A····]
    Window: 502
    [Calculated window size: 64256]
    [Window size scaling factor: 128]
    Checksum: 0x6b7b [unverified]
    [Checksum Status: Unverified]
    Urgent Pointer: 0
    Options: (12 bytes), No-Operation (NOP), No-Operation (NOP), Timestamps
        TCP Option - No-Operation (NOP)
            Kind: No-Operation (1)
        TCP Option - No-Operation (NOP)
            Kind: No-Operation (1)
        TCP Option - Timestamps: TSval 3519096906, TSecr 494204
            Kind: Time Stamp Option (8)
            Length: 10
            Timestamp value: 3519096906
            Timestamp echo reply: 494204
    [Timestamps]
        [Time since first frame in this TCP stream: 0.001111753 seconds]
        [Time since previous frame in this TCP stream: 0.000050410 seconds]
    [SEQ/ACK analysis]
        [This is an ACK to the segment in frame: 2]
        [The RTT to ACK the segment was: 0.000050410 seconds]
        [iRTT: 0.001111753 seconds]

0000  08 00 27 9f a5 ba 08 00 27 57 5f a0 08 00 45 10   ..'.....'W_...E.
0010  00 34 f8 fb 40 00 40 06 d6 63 0a 02 49 05 0a 49   .4..@.@..c..I..I
0020  0e 05 c0 30 00 16 de a3 47 66 88 58 e1 29 80 10   ...0....Gf.X.)..
0030  01 f6 6b 7b 00 00 01 01 08 0a d1 c1 28 4a 00 07   ..k{........(J..
0040  8a 7c                                             .|

No.     Time           Source                Destination           Protocol Length Info
      4 0.002246534    10.2.73.5             10.73.14.5            SSHv2    98     Client: Protocol (SSH-2.0-OpenSSH_8.9p1 Ubuntu-3)

Frame 4: 98 bytes on wire (784 bits), 98 bytes captured (784 bits) on interface enp0s3, id 0
    Interface id: 0 (enp0s3)
        Interface name: enp0s3
    Encapsulation type: Ethernet (1)
    Arrival Time: Oct 26, 2022 20:40:27.955160669 EEST
    [Time shift for this packet: 0.000000000 seconds]
    Epoch Time: 1666806027.955160669 seconds
    [Time delta from previous captured frame: 0.001134781 seconds]
    [Time delta from previous displayed frame: 0.001134781 seconds]
    [Time since reference or first frame: 0.002246534 seconds]
    Frame Number: 4
    Frame Length: 98 bytes (784 bits)
    Capture Length: 98 bytes (784 bits)
    [Frame is marked: False]
    [Frame is ignored: False]
    [Protocols in frame: eth:ethertype:ip:tcp:ssh]
    [Coloring Rule Name: TCP]
    [Coloring Rule String: tcp]
Ethernet II, Src: PcsCompu_57:5f:a0 (08:00:27:57:5f:a0), Dst: PcsCompu_9f:a5:ba (08:00:27:9f:a5:ba)
    Destination: PcsCompu_9f:a5:ba (08:00:27:9f:a5:ba)
        Address: PcsCompu_9f:a5:ba (08:00:27:9f:a5:ba)
        .... ..0. .... .... .... .... = LG bit: Globally unique address (factory default)
        .... ...0 .... .... .... .... = IG bit: Individual address (unicast)
    Source: PcsCompu_57:5f:a0 (08:00:27:57:5f:a0)
        Address: PcsCompu_57:5f:a0 (08:00:27:57:5f:a0)
        .... ..0. .... .... .... .... = LG bit: Globally unique address (factory default)
        .... ...0 .... .... .... .... = IG bit: Individual address (unicast)
    Type: IPv4 (0x0800)
Internet Protocol Version 4, Src: 10.2.73.5, Dst: 10.73.14.5
    0100 .... = Version: 4
    .... 0101 = Header Length: 20 bytes (5)
    Differentiated Services Field: 0x10 (DSCP: Unknown, ECN: Not-ECT)
        0001 00.. = Differentiated Services Codepoint: Unknown (4)
        .... ..00 = Explicit Congestion Notification: Not ECN-Capable Transport (0)
    Total Length: 84
    Identification: 0xf8fc (63740)
    Flags: 0x40, Don't fragment
        0... .... = Reserved bit: Not set
        .1.. .... = Don't fragment: Set
        ..0. .... = More fragments: Not set
    ...0 0000 0000 0000 = Fragment Offset: 0
    Time to Live: 64
    Protocol: TCP (6)
    Header Checksum: 0xd642 [validation disabled]
    [Header checksum status: Unverified]
    Source Address: 10.2.73.5
    Destination Address: 10.73.14.5
Transmission Control Protocol, Src Port: 49200, Dst Port: 22, Seq: 1, Ack: 1, Len: 32
    Source Port: 49200
    Destination Port: 22
    [Stream index: 0]
    [Conversation completeness: Incomplete, DATA (15)]
    [TCP Segment Len: 32]
    Sequence Number: 1    (relative sequence number)
    Sequence Number (raw): 3735242598
    [Next Sequence Number: 33    (relative sequence number)]
    Acknowledgment Number: 1    (relative ack number)
    Acknowledgment number (raw): 2287526185
    1000 .... = Header Length: 32 bytes (8)
    Flags: 0x018 (PSH, ACK)
        000. .... .... = Reserved: Not set
        ...0 .... .... = Nonce: Not set
        .... 0... .... = Congestion Window Reduced (CWR): Not set
        .... .0.. .... = ECN-Echo: Not set
        .... ..0. .... = Urgent: Not set
        .... ...1 .... = Acknowledgment: Set
        .... .... 1... = Push: Set
        .... .... .0.. = Reset: Not set
        .... .... ..0. = Syn: Not set
        .... .... ...0 = Fin: Not set
        [TCP Flags: ·······AP···]
    Window: 502
    [Calculated window size: 64256]
    [Window size scaling factor: 128]
    Checksum: 0x6b9b [unverified]
    [Checksum Status: Unverified]
    Urgent Pointer: 0
    Options: (12 bytes), No-Operation (NOP), No-Operation (NOP), Timestamps
        TCP Option - No-Operation (NOP)
            Kind: No-Operation (1)
        TCP Option - No-Operation (NOP)
            Kind: No-Operation (1)
        TCP Option - Timestamps: TSval 3519096907, TSecr 494204
            Kind: Time Stamp Option (8)
            Length: 10
            Timestamp value: 3519096907
            Timestamp echo reply: 494204
    [Timestamps]
        [Time since first frame in this TCP stream: 0.002246534 seconds]
        [Time since previous frame in this TCP stream: 0.001134781 seconds]
    [SEQ/ACK analysis]
        [iRTT: 0.001111753 seconds]
        [Bytes in flight: 32]
        [Bytes sent since last PSH flag: 32]
    TCP payload (32 bytes)
SSH Protocol
    Protocol: SSH-2.0-OpenSSH_8.9p1 Ubuntu-3
    [Direction: client-to-server]

0000  08 00 27 9f a5 ba 08 00 27 57 5f a0 08 00 45 10   ..'.....'W_...E.
0010  00 54 f8 fc 40 00 40 06 d6 42 0a 02 49 05 0a 49   .T..@.@..B..I..I
0020  0e 05 c0 30 00 16 de a3 47 66 88 58 e1 29 80 18   ...0....Gf.X.)..
0030  01 f6 6b 9b 00 00 01 01 08 0a d1 c1 28 4b 00 07   ..k.........(K..
0040  8a 7c 53 53 48 2d 32 2e 30 2d 4f 70 65 6e 53 53   .|SSH-2.0-OpenSS
0050  48 5f 38 2e 39 70 31 20 55 62 75 6e 74 75 2d 33   H_8.9p1 Ubuntu-3
0060  0d 0a                                             ..

No.     Time           Source                Destination           Protocol Length Info
      5 0.004102225    10.73.14.5            10.2.73.5             TCP      66     22 → 49200 [ACK] Seq=1 Ack=33 Win=29056 Len=0 TSval=494207 TSecr=3519096907

Frame 5: 66 bytes on wire (528 bits), 66 bytes captured (528 bits) on interface enp0s3, id 0
    Interface id: 0 (enp0s3)
        Interface name: enp0s3
    Encapsulation type: Ethernet (1)
    Arrival Time: Oct 26, 2022 20:40:27.957016360 EEST
    [Time shift for this packet: 0.000000000 seconds]
    Epoch Time: 1666806027.957016360 seconds
    [Time delta from previous captured frame: 0.001855691 seconds]
    [Time delta from previous displayed frame: 0.001855691 seconds]
    [Time since reference or first frame: 0.004102225 seconds]
    Frame Number: 5
    Frame Length: 66 bytes (528 bits)
    Capture Length: 66 bytes (528 bits)
    [Frame is marked: False]
    [Frame is ignored: False]
    [Protocols in frame: eth:ethertype:ip:tcp]
    [Coloring Rule Name: TCP]
    [Coloring Rule String: tcp]
Ethernet II, Src: PcsCompu_9f:a5:ba (08:00:27:9f:a5:ba), Dst: PcsCompu_57:5f:a0 (08:00:27:57:5f:a0)
    Destination: PcsCompu_57:5f:a0 (08:00:27:57:5f:a0)
        Address: PcsCompu_57:5f:a0 (08:00:27:57:5f:a0)
        .... ..0. .... .... .... .... = LG bit: Globally unique address (factory default)
        .... ...0 .... .... .... .... = IG bit: Individual address (unicast)
    Source: PcsCompu_9f:a5:ba (08:00:27:9f:a5:ba)
        Address: PcsCompu_9f:a5:ba (08:00:27:9f:a5:ba)
        .... ..0. .... .... .... .... = LG bit: Globally unique address (factory default)
        .... ...0 .... .... .... .... = IG bit: Individual address (unicast)
    Type: IPv4 (0x0800)
Internet Protocol Version 4, Src: 10.73.14.5, Dst: 10.2.73.5
    0100 .... = Version: 4
    .... 0101 = Header Length: 20 bytes (5)
    Differentiated Services Field: 0x00 (DSCP: CS0, ECN: Not-ECT)
        0000 00.. = Differentiated Services Codepoint: Default (0)
        .... ..00 = Explicit Congestion Notification: Not ECN-Capable Transport (0)
    Total Length: 52
    Identification: 0x6b54 (27476)
    Flags: 0x40, Don't fragment
        0... .... = Reserved bit: Not set
        .1.. .... = Don't fragment: Set
        ..0. .... = More fragments: Not set
    ...0 0000 0000 0000 = Fragment Offset: 0
    Time to Live: 63
    Protocol: TCP (6)
    Header Checksum: 0x651b [validation disabled]
    [Header checksum status: Unverified]
    Source Address: 10.73.14.5
    Destination Address: 10.2.73.5
Transmission Control Protocol, Src Port: 22, Dst Port: 49200, Seq: 1, Ack: 33, Len: 0
    Source Port: 22
    Destination Port: 49200
    [Stream index: 0]
    [Conversation completeness: Incomplete, DATA (15)]
    [TCP Segment Len: 0]
    Sequence Number: 1    (relative sequence number)
    Sequence Number (raw): 2287526185
    [Next Sequence Number: 1    (relative sequence number)]
    Acknowledgment Number: 33    (relative ack number)
    Acknowledgment number (raw): 3735242630
    1000 .... = Header Length: 32 bytes (8)
    Flags: 0x010 (ACK)
        000. .... .... = Reserved: Not set
        ...0 .... .... = Nonce: Not set
        .... 0... .... = Congestion Window Reduced (CWR): Not set
        .... .0.. .... = ECN-Echo: Not set
        .... ..0. .... = Urgent: Not set
        .... ...1 .... = Acknowledgment: Set
        .... .... 0... = Push: Not set
        .... .... .0.. = Reset: Not set
        .... .... ..0. = Syn: Not set
        .... .... ...0 = Fin: Not set
        [TCP Flags: ·······A····]
    Window: 227
    [Calculated window size: 29056]
    [Window size scaling factor: 128]
    Checksum: 0x35ff [unverified]
    [Checksum Status: Unverified]
    Urgent Pointer: 0
    Options: (12 bytes), No-Operation (NOP), No-Operation (NOP), Timestamps
        TCP Option - No-Operation (NOP)
            Kind: No-Operation (1)
        TCP Option - No-Operation (NOP)
            Kind: No-Operation (1)
        TCP Option - Timestamps: TSval 494207, TSecr 3519096907
            Kind: Time Stamp Option (8)
            Length: 10
            Timestamp value: 494207
            Timestamp echo reply: 3519096907
    [Timestamps]
        [Time since first frame in this TCP stream: 0.004102225 seconds]
        [Time since previous frame in this TCP stream: 0.001855691 seconds]
    [SEQ/ACK analysis]
        [This is an ACK to the segment in frame: 4]
        [The RTT to ACK the segment was: 0.001855691 seconds]
        [iRTT: 0.001111753 seconds]

0000  08 00 27 57 5f a0 08 00 27 9f a5 ba 08 00 45 00   ..'W_...'.....E.
0010  00 34 6b 54 40 00 3f 06 65 1b 0a 49 0e 05 0a 02   .4kT@.?.e..I....
0020  49 05 00 16 c0 30 88 58 e1 29 de a3 47 86 80 10   I....0.X.)..G...
0030  00 e3 35 ff 00 00 01 01 08 0a 00 07 8a 7f d1 c1   ..5.............
0040  28 4b                                             (K

No.     Time           Source                Destination           Protocol Length Info
      6 0.023709242    10.73.14.5            10.2.73.5             SSHv2    87     Server: Protocol (SSH-2.0-OpenSSH_7.4)

Frame 6: 87 bytes on wire (696 bits), 87 bytes captured (696 bits) on interface enp0s3, id 0
    Interface id: 0 (enp0s3)
        Interface name: enp0s3
    Encapsulation type: Ethernet (1)
    Arrival Time: Oct 26, 2022 20:40:27.976623377 EEST
    [Time shift for this packet: 0.000000000 seconds]
    Epoch Time: 1666806027.976623377 seconds
    [Time delta from previous captured frame: 0.019607017 seconds]
    [Time delta from previous displayed frame: 0.019607017 seconds]
    [Time since reference or first frame: 0.023709242 seconds]
    Frame Number: 6
    Frame Length: 87 bytes (696 bits)
    Capture Length: 87 bytes (696 bits)
    [Frame is marked: False]
    [Frame is ignored: False]
    [Protocols in frame: eth:ethertype:ip:tcp:ssh]
    [Coloring Rule Name: TCP]
    [Coloring Rule String: tcp]
Ethernet II, Src: PcsCompu_9f:a5:ba (08:00:27:9f:a5:ba), Dst: PcsCompu_57:5f:a0 (08:00:27:57:5f:a0)
    Destination: PcsCompu_57:5f:a0 (08:00:27:57:5f:a0)
        Address: PcsCompu_57:5f:a0 (08:00:27:57:5f:a0)
        .... ..0. .... .... .... .... = LG bit: Globally unique address (factory default)
        .... ...0 .... .... .... .... = IG bit: Individual address (unicast)
    Source: PcsCompu_9f:a5:ba (08:00:27:9f:a5:ba)
        Address: PcsCompu_9f:a5:ba (08:00:27:9f:a5:ba)
        .... ..0. .... .... .... .... = LG bit: Globally unique address (factory default)
        .... ...0 .... .... .... .... = IG bit: Individual address (unicast)
    Type: IPv4 (0x0800)
Internet Protocol Version 4, Src: 10.73.14.5, Dst: 10.2.73.5
    0100 .... = Version: 4
    .... 0101 = Header Length: 20 bytes (5)
    Differentiated Services Field: 0x00 (DSCP: CS0, ECN: Not-ECT)
        0000 00.. = Differentiated Services Codepoint: Default (0)
        .... ..00 = Explicit Congestion Notification: Not ECN-Capable Transport (0)
    Total Length: 73
    Identification: 0x6b55 (27477)
    Flags: 0x40, Don't fragment
        0... .... = Reserved bit: Not set
        .1.. .... = Don't fragment: Set
        ..0. .... = More fragments: Not set
    ...0 0000 0000 0000 = Fragment Offset: 0
    Time to Live: 63
    Protocol: TCP (6)
    Header Checksum: 0x6505 [validation disabled]
    [Header checksum status: Unverified]
    Source Address: 10.73.14.5
    Destination Address: 10.2.73.5
Transmission Control Protocol, Src Port: 22, Dst Port: 49200, Seq: 1, Ack: 33, Len: 21
    Source Port: 22
    Destination Port: 49200
    [Stream index: 0]
    [Conversation completeness: Incomplete, DATA (15)]
    [TCP Segment Len: 21]
    Sequence Number: 1    (relative sequence number)
    Sequence Number (raw): 2287526185
    [Next Sequence Number: 22    (relative sequence number)]
    Acknowledgment Number: 33    (relative ack number)
    Acknowledgment number (raw): 3735242630
    1000 .... = Header Length: 32 bytes (8)
    Flags: 0x018 (PSH, ACK)
        000. .... .... = Reserved: Not set
        ...0 .... .... = Nonce: Not set
        .... 0... .... = Congestion Window Reduced (CWR): Not set
        .... .0.. .... = ECN-Echo: Not set
        .... ..0. .... = Urgent: Not set
        .... ...1 .... = Acknowledgment: Set
        .... .... 1... = Push: Set
        .... .... .0.. = Reset: Not set
        .... .... ..0. = Syn: Not set
        .... .... ...0 = Fin: Not set
        [TCP Flags: ·······AP···]
    Window: 227
    [Calculated window size: 29056]
    [Window size scaling factor: 128]
    Checksum: 0x7225 [unverified]
    [Checksum Status: Unverified]
    Urgent Pointer: 0
    Options: (12 bytes), No-Operation (NOP), No-Operation (NOP), Timestamps
        TCP Option - No-Operation (NOP)
            Kind: No-Operation (1)
        TCP Option - No-Operation (NOP)
            Kind: No-Operation (1)
        TCP Option - Timestamps: TSval 494227, TSecr 3519096907
            Kind: Time Stamp Option (8)
            Length: 10
            Timestamp value: 494227
            Timestamp echo reply: 3519096907
    [Timestamps]
        [Time since first frame in this TCP stream: 0.023709242 seconds]
        [Time since previous frame in this TCP stream: 0.019607017 seconds]
    [SEQ/ACK analysis]
        [iRTT: 0.001111753 seconds]
        [Bytes in flight: 21]
        [Bytes sent since last PSH flag: 21]
    TCP payload (21 bytes)
SSH Protocol
    Protocol: SSH-2.0-OpenSSH_7.4
    [Direction: server-to-client]

0000  08 00 27 57 5f a0 08 00 27 9f a5 ba 08 00 45 00   ..'W_...'.....E.
0010  00 49 6b 55 40 00 3f 06 65 05 0a 49 0e 05 0a 02   .IkU@.?.e..I....
0020  49 05 00 16 c0 30 88 58 e1 29 de a3 47 86 80 18   I....0.X.)..G...
0030  00 e3 72 25 00 00 01 01 08 0a 00 07 8a 93 d1 c1   ..r%............
0040  28 4b 53 53 48 2d 32 2e 30 2d 4f 70 65 6e 53 53   (KSSH-2.0-OpenSS
0050  48 5f 37 2e 34 0d 0a                              H_7.4..

No.     Time           Source                Destination           Protocol Length Info
      7 0.023744427    10.2.73.5             10.73.14.5            TCP      66     49200 → 22 [ACK] Seq=33 Ack=22 Win=64256 Len=0 TSval=3519096929 TSecr=494227

Frame 7: 66 bytes on wire (528 bits), 66 bytes captured (528 bits) on interface enp0s3, id 0
    Interface id: 0 (enp0s3)
        Interface name: enp0s3
    Encapsulation type: Ethernet (1)
    Arrival Time: Oct 26, 2022 20:40:27.976658562 EEST
    [Time shift for this packet: 0.000000000 seconds]
    Epoch Time: 1666806027.976658562 seconds
    [Time delta from previous captured frame: 0.000035185 seconds]
    [Time delta from previous displayed frame: 0.000035185 seconds]
    [Time since reference or first frame: 0.023744427 seconds]
    Frame Number: 7
    Frame Length: 66 bytes (528 bits)
    Capture Length: 66 bytes (528 bits)
    [Frame is marked: False]
    [Frame is ignored: False]
    [Protocols in frame: eth:ethertype:ip:tcp]
    [Coloring Rule Name: TCP]
    [Coloring Rule String: tcp]
Ethernet II, Src: PcsCompu_57:5f:a0 (08:00:27:57:5f:a0), Dst: PcsCompu_9f:a5:ba (08:00:27:9f:a5:ba)
    Destination: PcsCompu_9f:a5:ba (08:00:27:9f:a5:ba)
        Address: PcsCompu_9f:a5:ba (08:00:27:9f:a5:ba)
        .... ..0. .... .... .... .... = LG bit: Globally unique address (factory default)
        .... ...0 .... .... .... .... = IG bit: Individual address (unicast)
    Source: PcsCompu_57:5f:a0 (08:00:27:57:5f:a0)
        Address: PcsCompu_57:5f:a0 (08:00:27:57:5f:a0)
        .... ..0. .... .... .... .... = LG bit: Globally unique address (factory default)
        .... ...0 .... .... .... .... = IG bit: Individual address (unicast)
    Type: IPv4 (0x0800)
Internet Protocol Version 4, Src: 10.2.73.5, Dst: 10.73.14.5
    0100 .... = Version: 4
    .... 0101 = Header Length: 20 bytes (5)
    Differentiated Services Field: 0x10 (DSCP: Unknown, ECN: Not-ECT)
        0001 00.. = Differentiated Services Codepoint: Unknown (4)
        .... ..00 = Explicit Congestion Notification: Not ECN-Capable Transport (0)
    Total Length: 52
    Identification: 0xf8fd (63741)
    Flags: 0x40, Don't fragment
        0... .... = Reserved bit: Not set
        .1.. .... = Don't fragment: Set
        ..0. .... = More fragments: Not set
    ...0 0000 0000 0000 = Fragment Offset: 0
    Time to Live: 64
    Protocol: TCP (6)
    Header Checksum: 0xd661 [validation disabled]
    [Header checksum status: Unverified]
    Source Address: 10.2.73.5
    Destination Address: 10.73.14.5
Transmission Control Protocol, Src Port: 49200, Dst Port: 22, Seq: 33, Ack: 22, Len: 0
    Source Port: 49200
    Destination Port: 22
    [Stream index: 0]
    [Conversation completeness: Incomplete, DATA (15)]
    [TCP Segment Len: 0]
    Sequence Number: 33    (relative sequence number)
    Sequence Number (raw): 3735242630
    [Next Sequence Number: 33    (relative sequence number)]
    Acknowledgment Number: 22    (relative ack number)
    Acknowledgment number (raw): 2287526206
    1000 .... = Header Length: 32 bytes (8)
    Flags: 0x010 (ACK)
        000. .... .... = Reserved: Not set
        ...0 .... .... = Nonce: Not set
        .... 0... .... = Congestion Window Reduced (CWR): Not set
        .... .0.. .... = ECN-Echo: Not set
        .... ..0. .... = Urgent: Not set
        .... ...1 .... = Acknowledgment: Set
        .... .... 0... = Push: Not set
        .... .... .0.. = Reset: Not set
        .... .... ..0. = Syn: Not set
        .... .... ...0 = Fin: Not set
        [TCP Flags: ·······A····]
    Window: 502
    [Calculated window size: 64256]
    [Window size scaling factor: 128]
    Checksum: 0x6b7b [unverified]
    [Checksum Status: Unverified]
    Urgent Pointer: 0
    Options: (12 bytes), No-Operation (NOP), No-Operation (NOP), Timestamps
        TCP Option - No-Operation (NOP)
            Kind: No-Operation (1)
        TCP Option - No-Operation (NOP)
            Kind: No-Operation (1)
        TCP Option - Timestamps: TSval 3519096929, TSecr 494227
            Kind: Time Stamp Option (8)
            Length: 10
            Timestamp value: 3519096929
            Timestamp echo reply: 494227
    [Timestamps]
        [Time since first frame in this TCP stream: 0.023744427 seconds]
        [Time since previous frame in this TCP stream: 0.000035185 seconds]
    [SEQ/ACK analysis]
        [This is an ACK to the segment in frame: 6]
        [The RTT to ACK the segment was: 0.000035185 seconds]
        [iRTT: 0.001111753 seconds]

0000  08 00 27 9f a5 ba 08 00 27 57 5f a0 08 00 45 10   ..'.....'W_...E.
0010  00 34 f8 fd 40 00 40 06 d6 61 0a 02 49 05 0a 49   .4..@.@..a..I..I
0020  0e 05 c0 30 00 16 de a3 47 86 88 58 e1 3e 80 10   ...0....G..X.>..
0030  01 f6 6b 7b 00 00 01 01 08 0a d1 c1 28 61 00 07   ..k{........(a..
0040  8a 93                                             ..

No.     Time           Source                Destination           Protocol Length Info
      8 0.024553786    10.2.73.5             10.73.14.5            SSHv2    1570   Client: Key Exchange Init

Frame 8: 1570 bytes on wire (12560 bits), 1570 bytes captured (12560 bits) on interface enp0s3, id 0
    Interface id: 0 (enp0s3)
        Interface name: enp0s3
    Encapsulation type: Ethernet (1)
    Arrival Time: Oct 26, 2022 20:40:27.977467921 EEST
    [Time shift for this packet: 0.000000000 seconds]
    Epoch Time: 1666806027.977467921 seconds
    [Time delta from previous captured frame: 0.000809359 seconds]
    [Time delta from previous displayed frame: 0.000809359 seconds]
    [Time since reference or first frame: 0.024553786 seconds]
    Frame Number: 8
    Frame Length: 1570 bytes (12560 bits)
    Capture Length: 1570 bytes (12560 bits)
    [Frame is marked: False]
    [Frame is ignored: False]
    [Protocols in frame: eth:ethertype:ip:tcp:ssh]
    [Coloring Rule Name: TCP]
    [Coloring Rule String: tcp]
Ethernet II, Src: PcsCompu_57:5f:a0 (08:00:27:57:5f:a0), Dst: PcsCompu_9f:a5:ba (08:00:27:9f:a5:ba)
    Destination: PcsCompu_9f:a5:ba (08:00:27:9f:a5:ba)
        Address: PcsCompu_9f:a5:ba (08:00:27:9f:a5:ba)
        .... ..0. .... .... .... .... = LG bit: Globally unique address (factory default)
        .... ...0 .... .... .... .... = IG bit: Individual address (unicast)
    Source: PcsCompu_57:5f:a0 (08:00:27:57:5f:a0)
        Address: PcsCompu_57:5f:a0 (08:00:27:57:5f:a0)
        .... ..0. .... .... .... .... = LG bit: Globally unique address (factory default)
        .... ...0 .... .... .... .... = IG bit: Individual address (unicast)
    Type: IPv4 (0x0800)
Internet Protocol Version 4, Src: 10.2.73.5, Dst: 10.73.14.5
    0100 .... = Version: 4
    .... 0101 = Header Length: 20 bytes (5)
    Differentiated Services Field: 0x10 (DSCP: Unknown, ECN: Not-ECT)
        0001 00.. = Differentiated Services Codepoint: Unknown (4)
        .... ..00 = Explicit Congestion Notification: Not ECN-Capable Transport (0)
    Total Length: 1556
    Identification: 0xf8fe (63742)
    Flags: 0x40, Don't fragment
        0... .... = Reserved bit: Not set
        .1.. .... = Don't fragment: Set
        ..0. .... = More fragments: Not set
    ...0 0000 0000 0000 = Fragment Offset: 0
    Time to Live: 64
    Protocol: TCP (6)
    Header Checksum: 0xd080 [validation disabled]
    [Header checksum status: Unverified]
    Source Address: 10.2.73.5
    Destination Address: 10.73.14.5
Transmission Control Protocol, Src Port: 49200, Dst Port: 22, Seq: 33, Ack: 22, Len: 1504
    Source Port: 49200
    Destination Port: 22
    [Stream index: 0]
    [Conversation completeness: Incomplete, DATA (15)]
    [TCP Segment Len: 1504]
    Sequence Number: 33    (relative sequence number)
    Sequence Number (raw): 3735242630
    [Next Sequence Number: 1537    (relative sequence number)]
    Acknowledgment Number: 22    (relative ack number)
    Acknowledgment number (raw): 2287526206
    1000 .... = Header Length: 32 bytes (8)
    Flags: 0x018 (PSH, ACK)
        000. .... .... = Reserved: Not set
        ...0 .... .... = Nonce: Not set
        .... 0... .... = Congestion Window Reduced (CWR): Not set
        .... .0.. .... = ECN-Echo: Not set
        .... ..0. .... = Urgent: Not set
        .... ...1 .... = Acknowledgment: Set
        .... .... 1... = Push: Set
        .... .... .0.. = Reset: Not set
        .... .... ..0. = Syn: Not set
        .... .... ...0 = Fin: Not set
        [TCP Flags: ·······AP···]
    Window: 502
    [Calculated window size: 64256]
    [Window size scaling factor: 128]
    Checksum: 0x715b [unverified]
    [Checksum Status: Unverified]
    Urgent Pointer: 0
    Options: (12 bytes), No-Operation (NOP), No-Operation (NOP), Timestamps
        TCP Option - No-Operation (NOP)
            Kind: No-Operation (1)
        TCP Option - No-Operation (NOP)
            Kind: No-Operation (1)
        TCP Option - Timestamps: TSval 3519096929, TSecr 494227
            Kind: Time Stamp Option (8)
            Length: 10
            Timestamp value: 3519096929
            Timestamp echo reply: 494227
    [Timestamps]
        [Time since first frame in this TCP stream: 0.024553786 seconds]
        [Time since previous frame in this TCP stream: 0.000809359 seconds]
    [SEQ/ACK analysis]
        [iRTT: 0.001111753 seconds]
        [Bytes in flight: 1504]
        [Bytes sent since last PSH flag: 1504]
    TCP payload (1504 bytes)
SSH Protocol
