No.     Time           Source                Destination           Protocol Length Info
      1 0.000000000    10.73.14.5            10.2.73.5             TCP      74     38870 → 22 [SYN] Seq=0 Win=29200 Len=0 MSS=1460 SACK_PERM=1 TSval=110853 TSecr=0 WS=128

Frame 1: 74 bytes on wire (592 bits), 74 bytes captured (592 bits) on interface enp0s3, id 0
    Interface id: 0 (enp0s3)
        Interface name: enp0s3
    Encapsulation type: Ethernet (1)
    Arrival Time: Oct 26, 2022 13:43:12.038744424 EEST
    [Time shift for this packet: 0.000000000 seconds]
    Epoch Time: 1666780992.038744424 seconds
    [Time delta from previous captured frame: 0.000000000 seconds]
    [Time delta from previous displayed frame: 0.000000000 seconds]
    [Time since reference or first frame: 0.000000000 seconds]
    Frame Number: 1
    Frame Length: 74 bytes (592 bits)
    Capture Length: 74 bytes (592 bits)
    [Frame is marked: False]
    [Frame is ignored: False]
    [Protocols in frame: eth:ethertype:ip:tcp]
    [Coloring Rule Name: TCP SYN/FIN]
    [Coloring Rule String: tcp.flags & 0x02 || tcp.flags.fin == 1]
Ethernet II, Src: PcsCompu_9f:a5:ba (08:00:27:9f:a5:ba), Dst: PcsCompu_57:5f:a0 (08:00:27:57:5f:a0)
    Destination: PcsCompu_57:5f:a0 (08:00:27:57:5f:a0)
        Address: PcsCompu_57:5f:a0 (08:00:27:57:5f:a0)
        .... ..0. .... .... .... .... = LG bit: Globally unique address (factory default)
        .... ...0 .... .... .... .... = IG bit: Individual address (unicast)
    Source: PcsCompu_9f:a5:ba (08:00:27:9f:a5:ba)
        Address: PcsCompu_9f:a5:ba (08:00:27:9f:a5:ba)
        .... ..0. .... .... .... .... = LG bit: Globally unique address (factory default)
        .... ...0 .... .... .... .... = IG bit: Individual address (unicast)
    Type: IPv4 (0x0800)
Internet Protocol Version 4, Src: 10.73.14.5, Dst: 10.2.73.5
    0100 .... = Version: 4
    .... 0101 = Header Length: 20 bytes (5)
    Differentiated Services Field: 0x00 (DSCP: CS0, ECN: Not-ECT)
        0000 00.. = Differentiated Services Codepoint: Default (0)
        .... ..00 = Explicit Congestion Notification: Not ECN-Capable Transport (0)
    Total Length: 60
    Identification: 0x3714 (14100)
    Flags: 0x40, Don't fragment
        0... .... = Reserved bit: Not set
        .1.. .... = Don't fragment: Set
        ..0. .... = More fragments: Not set
    ...0 0000 0000 0000 = Fragment Offset: 0
    Time to Live: 63
    Protocol: TCP (6)
    Header Checksum: 0x9953 [validation disabled]
    [Header checksum status: Unverified]
    Source Address: 10.73.14.5
    Destination Address: 10.2.73.5
Transmission Control Protocol, Src Port: 38870, Dst Port: 22, Seq: 0, Len: 0
    Source Port: 38870
    Destination Port: 22
    [Stream index: 0]
    [Conversation completeness: Incomplete, DATA (15)]
    [TCP Segment Len: 0]
    Sequence Number: 0    (relative sequence number)
    Sequence Number (raw): 2970650129
    [Next Sequence Number: 1    (relative sequence number)]
    Acknowledgment Number: 0
    Acknowledgment number (raw): 0
    1010 .... = Header Length: 40 bytes (10)
    Flags: 0x002 (SYN)
        000. .... .... = Reserved: Not set
        ...0 .... .... = Nonce: Not set
        .... 0... .... = Congestion Window Reduced (CWR): Not set
        .... .0.. .... = ECN-Echo: Not set
        .... ..0. .... = Urgent: Not set
        .... ...0 .... = Acknowledgment: Not set
        .... .... 0... = Push: Not set
        .... .... .0.. = Reset: Not set
        .... .... ..1. = Syn: Set
            [Expert Info (Chat/Sequence): Connection establish request (SYN): server port 22]
                [Connection establish request (SYN): server port 22]
                [Severity level: Chat]
                [Group: Sequence]
        .... .... ...0 = Fin: Not set
        [TCP Flags: ··········S·]
    Window: 29200
    [Calculated window size: 29200]
    Checksum: 0xea85 [unverified]
    [Checksum Status: Unverified]
    Urgent Pointer: 0
    Options: (20 bytes), Maximum segment size, SACK permitted, Timestamps, No-Operation (NOP), Window scale
        TCP Option - Maximum segment size: 1460 bytes
            Kind: Maximum Segment Size (2)
            Length: 4
            MSS Value: 1460
        TCP Option - SACK permitted
            Kind: SACK Permitted (4)
            Length: 2
        TCP Option - Timestamps: TSval 110853, TSecr 0
            Kind: Time Stamp Option (8)
            Length: 10
            Timestamp value: 110853
            Timestamp echo reply: 0
        TCP Option - No-Operation (NOP)
            Kind: No-Operation (1)
        TCP Option - Window scale: 7 (multiply by 128)
            Kind: Window Scale (3)
            Length: 3
            Shift count: 7
            [Multiplier: 128]
    [Timestamps]
        [Time since first frame in this TCP stream: 0.000000000 seconds]
        [Time since previous frame in this TCP stream: 0.000000000 seconds]

0000  08 00 27 57 5f a0 08 00 27 9f a5 ba 08 00 45 00   ..'W_...'.....E.
0010  00 3c 37 14 40 00 3f 06 99 53 0a 49 0e 05 0a 02   .<7.@.?..S.I....
0020  49 05 97 d6 00 16 b1 10 86 11 00 00 00 00 a0 02   I...............
0030  72 10 ea 85 00 00 02 04 05 b4 04 02 08 0a 00 01   r...............
0040  b1 05 00 00 00 00 01 03 03 07                     ..........

No.     Time           Source                Destination           Protocol Length Info
      2 0.000036852    10.2.73.5             10.73.14.5            TCP      74     22 → 38870 [SYN, ACK] Seq=0 Ack=1 Win=65160 Len=0 MSS=1460 SACK_PERM=1 TSval=366406610 TSecr=110853 WS=128

Frame 2: 74 bytes on wire (592 bits), 74 bytes captured (592 bits) on interface enp0s3, id 0
    Interface id: 0 (enp0s3)
        Interface name: enp0s3
    Encapsulation type: Ethernet (1)
    Arrival Time: Oct 26, 2022 13:43:12.038781276 EEST
    [Time shift for this packet: 0.000000000 seconds]
    Epoch Time: 1666780992.038781276 seconds
    [Time delta from previous captured frame: 0.000036852 seconds]
    [Time delta from previous displayed frame: 0.000036852 seconds]
    [Time since reference or first frame: 0.000036852 seconds]
    Frame Number: 2
    Frame Length: 74 bytes (592 bits)
    Capture Length: 74 bytes (592 bits)
    [Frame is marked: False]
    [Frame is ignored: False]
    [Protocols in frame: eth:ethertype:ip:tcp]
    [Coloring Rule Name: TCP SYN/FIN]
    [Coloring Rule String: tcp.flags & 0x02 || tcp.flags.fin == 1]
Ethernet II, Src: PcsCompu_57:5f:a0 (08:00:27:57:5f:a0), Dst: PcsCompu_9f:a5:ba (08:00:27:9f:a5:ba)
    Destination: PcsCompu_9f:a5:ba (08:00:27:9f:a5:ba)
        Address: PcsCompu_9f:a5:ba (08:00:27:9f:a5:ba)
        .... ..0. .... .... .... .... = LG bit: Globally unique address (factory default)
        .... ...0 .... .... .... .... = IG bit: Individual address (unicast)
    Source: PcsCompu_57:5f:a0 (08:00:27:57:5f:a0)
        Address: PcsCompu_57:5f:a0 (08:00:27:57:5f:a0)
        .... ..0. .... .... .... .... = LG bit: Globally unique address (factory default)
        .... ...0 .... .... .... .... = IG bit: Individual address (unicast)
    Type: IPv4 (0x0800)
Internet Protocol Version 4, Src: 10.2.73.5, Dst: 10.73.14.5
    0100 .... = Version: 4
    .... 0101 = Header Length: 20 bytes (5)
    Differentiated Services Field: 0x00 (DSCP: CS0, ECN: Not-ECT)
        0000 00.. = Differentiated Services Codepoint: Default (0)
        .... ..00 = Explicit Congestion Notification: Not ECN-Capable Transport (0)
    Total Length: 60
    Identification: 0x0000 (0)
    Flags: 0x40, Don't fragment
        0... .... = Reserved bit: Not set
        .1.. .... = Don't fragment: Set
        ..0. .... = More fragments: Not set
    ...0 0000 0000 0000 = Fragment Offset: 0
    Time to Live: 64
    Protocol: TCP (6)
    Header Checksum: 0xcf67 [validation disabled]
    [Header checksum status: Unverified]
    Source Address: 10.2.73.5
    Destination Address: 10.73.14.5
Transmission Control Protocol, Src Port: 22, Dst Port: 38870, Seq: 0, Ack: 1, Len: 0
    Source Port: 22
    Destination Port: 38870
    [Stream index: 0]
    [Conversation completeness: Incomplete, DATA (15)]
    [TCP Segment Len: 0]
    Sequence Number: 0    (relative sequence number)
    Sequence Number (raw): 4208680345
    [Next Sequence Number: 1    (relative sequence number)]
    Acknowledgment Number: 1    (relative ack number)
    Acknowledgment number (raw): 2970650130
    1010 .... = Header Length: 40 bytes (10)
    Flags: 0x012 (SYN, ACK)
        000. .... .... = Reserved: Not set
        ...0 .... .... = Nonce: Not set
        .... 0... .... = Congestion Window Reduced (CWR): Not set
        .... .0.. .... = ECN-Echo: Not set
        .... ..0. .... = Urgent: Not set
        .... ...1 .... = Acknowledgment: Set
        .... .... 0... = Push: Not set
        .... .... .0.. = Reset: Not set
        .... .... ..1. = Syn: Set
            [Expert Info (Chat/Sequence): Connection establish acknowledge (SYN+ACK): server port 22]
                [Connection establish acknowledge (SYN+ACK): server port 22]
                [Severity level: Chat]
                [Group: Sequence]
        .... .... ...0 = Fin: Not set
        [TCP Flags: ·······A··S·]
    Window: 65160
    [Calculated window size: 65160]
    Checksum: 0x6b83 [unverified]
    [Checksum Status: Unverified]
    Urgent Pointer: 0
    Options: (20 bytes), Maximum segment size, SACK permitted, Timestamps, No-Operation (NOP), Window scale
        TCP Option - Maximum segment size: 1460 bytes
            Kind: Maximum Segment Size (2)
            Length: 4
            MSS Value: 1460
        TCP Option - SACK permitted
            Kind: SACK Permitted (4)
            Length: 2
        TCP Option - Timestamps: TSval 366406610, TSecr 110853
            Kind: Time Stamp Option (8)
            Length: 10
            Timestamp value: 366406610
            Timestamp echo reply: 110853
        TCP Option - No-Operation (NOP)
            Kind: No-Operation (1)
        TCP Option - Window scale: 7 (multiply by 128)
            Kind: Window Scale (3)
            Length: 3
            Shift count: 7
            [Multiplier: 128]
    [Timestamps]
        [Time since first frame in this TCP stream: 0.000036852 seconds]
        [Time since previous frame in this TCP stream: 0.000036852 seconds]
    [SEQ/ACK analysis]
        [This is an ACK to the segment in frame: 1]
        [The RTT to ACK the segment was: 0.000036852 seconds]
        [iRTT: 0.000381139 seconds]

0000  08 00 27 9f a5 ba 08 00 27 57 5f a0 08 00 45 00   ..'.....'W_...E.
0010  00 3c 00 00 40 00 40 06 cf 67 0a 02 49 05 0a 49   .<..@.@..g..I..I
0020  0e 05 00 16 97 d6 fa db 5d 99 b1 10 86 12 a0 12   ........].......
0030  fe 88 6b 83 00 00 02 04 05 b4 04 02 08 0a 15 d6   ..k.............
0040  eb d2 00 01 b1 05 01 03 03 07                     ..........

No.     Time           Source                Destination           Protocol Length Info
      3 0.000381139    10.73.14.5            10.2.73.5             TCP      66     38870 → 22 [ACK] Seq=1 Ack=1 Win=29312 Len=0 TSval=110853 TSecr=366406610

Frame 3: 66 bytes on wire (528 bits), 66 bytes captured (528 bits) on interface enp0s3, id 0
    Interface id: 0 (enp0s3)
        Interface name: enp0s3
    Encapsulation type: Ethernet (1)
    Arrival Time: Oct 26, 2022 13:43:12.039125563 EEST
    [Time shift for this packet: 0.000000000 seconds]
    Epoch Time: 1666780992.039125563 seconds
    [Time delta from previous captured frame: 0.000344287 seconds]
    [Time delta from previous displayed frame: 0.000344287 seconds]
    [Time since reference or first frame: 0.000381139 seconds]
    Frame Number: 3
    Frame Length: 66 bytes (528 bits)
    Capture Length: 66 bytes (528 bits)
    [Frame is marked: False]
    [Frame is ignored: False]
    [Protocols in frame: eth:ethertype:ip:tcp]
    [Coloring Rule Name: TCP]
    [Coloring Rule String: tcp]
Ethernet II, Src: PcsCompu_9f:a5:ba (08:00:27:9f:a5:ba), Dst: PcsCompu_57:5f:a0 (08:00:27:57:5f:a0)
    Destination: PcsCompu_57:5f:a0 (08:00:27:57:5f:a0)
        Address: PcsCompu_57:5f:a0 (08:00:27:57:5f:a0)
        .... ..0. .... .... .... .... = LG bit: Globally unique address (factory default)
        .... ...0 .... .... .... .... = IG bit: Individual address (unicast)
    Source: PcsCompu_9f:a5:ba (08:00:27:9f:a5:ba)
        Address: PcsCompu_9f:a5:ba (08:00:27:9f:a5:ba)
        .... ..0. .... .... .... .... = LG bit: Globally unique address (factory default)
        .... ...0 .... .... .... .... = IG bit: Individual address (unicast)
    Type: IPv4 (0x0800)
Internet Protocol Version 4, Src: 10.73.14.5, Dst: 10.2.73.5
    0100 .... = Version: 4
    .... 0101 = Header Length: 20 bytes (5)
    Differentiated Services Field: 0x00 (DSCP: CS0, ECN: Not-ECT)
        0000 00.. = Differentiated Services Codepoint: Default (0)
        .... ..00 = Explicit Congestion Notification: Not ECN-Capable Transport (0)
    Total Length: 52
    Identification: 0x3715 (14101)
    Flags: 0x40, Don't fragment
        0... .... = Reserved bit: Not set
        .1.. .... = Don't fragment: Set
        ..0. .... = More fragments: Not set
    ...0 0000 0000 0000 = Fragment Offset: 0
    Time to Live: 63
    Protocol: TCP (6)
    Header Checksum: 0x995a [validation disabled]
    [Header checksum status: Unverified]
    Source Address: 10.73.14.5
    Destination Address: 10.2.73.5
Transmission Control Protocol, Src Port: 38870, Dst Port: 22, Seq: 1, Ack: 1, Len: 0
    Source Port: 38870
    Destination Port: 22
    [Stream index: 0]
    [Conversation completeness: Incomplete, DATA (15)]
    [TCP Segment Len: 0]
    Sequence Number: 1    (relative sequence number)
    Sequence Number (raw): 2970650130
    [Next Sequence Number: 1    (relative sequence number)]
    Acknowledgment Number: 1    (relative ack number)
    Acknowledgment number (raw): 4208680346
    1000 .... = Header Length: 32 bytes (8)
    Flags: 0x010 (ACK)
        000. .... .... = Reserved: Not set
        ...0 .... .... = Nonce: Not set
        .... 0... .... = Congestion Window Reduced (CWR): Not set
        .... .0.. .... = ECN-Echo: Not set
        .... ..0. .... = Urgent: Not set
        .... ...1 .... = Acknowledgment: Set
        .... .... 0... = Push: Not set
        .... .... .0.. = Reset: Not set
        .... .... ..0. = Syn: Not set
        .... .... ...0 = Fin: Not set
        [TCP Flags: ·······A····]
    Window: 229
    [Calculated window size: 29312]
    [Window size scaling factor: 128]
    Checksum: 0x304e [unverified]
    [Checksum Status: Unverified]
    Urgent Pointer: 0
    Options: (12 bytes), No-Operation (NOP), No-Operation (NOP), Timestamps
        TCP Option - No-Operation (NOP)
            Kind: No-Operation (1)
        TCP Option - No-Operation (NOP)
            Kind: No-Operation (1)
        TCP Option - Timestamps: TSval 110853, TSecr 366406610
            Kind: Time Stamp Option (8)
            Length: 10
            Timestamp value: 110853
            Timestamp echo reply: 366406610
    [Timestamps]
        [Time since first frame in this TCP stream: 0.000381139 seconds]
        [Time since previous frame in this TCP stream: 0.000344287 seconds]
    [SEQ/ACK analysis]
        [This is an ACK to the segment in frame: 2]
        [The RTT to ACK the segment was: 0.000344287 seconds]
        [iRTT: 0.000381139 seconds]

0000  08 00 27 57 5f a0 08 00 27 9f a5 ba 08 00 45 00   ..'W_...'.....E.
0010  00 34 37 15 40 00 3f 06 99 5a 0a 49 0e 05 0a 02   .47.@.?..Z.I....
0020  49 05 97 d6 00 16 b1 10 86 12 fa db 5d 9a 80 10   I...........]...
0030  00 e5 30 4e 00 00 01 01 08 0a 00 01 b1 05 15 d6   ..0N............
0040  eb d2                                             ..

No.     Time           Source                Destination           Protocol Length Info
      4 0.000973300    10.73.14.5            10.2.73.5             SSHv2    87     Client: Protocol (SSH-2.0-OpenSSH_7.4)

Frame 4: 87 bytes on wire (696 bits), 87 bytes captured (696 bits) on interface enp0s3, id 0
    Interface id: 0 (enp0s3)
        Interface name: enp0s3
    Encapsulation type: Ethernet (1)
    Arrival Time: Oct 26, 2022 13:43:12.039717724 EEST
    [Time shift for this packet: 0.000000000 seconds]
    Epoch Time: 1666780992.039717724 seconds
    [Time delta from previous captured frame: 0.000592161 seconds]
    [Time delta from previous displayed frame: 0.000592161 seconds]
    [Time since reference or first frame: 0.000973300 seconds]
    Frame Number: 4
    Frame Length: 87 bytes (696 bits)
    Capture Length: 87 bytes (696 bits)
    [Frame is marked: False]
    [Frame is ignored: False]
    [Protocols in frame: eth:ethertype:ip:tcp:ssh]
    [Coloring Rule Name: TCP]
    [Coloring Rule String: tcp]
Ethernet II, Src: PcsCompu_9f:a5:ba (08:00:27:9f:a5:ba), Dst: PcsCompu_57:5f:a0 (08:00:27:57:5f:a0)
    Destination: PcsCompu_57:5f:a0 (08:00:27:57:5f:a0)
        Address: PcsCompu_57:5f:a0 (08:00:27:57:5f:a0)
        .... ..0. .... .... .... .... = LG bit: Globally unique address (factory default)
        .... ...0 .... .... .... .... = IG bit: Individual address (unicast)
    Source: PcsCompu_9f:a5:ba (08:00:27:9f:a5:ba)
        Address: PcsCompu_9f:a5:ba (08:00:27:9f:a5:ba)
        .... ..0. .... .... .... .... = LG bit: Globally unique address (factory default)
        .... ...0 .... .... .... .... = IG bit: Individual address (unicast)
    Type: IPv4 (0x0800)
Internet Protocol Version 4, Src: 10.73.14.5, Dst: 10.2.73.5
    0100 .... = Version: 4
    .... 0101 = Header Length: 20 bytes (5)
    Differentiated Services Field: 0x00 (DSCP: CS0, ECN: Not-ECT)
        0000 00.. = Differentiated Services Codepoint: Default (0)
        .... ..00 = Explicit Congestion Notification: Not ECN-Capable Transport (0)
    Total Length: 73
    Identification: 0x3716 (14102)
    Flags: 0x40, Don't fragment
        0... .... = Reserved bit: Not set
        .1.. .... = Don't fragment: Set
        ..0. .... = More fragments: Not set
    ...0 0000 0000 0000 = Fragment Offset: 0
    Time to Live: 63
    Protocol: TCP (6)
    Header Checksum: 0x9944 [validation disabled]
    [Header checksum status: Unverified]
    Source Address: 10.73.14.5
    Destination Address: 10.2.73.5
Transmission Control Protocol, Src Port: 38870, Dst Port: 22, Seq: 1, Ack: 1, Len: 21
    Source Port: 38870
    Destination Port: 22
    [Stream index: 0]
    [Conversation completeness: Incomplete, DATA (15)]
    [TCP Segment Len: 21]
    Sequence Number: 1    (relative sequence number)
    Sequence Number (raw): 2970650130
    [Next Sequence Number: 22    (relative sequence number)]
    Acknowledgment Number: 1    (relative ack number)
    Acknowledgment number (raw): 4208680346
    1000 .... = Header Length: 32 bytes (8)
    Flags: 0x018 (PSH, ACK)
        000. .... .... = Reserved: Not set
        ...0 .... .... = Nonce: Not set
        .... 0... .... = Congestion Window Reduced (CWR): Not set
        .... .0.. .... = ECN-Echo: Not set
        .... ..0. .... = Urgent: Not set
        .... ...1 .... = Acknowledgment: Set
        .... .... 1... = Push: Set
        .... .... .0.. = Reset: Not set
        .... .... ..0. = Syn: Not set
        .... .... ...0 = Fin: Not set
        [TCP Flags: ·······AP···]
    Window: 229
    [Calculated window size: 29312]
    [Window size scaling factor: 128]
    Checksum: 0x6c88 [unverified]
    [Checksum Status: Unverified]
    Urgent Pointer: 0
    Options: (12 bytes), No-Operation (NOP), No-Operation (NOP), Timestamps
        TCP Option - No-Operation (NOP)
            Kind: No-Operation (1)
        TCP Option - No-Operation (NOP)
            Kind: No-Operation (1)
        TCP Option - Timestamps: TSval 110853, TSecr 366406610
            Kind: Time Stamp Option (8)
            Length: 10
            Timestamp value: 110853
            Timestamp echo reply: 366406610
    [Timestamps]
        [Time since first frame in this TCP stream: 0.000973300 seconds]
        [Time since previous frame in this TCP stream: 0.000592161 seconds]
    [SEQ/ACK analysis]
        [iRTT: 0.000381139 seconds]
        [Bytes in flight: 21]
        [Bytes sent since last PSH flag: 21]
    TCP payload (21 bytes)
SSH Protocol
    Protocol: SSH-2.0-OpenSSH_7.4
    [Direction: client-to-server]

0000  08 00 27 57 5f a0 08 00 27 9f a5 ba 08 00 45 00   ..'W_...'.....E.
0010  00 49 37 16 40 00 3f 06 99 44 0a 49 0e 05 0a 02   .I7.@.?..D.I....
0020  49 05 97 d6 00 16 b1 10 86 12 fa db 5d 9a 80 18   I...........]...
0030  00 e5 6c 88 00 00 01 01 08 0a 00 01 b1 05 15 d6   ..l.............
0040  eb d2 53 53 48 2d 32 2e 30 2d 4f 70 65 6e 53 53   ..SSH-2.0-OpenSS
0050  48 5f 37 2e 34 0d 0a                              H_7.4..

No.     Time           Source                Destination           Protocol Length Info
      5 0.000985613    10.2.73.5             10.73.14.5            TCP      66     22 → 38870 [ACK] Seq=1 Ack=22 Win=65152 Len=0 TSval=366406611 TSecr=110853

Frame 5: 66 bytes on wire (528 bits), 66 bytes captured (528 bits) on interface enp0s3, id 0
    Interface id: 0 (enp0s3)
        Interface name: enp0s3
    Encapsulation type: Ethernet (1)
    Arrival Time: Oct 26, 2022 13:43:12.039730037 EEST
    [Time shift for this packet: 0.000000000 seconds]
    Epoch Time: 1666780992.039730037 seconds
    [Time delta from previous captured frame: 0.000012313 seconds]
    [Time delta from previous displayed frame: 0.000012313 seconds]
    [Time since reference or first frame: 0.000985613 seconds]
    Frame Number: 5
    Frame Length: 66 bytes (528 bits)
    Capture Length: 66 bytes (528 bits)
    [Frame is marked: False]
    [Frame is ignored: False]
    [Protocols in frame: eth:ethertype:ip:tcp]
    [Coloring Rule Name: TCP]
    [Coloring Rule String: tcp]
Ethernet II, Src: PcsCompu_57:5f:a0 (08:00:27:57:5f:a0), Dst: PcsCompu_9f:a5:ba (08:00:27:9f:a5:ba)
    Destination: PcsCompu_9f:a5:ba (08:00:27:9f:a5:ba)
        Address: PcsCompu_9f:a5:ba (08:00:27:9f:a5:ba)
        .... ..0. .... .... .... .... = LG bit: Globally unique address (factory default)
        .... ...0 .... .... .... .... = IG bit: Individual address (unicast)
    Source: PcsCompu_57:5f:a0 (08:00:27:57:5f:a0)
        Address: PcsCompu_57:5f:a0 (08:00:27:57:5f:a0)
        .... ..0. .... .... .... .... = LG bit: Globally unique address (factory default)
        .... ...0 .... .... .... .... = IG bit: Individual address (unicast)
    Type: IPv4 (0x0800)
Internet Protocol Version 4, Src: 10.2.73.5, Dst: 10.73.14.5
    0100 .... = Version: 4
    .... 0101 = Header Length: 20 bytes (5)
    Differentiated Services Field: 0x00 (DSCP: CS0, ECN: Not-ECT)
        0000 00.. = Differentiated Services Codepoint: Default (0)
        .... ..00 = Explicit Congestion Notification: Not ECN-Capable Transport (0)
    Total Length: 52
    Identification: 0x1a8d (6797)
    Flags: 0x40, Don't fragment
        0... .... = Reserved bit: Not set
        .1.. .... = Don't fragment: Set
        ..0. .... = More fragments: Not set
    ...0 0000 0000 0000 = Fragment Offset: 0
    Time to Live: 64
    Protocol: TCP (6)
    Header Checksum: 0xb4e2 [validation disabled]
    [Header checksum status: Unverified]
    Source Address: 10.2.73.5
    Destination Address: 10.73.14.5
Transmission Control Protocol, Src Port: 22, Dst Port: 38870, Seq: 1, Ack: 22, Len: 0
    Source Port: 22
    Destination Port: 38870
    [Stream index: 0]
    [Conversation completeness: Incomplete, DATA (15)]
    [TCP Segment Len: 0]
    Sequence Number: 1    (relative sequence number)
    Sequence Number (raw): 4208680346
    [Next Sequence Number: 1    (relative sequence number)]
    Acknowledgment Number: 22    (relative ack number)
    Acknowledgment number (raw): 2970650151
    1000 .... = Header Length: 32 bytes (8)
    Flags: 0x010 (ACK)
        000. .... .... = Reserved: Not set
        ...0 .... .... = Nonce: Not set
        .... 0... .... = Congestion Window Reduced (CWR): Not set
        .... .0.. .... = ECN-Echo: Not set
        .... ..0. .... = Urgent: Not set
        .... ...1 .... = Acknowledgment: Set
        .... .... 0... = Push: Not set
        .... .... .0.. = Reset: Not set
        .... .... ..0. = Syn: Not set
        .... .... ...0 = Fin: Not set
        [TCP Flags: ·······A····]
    Window: 509
    [Calculated window size: 65152]
    [Window size scaling factor: 128]
    Checksum: 0x6b7b [unverified]
    [Checksum Status: Unverified]
    Urgent Pointer: 0
    Options: (12 bytes), No-Operation (NOP), No-Operation (NOP), Timestamps
        TCP Option - No-Operation (NOP)
            Kind: No-Operation (1)
        TCP Option - No-Operation (NOP)
            Kind: No-Operation (1)
        TCP Option - Timestamps: TSval 366406611, TSecr 110853
            Kind: Time Stamp Option (8)
            Length: 10
            Timestamp value: 366406611
            Timestamp echo reply: 110853
    [Timestamps]
        [Time since first frame in this TCP stream: 0.000985613 seconds]
        [Time since previous frame in this TCP stream: 0.000012313 seconds]
    [SEQ/ACK analysis]
        [This is an ACK to the segment in frame: 4]
        [The RTT to ACK the segment was: 0.000012313 seconds]
        [iRTT: 0.000381139 seconds]

0000  08 00 27 9f a5 ba 08 00 27 57 5f a0 08 00 45 00   ..'.....'W_...E.
0010  00 34 1a 8d 40 00 40 06 b4 e2 0a 02 49 05 0a 49   .4..@.@.....I..I
0020  0e 05 00 16 97 d6 fa db 5d 9a b1 10 86 27 80 10   ........]....'..
0030  01 fd 6b 7b 00 00 01 01 08 0a 15 d6 eb d3 00 01   ..k{............
0040  b1 05                                             ..

No.     Time           Source                Destination           Protocol Length Info
      6 0.080983312    10.2.73.5             10.73.14.5            SSHv2    98     Server: Protocol (SSH-2.0-OpenSSH_8.9p1 Ubuntu-3)

Frame 6: 98 bytes on wire (784 bits), 98 bytes captured (784 bits) on interface enp0s3, id 0
    Interface id: 0 (enp0s3)
        Interface name: enp0s3
    Encapsulation type: Ethernet (1)
    Arrival Time: Oct 26, 2022 13:43:12.119727736 EEST
    [Time shift for this packet: 0.000000000 seconds]
    Epoch Time: 1666780992.119727736 seconds
    [Time delta from previous captured frame: 0.079997699 seconds]
    [Time delta from previous displayed frame: 0.079997699 seconds]
    [Time since reference or first frame: 0.080983312 seconds]
    Frame Number: 6
    Frame Length: 98 bytes (784 bits)
    Capture Length: 98 bytes (784 bits)
    [Frame is marked: False]
    [Frame is ignored: False]
    [Protocols in frame: eth:ethertype:ip:tcp:ssh]
    [Coloring Rule Name: TCP]
    [Coloring Rule String: tcp]
Ethernet II, Src: PcsCompu_57:5f:a0 (08:00:27:57:5f:a0), Dst: PcsCompu_9f:a5:ba (08:00:27:9f:a5:ba)
    Destination: PcsCompu_9f:a5:ba (08:00:27:9f:a5:ba)
        Address: PcsCompu_9f:a5:ba (08:00:27:9f:a5:ba)
        .... ..0. .... .... .... .... = LG bit: Globally unique address (factory default)
        .... ...0 .... .... .... .... = IG bit: Individual address (unicast)
    Source: PcsCompu_57:5f:a0 (08:00:27:57:5f:a0)
        Address: PcsCompu_57:5f:a0 (08:00:27:57:5f:a0)
        .... ..0. .... .... .... .... = LG bit: Globally unique address (factory default)
        .... ...0 .... .... .... .... = IG bit: Individual address (unicast)
    Type: IPv4 (0x0800)
Internet Protocol Version 4, Src: 10.2.73.5, Dst: 10.73.14.5
    0100 .... = Version: 4
    .... 0101 = Header Length: 20 bytes (5)
    Differentiated Services Field: 0x00 (DSCP: CS0, ECN: Not-ECT)
        0000 00.. = Differentiated Services Codepoint: Default (0)
        .... ..00 = Explicit Congestion Notification: Not ECN-Capable Transport (0)
    Total Length: 84
    Identification: 0x1a8e (6798)
    Flags: 0x40, Don't fragment
        0... .... = Reserved bit: Not set
        .1.. .... = Don't fragment: Set
        ..0. .... = More fragments: Not set
    ...0 0000 0000 0000 = Fragment Offset: 0
    Time to Live: 64
    Protocol: TCP (6)
    Header Checksum: 0xb4c1 [validation disabled]
    [Header checksum status: Unverified]
    Source Address: 10.2.73.5
    Destination Address: 10.73.14.5
Transmission Control Protocol, Src Port: 22, Dst Port: 38870, Seq: 1, Ack: 22, Len: 32
    Source Port: 22
    Destination Port: 38870
    [Stream index: 0]
    [Conversation completeness: Incomplete, DATA (15)]
    [TCP Segment Len: 32]
    Sequence Number: 1    (relative sequence number)
    Sequence Number (raw): 4208680346
    [Next Sequence Number: 33    (relative sequence number)]
    Acknowledgment Number: 22    (relative ack number)
    Acknowledgment number (raw): 2970650151
    1000 .... = Header Length: 32 bytes (8)
    Flags: 0x018 (PSH, ACK)
        000. .... .... = Reserved: Not set
        ...0 .... .... = Nonce: Not set
        .... 0... .... = Congestion Window Reduced (CWR): Not set
        .... .0.. .... = ECN-Echo: Not set
        .... ..0. .... = Urgent: Not set
        .... ...1 .... = Acknowledgment: Set
        .... .... 1... = Push: Set
        .... .... .0.. = Reset: Not set
        .... .... ..0. = Syn: Not set
        .... .... ...0 = Fin: Not set
        [TCP Flags: ·······AP···]
    Window: 509
    [Calculated window size: 65152]
    [Window size scaling factor: 128]
    Checksum: 0x6b9b [unverified]
    [Checksum Status: Unverified]
    Urgent Pointer: 0
    Options: (12 bytes), No-Operation (NOP), No-Operation (NOP), Timestamps
        TCP Option - No-Operation (NOP)
            Kind: No-Operation (1)
        TCP Option - No-Operation (NOP)
            Kind: No-Operation (1)
        TCP Option - Timestamps: TSval 366406691, TSecr 110853
            Kind: Time Stamp Option (8)
            Length: 10
            Timestamp value: 366406691
            Timestamp echo reply: 110853
    [Timestamps]
        [Time since first frame in this TCP stream: 0.080983312 seconds]
        [Time since previous frame in this TCP stream: 0.079997699 seconds]
    [SEQ/ACK analysis]
        [iRTT: 0.000381139 seconds]
        [Bytes in flight: 32]
        [Bytes sent since last PSH flag: 32]
    TCP payload (32 bytes)
SSH Protocol
    Protocol: SSH-2.0-OpenSSH_8.9p1 Ubuntu-3
    [Direction: server-to-client]

0000  08 00 27 9f a5 ba 08 00 27 57 5f a0 08 00 45 00   ..'.....'W_...E.
0010  00 54 1a 8e 40 00 40 06 b4 c1 0a 02 49 05 0a 49   .T..@.@.....I..I
0020  0e 05 00 16 97 d6 fa db 5d 9a b1 10 86 27 80 18   ........]....'..
0030  01 fd 6b 9b 00 00 01 01 08 0a 15 d6 ec 23 00 01   ..k..........#..
0040  b1 05 53 53 48 2d 32 2e 30 2d 4f 70 65 6e 53 53   ..SSH-2.0-OpenSS
0050  48 5f 38 2e 39 70 31 20 55 62 75 6e 74 75 2d 33   H_8.9p1 Ubuntu-3
0060  0d 0a                                             ..

No.     Time           Source                Destination           Protocol Length Info
      7 0.081662960    10.73.14.5            10.2.73.5             TCP      66     38870 → 22 [ACK] Seq=22 Ack=33 Win=29312 Len=0 TSval=110934 TSecr=366406691

Frame 7: 66 bytes on wire (528 bits), 66 bytes captured (528 bits) on interface enp0s3, id 0
    Interface id: 0 (enp0s3)
        Interface name: enp0s3
    Encapsulation type: Ethernet (1)
    Arrival Time: Oct 26, 2022 13:43:12.120407384 EEST
    [Time shift for this packet: 0.000000000 seconds]
    Epoch Time: 1666780992.120407384 seconds
    [Time delta from previous captured frame: 0.000679648 seconds]
    [Time delta from previous displayed frame: 0.000679648 seconds]
    [Time since reference or first frame: 0.081662960 seconds]
    Frame Number: 7
    Frame Length: 66 bytes (528 bits)
    Capture Length: 66 bytes (528 bits)
    [Frame is marked: False]
    [Frame is ignored: False]
    [Protocols in frame: eth:ethertype:ip:tcp]
    [Coloring Rule Name: TCP]
    [Coloring Rule String: tcp]
Ethernet II, Src: PcsCompu_9f:a5:ba (08:00:27:9f:a5:ba), Dst: PcsCompu_57:5f:a0 (08:00:27:57:5f:a0)
    Destination: PcsCompu_57:5f:a0 (08:00:27:57:5f:a0)
        Address: PcsCompu_57:5f:a0 (08:00:27:57:5f:a0)
        .... ..0. .... .... .... .... = LG bit: Globally unique address (factory default)
        .... ...0 .... .... .... .... = IG bit: Individual address (unicast)
    Source: PcsCompu_9f:a5:ba (08:00:27:9f:a5:ba)
        Address: PcsCompu_9f:a5:ba (08:00:27:9f:a5:ba)
        .... ..0. .... .... .... .... = LG bit: Globally unique address (factory default)
        .... ...0 .... .... .... .... = IG bit: Individual address (unicast)
    Type: IPv4 (0x0800)
Internet Protocol Version 4, Src: 10.73.14.5, Dst: 10.2.73.5
    0100 .... = Version: 4
    .... 0101 = Header Length: 20 bytes (5)
    Differentiated Services Field: 0x00 (DSCP: CS0, ECN: Not-ECT)
        0000 00.. = Differentiated Services Codepoint: Default (0)
        .... ..00 = Explicit Congestion Notification: Not ECN-Capable Transport (0)
    Total Length: 52
    Identification: 0x3717 (14103)
    Flags: 0x40, Don't fragment
        0... .... = Reserved bit: Not set
        .1.. .... = Don't fragment: Set
        ..0. .... = More fragments: Not set
    ...0 0000 0000 0000 = Fragment Offset: 0
    Time to Live: 63
    Protocol: TCP (6)
    Header Checksum: 0x9958 [validation disabled]
    [Header checksum status: Unverified]
    Source Address: 10.73.14.5
    Destination Address: 10.2.73.5
Transmission Control Protocol, Src Port: 38870, Dst Port: 22, Seq: 22, Ack: 33, Len: 0
    Source Port: 38870
    Destination Port: 22
    [Stream index: 0]
    [Conversation completeness: Incomplete, DATA (15)]
    [TCP Segment Len: 0]
    Sequence Number: 22    (relative sequence number)
    Sequence Number (raw): 2970650151
    [Next Sequence Number: 22    (relative sequence number)]
    Acknowledgment Number: 33    (relative ack number)
    Acknowledgment number (raw): 4208680378
    1000 .... = Header Length: 32 bytes (8)
    Flags: 0x010 (ACK)
        000. .... .... = Reserved: Not set
        ...0 .... .... = Nonce: Not set
        .... 0... .... = Congestion Window Reduced (CWR): Not set
        .... .0.. .... = ECN-Echo: Not set
        .... ..0. .... = Urgent: Not set
        .... ...1 .... = Acknowledgment: Set
        .... .... 0... = Push: Not set
        .... .... .0.. = Reset: Not set
        .... .... ..0. = Syn: Not set
        .... .... ...0 = Fin: Not set
        [TCP Flags: ·······A····]
    Window: 229
    [Calculated window size: 29312]
    [Window size scaling factor: 128]
    Checksum: 0x2f77 [unverified]
    [Checksum Status: Unverified]
    Urgent Pointer: 0
    Options: (12 bytes), No-Operation (NOP), No-Operation (NOP), Timestamps
        TCP Option - No-Operation (NOP)
            Kind: No-Operation (1)
        TCP Option - No-Operation (NOP)
            Kind: No-Operation (1)
        TCP Option - Timestamps: TSval 110934, TSecr 366406691
            Kind: Time Stamp Option (8)
            Length: 10
            Timestamp value: 110934
            Timestamp echo reply: 366406691
    [Timestamps]
        [Time since first frame in this TCP stream: 0.081662960 seconds]
        [Time since previous frame in this TCP stream: 0.000679648 seconds]
    [SEQ/ACK analysis]
        [This is an ACK to the segment in frame: 6]
        [The RTT to ACK the segment was: 0.000679648 seconds]
        [iRTT: 0.000381139 seconds]

0000  08 00 27 57 5f a0 08 00 27 9f a5 ba 08 00 45 00   ..'W_...'.....E.
0010  00 34 37 17 40 00 3f 06 99 58 0a 49 0e 05 0a 02   .47.@.?..X.I....
0020  49 05 97 d6 00 16 b1 10 86 27 fa db 5d ba 80 10   I........'..]...
0030  00 e5 2f 77 00 00 01 01 08 0a 00 01 b1 56 15 d6   ../w.........V..
0040  ec 23                                             .#

No.     Time           Source                Destination           Protocol Length Info
      8 0.082556628    10.73.14.5            10.2.73.5             SSHv2    1562   Client: Key Exchange Init

Frame 8: 1562 bytes on wire (12496 bits), 1562 bytes captured (12496 bits) on interface enp0s3, id 0
    Interface id: 0 (enp0s3)
        Interface name: enp0s3
    Encapsulation type: Ethernet (1)
    Arrival Time: Oct 26, 2022 13:43:12.121301052 EEST
    [Time shift for this packet: 0.000000000 seconds]
    Epoch Time: 1666780992.121301052 seconds
    [Time delta from previous captured frame: 0.000893668 seconds]
    [Time delta from previous displayed frame: 0.000893668 seconds]
    [Time since reference or first frame: 0.082556628 seconds]
    Frame Number: 8
    Frame Length: 1562 bytes (12496 bits)
    Capture Length: 1562 bytes (12496 bits)
    [Frame is marked: False]
    [Frame is ignored: False]
    [Protocols in frame: eth:ethertype:ip:tcp:ssh]
    [Coloring Rule Name: TCP]
    [Coloring Rule String: tcp]
Ethernet II, Src: PcsCompu_9f:a5:ba (08:00:27:9f:a5:ba), Dst: PcsCompu_57:5f:a0 (08:00:27:57:5f:a0)
    Destination: PcsCompu_57:5f:a0 (08:00:27:57:5f:a0)
        Address: PcsCompu_57:5f:a0 (08:00:27:57:5f:a0)
        .... ..0. .... .... .... .... = LG bit: Globally unique address (factory default)
        .... ...0 .... .... .... .... = IG bit: Individual address (unicast)
    Source: PcsCompu_9f:a5:ba (08:00:27:9f:a5:ba)
        Address: PcsCompu_9f:a5:ba (08:00:27:9f:a5:ba)
        .... ..0. .... .... .... .... = LG bit: Globally unique address (factory default)
        .... ...0 .... .... .... .... = IG bit: Individual address (unicast)
    Type: IPv4 (0x0800)
Internet Protocol Version 4, Src: 10.73.14.5, Dst: 10.2.73.5
    0100 .... = Version: 4
    .... 0101 = Header Length: 20 bytes (5)
    Differentiated Services Field: 0x00 (DSCP: CS0, ECN: Not-ECT)
        0000 00.. = Differentiated Services Codepoint: Default (0)
        .... ..00 = Explicit Congestion Notification: Not ECN-Capable Transport (0)
    Total Length: 1548
    Identification: 0x3718 (14104)
    Flags: 0x40, Don't fragment
        0... .... = Reserved bit: Not set
        .1.. .... = Don't fragment: Set
        ..0. .... = More fragments: Not set
    ...0 0000 0000 0000 = Fragment Offset: 0
    Time to Live: 63
    Protocol: TCP (6)
    Header Checksum: 0x937f [validation disabled]
    [Header checksum status: Unverified]
    Source Address: 10.73.14.5
    Destination Address: 10.2.73.5
Transmission Control Protocol, Src Port: 38870, Dst Port: 22, Seq: 22, Ack: 33, Len: 1496
    Source Port: 38870
    Destination Port: 22
    [Stream index: 0]
    [Conversation completeness: Incomplete, DATA (15)]
    [TCP Segment Len: 1496]
    Sequence Number: 22    (relative sequence number)
    Sequence Number (raw): 2970650151
    [Next Sequence Number: 1518    (relative sequence number)]
    Acknowledgment Number: 33    (relative ack number)
    Acknowledgment number (raw): 4208680378
    1000 .... = Header Length: 32 bytes (8)
    Flags: 0x018 (PSH, ACK)
        000. .... .... = Reserved: Not set
        ...0 .... .... = Nonce: Not set
        .... 0... .... = Congestion Window Reduced (CWR): Not set
        .... .0.. .... = ECN-Echo: Not set
        .... ..0. .... = Urgent: Not set
        .... ...1 .... = Acknowledgment: Set
        .... .... 1... = Push: Set
        .... .... .0.. = Reset: Not set
        .... .... ..0. = Syn: Not set
        .... .... ...0 = Fin: Not set
        [TCP Flags: ·······AP···]
    Window: 229
    [Calculated window size: 29312]
    [Window size scaling factor: 128]
    Checksum: 0x7153 [unverified]
    [Checksum Status: Unverified]
    Urgent Pointer: 0
    Options: (12 bytes), No-Operation (NOP), No-Operation (NOP), Timestamps
        TCP Option - No-Operation (NOP)
            Kind: No-Operation (1)
        TCP Option - No-Operation (NOP)
            Kind: No-Operation (1)
        TCP Option - Timestamps: TSval 110935, TSecr 366406691
            Kind: Time Stamp Option (8)
            Length: 10
            Timestamp value: 110935
            Timestamp echo reply: 366406691
    [Timestamps]
        [Time since first frame in this TCP stream: 0.082556628 seconds]
        [Time since previous frame in this TCP stream: 0.000893668 seconds]
    [SEQ/ACK analysis]
        [iRTT: 0.000381139 seconds]
        [Bytes in flight: 1496]
        [Bytes sent since last PSH flag: 1496]
    TCP payload (1496 bytes)
SSH Protocol
    SSH Version 2 (encryption:chacha20-poly1305@openssh.com mac:<implicit> compression:none)
