No.     Time           Source                Destination           Protocol Length Info
      1 0.000000000    10.2.73.5             10.73.14.5            TCP      74     57064 > ssh [SYN] Seq=0 Win=64240 Len=0 MSS=1460 SACK_PERM=1 TSval=368421471 TSecr=0 WS=128

Frame 1: 74 bytes on wire (592 bits), 74 bytes captured (592 bits) on interface 0
    Interface id: 0
    Encapsulation type: Ethernet (1)
    Arrival Time: Oct 26, 2022 14:16:21.541372885 MSK
    [Time shift for this packet: 0.000000000 seconds]
    Epoch Time: 1666782981.541372885 seconds
    [Time delta from previous captured frame: 0.000000000 seconds]
    [Time delta from previous displayed frame: 0.000000000 seconds]
    [Time since reference or first frame: 0.000000000 seconds]
    Frame Number: 1
    Frame Length: 74 bytes (592 bits)
    Capture Length: 74 bytes (592 bits)
    [Frame is marked: False]
    [Frame is ignored: False]
    [Protocols in frame: eth:ip:tcp]
    [Coloring Rule Name: TCP SYN/FIN]
    [Coloring Rule String: tcp.flags & 0x02 || tcp.flags.fin == 1]
Ethernet II, Src: CadmusCo_62:0e:57 (08:00:27:62:0e:57), Dst: CadmusCo_41:0f:d0 (08:00:27:41:0f:d0)
    Destination: CadmusCo_41:0f:d0 (08:00:27:41:0f:d0)
        Address: CadmusCo_41:0f:d0 (08:00:27:41:0f:d0)
        .... ..0. .... .... .... .... = LG bit: Globally unique address (factory default)
        .... ...0 .... .... .... .... = IG bit: Individual address (unicast)
    Source: CadmusCo_62:0e:57 (08:00:27:62:0e:57)
        Address: CadmusCo_62:0e:57 (08:00:27:62:0e:57)
        .... ..0. .... .... .... .... = LG bit: Globally unique address (factory default)
        .... ...0 .... .... .... .... = IG bit: Individual address (unicast)
    Type: IP (0x0800)
Internet Protocol Version 4, Src: 10.2.73.5 (10.2.73.5), Dst: 10.73.14.5 (10.73.14.5)
    Version: 4
    Header length: 20 bytes
    Differentiated Services Field: 0x10 (DSCP 0x04: Unknown DSCP; ECN: 0x00: Not-ECT (Not ECN-Capable Transport))
        0001 00.. = Differentiated Services Codepoint: Unknown (0x04)
        .... ..00 = Explicit Congestion Notification: Not-ECT (Not ECN-Capable Transport) (0x00)
    Total Length: 60
    Identification: 0x46c5 (18117)
    Flags: 0x02 (Don't Fragment)
        0... .... = Reserved bit: Not set
        .1.. .... = Don't fragment: Set
        ..0. .... = More fragments: Not set
    Fragment offset: 0
    Time to live: 63
    Protocol: TCP (6)
    Header checksum: 0x8992 [validation disabled]
        [Good: False]
        [Bad: False]
    Source: 10.2.73.5 (10.2.73.5)
    Destination: 10.73.14.5 (10.73.14.5)
Transmission Control Protocol, Src Port: 57064 (57064), Dst Port: ssh (22), Seq: 0, Len: 0
    Source port: 57064 (57064)
    Destination port: ssh (22)
    [Stream index: 0]
    Sequence number: 0    (relative sequence number)
    Header length: 40 bytes
    Flags: 0x002 (SYN)
        000. .... .... = Reserved: Not set
        ...0 .... .... = Nonce: Not set
        .... 0... .... = Congestion Window Reduced (CWR): Not set
        .... .0.. .... = ECN-Echo: Not set
        .... ..0. .... = Urgent: Not set
        .... ...0 .... = Acknowledgment: Not set
        .... .... 0... = Push: Not set
        .... .... .0.. = Reset: Not set
        .... .... ..1. = Syn: Set
            [Expert Info (Chat/Sequence): Connection establish request (SYN): server port ssh]
                [Message: Connection establish request (SYN): server port ssh]
                [Severity level: Chat]
                [Group: Sequence]
        .... .... ...0 = Fin: Not set
    Window size value: 64240
    [Calculated window size: 64240]
    Checksum: 0x3db0 [validation disabled]
        [Good Checksum: False]
        [Bad Checksum: False]
    Options: (20 bytes), Maximum segment size, SACK permitted, Timestamps, No-Operation (NOP), Window scale
        Maximum segment size: 1460 bytes
            Kind: MSS size (2)
            Length: 4
            MSS Value: 1460
        TCP SACK Permitted Option: True
            Kind: SACK Permission (4)
            Length: 2
        Timestamps: TSval 368421471, TSecr 0
            Kind: Timestamp (8)
            Length: 10
            Timestamp value: 368421471
            Timestamp echo reply: 0
        No-Operation (NOP)
            Type: 1
                0... .... = Copy on fragmentation: No
                .00. .... = Class: Control (0)
                ...0 0001 = Number: No-Operation (NOP) (1)
        Window scale: 7 (multiply by 128)
            Kind: Window Scale (3)
            Length: 3
            Shift count: 7
            [Multiplier: 128]

0000  08 00 27 41 0f d0 08 00 27 62 0e 57 08 00 45 10   ..'A....'b.W..E.
0010  00 3c 46 c5 40 00 3f 06 89 92 0a 02 49 05 0a 49   .<F.@.?.....I..I
0020  0e 05 de e8 00 16 b7 d9 4c dd 00 00 00 00 a0 02   ........L.......
0030  fa f0 3d b0 00 00 02 04 05 b4 04 02 08 0a 15 f5   ..=.............
0040  aa 5f 00 00 00 00 01 03 03 07                     ._........
No.     Time           Source                Destination           Protocol Length Info
      2 0.000117977    10.73.14.5            10.2.73.5             TCP      74     ssh > 57064 [SYN, ACK] Seq=0 Ack=1 Win=28960 Len=0 MSS=1460 SACK_PERM=1 TSval=2125703 TSecr=368421471 WS=128

Frame 2: 74 bytes on wire (592 bits), 74 bytes captured (592 bits) on interface 0
    Interface id: 0
    Encapsulation type: Ethernet (1)
    Arrival Time: Oct 26, 2022 14:16:21.541490862 MSK
    [Time shift for this packet: 0.000000000 seconds]
    Epoch Time: 1666782981.541490862 seconds
    [Time delta from previous captured frame: 0.000117977 seconds]
    [Time delta from previous displayed frame: 0.000117977 seconds]
    [Time since reference or first frame: 0.000117977 seconds]
    Frame Number: 2
    Frame Length: 74 bytes (592 bits)
    Capture Length: 74 bytes (592 bits)
    [Frame is marked: False]
    [Frame is ignored: False]
    [Protocols in frame: eth:ip:tcp]
    [Coloring Rule Name: TCP SYN/FIN]
    [Coloring Rule String: tcp.flags & 0x02 || tcp.flags.fin == 1]
Ethernet II, Src: CadmusCo_41:0f:d0 (08:00:27:41:0f:d0), Dst: CadmusCo_62:0e:57 (08:00:27:62:0e:57)
    Destination: CadmusCo_62:0e:57 (08:00:27:62:0e:57)
        Address: CadmusCo_62:0e:57 (08:00:27:62:0e:57)
        .... ..0. .... .... .... .... = LG bit: Globally unique address (factory default)
        .... ...0 .... .... .... .... = IG bit: Individual address (unicast)
    Source: CadmusCo_41:0f:d0 (08:00:27:41:0f:d0)
        Address: CadmusCo_41:0f:d0 (08:00:27:41:0f:d0)
        .... ..0. .... .... .... .... = LG bit: Globally unique address (factory default)
        .... ...0 .... .... .... .... = IG bit: Individual address (unicast)
    Type: IP (0x0800)
Internet Protocol Version 4, Src: 10.73.14.5 (10.73.14.5), Dst: 10.2.73.5 (10.2.73.5)
    Version: 4
    Header length: 20 bytes
    Differentiated Services Field: 0x00 (DSCP 0x00: Default; ECN: 0x00: Not-ECT (Not ECN-Capable Transport))
        0000 00.. = Differentiated Services Codepoint: Default (0x00)
        .... ..00 = Explicit Congestion Notification: Not-ECT (Not ECN-Capable Transport) (0x00)
    Total Length: 60
    Identification: 0x0000 (0)
    Flags: 0x02 (Don't Fragment)
        0... .... = Reserved bit: Not set
        .1.. .... = Don't fragment: Set
        ..0. .... = More fragments: Not set
    Fragment offset: 0
    Time to live: 64
    Protocol: TCP (6)
    Header checksum: 0xcf67 [validation disabled]
        [Good: False]
        [Bad: False]
    Source: 10.73.14.5 (10.73.14.5)
    Destination: 10.2.73.5 (10.2.73.5)
Transmission Control Protocol, Src Port: ssh (22), Dst Port: 57064 (57064), Seq: 0, Ack: 1, Len: 0
    Source port: ssh (22)
    Destination port: 57064 (57064)
    [Stream index: 0]
    Sequence number: 0    (relative sequence number)
    Acknowledgment number: 1    (relative ack number)
    Header length: 40 bytes
    Flags: 0x012 (SYN, ACK)
        000. .... .... = Reserved: Not set
        ...0 .... .... = Nonce: Not set
        .... 0... .... = Congestion Window Reduced (CWR): Not set
        .... .0.. .... = ECN-Echo: Not set
        .... ..0. .... = Urgent: Not set
        .... ...1 .... = Acknowledgment: Set
        .... .... 0... = Push: Not set
        .... .... .0.. = Reset: Not set
        .... .... ..1. = Syn: Set
            [Expert Info (Chat/Sequence): Connection establish acknowledge (SYN+ACK): server port ssh]
                [Message: Connection establish acknowledge (SYN+ACK): server port ssh]
                [Severity level: Chat]
                [Group: Sequence]
        .... .... ...0 = Fin: Not set
    Window size value: 28960
    [Calculated window size: 28960]
    Checksum: 0x6b83 [validation disabled]
        [Good Checksum: False]
        [Bad Checksum: False]
    Options: (20 bytes), Maximum segment size, SACK permitted, Timestamps, No-Operation (NOP), Window scale
        Maximum segment size: 1460 bytes
            Kind: MSS size (2)
            Length: 4
            MSS Value: 1460
        TCP SACK Permitted Option: True
            Kind: SACK Permission (4)
            Length: 2
        Timestamps: TSval 2125703, TSecr 368421471
            Kind: Timestamp (8)
            Length: 10
            Timestamp value: 2125703
            Timestamp echo reply: 368421471
        No-Operation (NOP)
            Type: 1
                0... .... = Copy on fragmentation: No
                .00. .... = Class: Control (0)
                ...0 0001 = Number: No-Operation (NOP) (1)
        Window scale: 7 (multiply by 128)
            Kind: Window Scale (3)
            Length: 3
            Shift count: 7
            [Multiplier: 128]
    [SEQ/ACK analysis]
        [This is an ACK to the segment in frame: 1]
        [The RTT to ACK the segment was: 0.000117977 seconds]

0000  08 00 27 62 0e 57 08 00 27 41 0f d0 08 00 45 00   ..'b.W..'A....E.
0010  00 3c 00 00 40 00 40 06 cf 67 0a 49 0e 05 0a 02   .<..@.@..g.I....
0020  49 05 00 16 de e8 d9 66 f3 56 b7 d9 4c de a0 12   I......f.V..L...
0030  71 20 6b 83 00 00 02 04 05 b4 04 02 08 0a 00 20   q k............ 
0040  6f 87 15 f5 aa 5f 01 03 03 07                     o...._....
No.     Time           Source                Destination           Protocol Length Info
      3 0.000584970    10.2.73.5             10.73.14.5            TCP      66     57064 > ssh [ACK] Seq=1 Ack=1 Win=64256 Len=0 TSval=368421471 TSecr=2125703

Frame 3: 66 bytes on wire (528 bits), 66 bytes captured (528 bits) on interface 0
    Interface id: 0
    Encapsulation type: Ethernet (1)
    Arrival Time: Oct 26, 2022 14:16:21.541957855 MSK
    [Time shift for this packet: 0.000000000 seconds]
    Epoch Time: 1666782981.541957855 seconds
    [Time delta from previous captured frame: 0.000466993 seconds]
    [Time delta from previous displayed frame: 0.000466993 seconds]
    [Time since reference or first frame: 0.000584970 seconds]
    Frame Number: 3
    Frame Length: 66 bytes (528 bits)
    Capture Length: 66 bytes (528 bits)
    [Frame is marked: False]
    [Frame is ignored: False]
    [Protocols in frame: eth:ip:tcp]
    [Coloring Rule Name: TCP]
    [Coloring Rule String: tcp]
Ethernet II, Src: CadmusCo_62:0e:57 (08:00:27:62:0e:57), Dst: CadmusCo_41:0f:d0 (08:00:27:41:0f:d0)
    Destination: CadmusCo_41:0f:d0 (08:00:27:41:0f:d0)
        Address: CadmusCo_41:0f:d0 (08:00:27:41:0f:d0)
        .... ..0. .... .... .... .... = LG bit: Globally unique address (factory default)
        .... ...0 .... .... .... .... = IG bit: Individual address (unicast)
    Source: CadmusCo_62:0e:57 (08:00:27:62:0e:57)
        Address: CadmusCo_62:0e:57 (08:00:27:62:0e:57)
        .... ..0. .... .... .... .... = LG bit: Globally unique address (factory default)
        .... ...0 .... .... .... .... = IG bit: Individual address (unicast)
    Type: IP (0x0800)
Internet Protocol Version 4, Src: 10.2.73.5 (10.2.73.5), Dst: 10.73.14.5 (10.73.14.5)
    Version: 4
    Header length: 20 bytes
    Differentiated Services Field: 0x10 (DSCP 0x04: Unknown DSCP; ECN: 0x00: Not-ECT (Not ECN-Capable Transport))
        0001 00.. = Differentiated Services Codepoint: Unknown (0x04)
        .... ..00 = Explicit Congestion Notification: Not-ECT (Not ECN-Capable Transport) (0x00)
    Total Length: 52
    Identification: 0x46c6 (18118)
    Flags: 0x02 (Don't Fragment)
        0... .... = Reserved bit: Not set
        .1.. .... = Don't fragment: Set
        ..0. .... = More fragments: Not set
    Fragment offset: 0
    Time to live: 63
    Protocol: TCP (6)
    Header checksum: 0x8999 [validation disabled]
        [Good: False]
        [Bad: False]
    Source: 10.2.73.5 (10.2.73.5)
    Destination: 10.73.14.5 (10.73.14.5)
Transmission Control Protocol, Src Port: 57064 (57064), Dst Port: ssh (22), Seq: 1, Ack: 1, Len: 0
    Source port: 57064 (57064)
    Destination port: ssh (22)
    [Stream index: 0]
    Sequence number: 1    (relative sequence number)
    Acknowledgment number: 1    (relative ack number)
    Header length: 32 bytes
    Flags: 0x010 (ACK)
        000. .... .... = Reserved: Not set
        ...0 .... .... = Nonce: Not set
        .... 0... .... = Congestion Window Reduced (CWR): Not set
        .... .0.. .... = ECN-Echo: Not set
        .... ..0. .... = Urgent: Not set
        .... ...1 .... = Acknowledgment: Set
        .... .... 0... = Push: Not set
        .... .... .0.. = Reset: Not set
        .... .... ..0. = Syn: Not set
        .... .... ...0 = Fin: Not set
    Window size value: 502
    [Calculated window size: 64256]
    [Window size scaling factor: 128]
    Checksum: 0x2901 [validation disabled]
        [Good Checksum: False]
        [Bad Checksum: False]
    Options: (12 bytes), No-Operation (NOP), No-Operation (NOP), Timestamps
        No-Operation (NOP)
            Type: 1
                0... .... = Copy on fragmentation: No
                .00. .... = Class: Control (0)
                ...0 0001 = Number: No-Operation (NOP) (1)
        No-Operation (NOP)
            Type: 1
                0... .... = Copy on fragmentation: No
                .00. .... = Class: Control (0)
                ...0 0001 = Number: No-Operation (NOP) (1)
        Timestamps: TSval 368421471, TSecr 2125703
            Kind: Timestamp (8)
            Length: 10
            Timestamp value: 368421471
            Timestamp echo reply: 2125703
    [SEQ/ACK analysis]
        [This is an ACK to the segment in frame: 2]
        [The RTT to ACK the segment was: 0.000466993 seconds]

0000  08 00 27 41 0f d0 08 00 27 62 0e 57 08 00 45 10   ..'A....'b.W..E.
0010  00 34 46 c6 40 00 3f 06 89 99 0a 02 49 05 0a 49   .4F.@.?.....I..I
0020  0e 05 de e8 00 16 b7 d9 4c de d9 66 f3 57 80 10   ........L..f.W..
0030  01 f6 29 01 00 00 01 01 08 0a 15 f5 aa 5f 00 20   ..).........._. 
0040  6f 87                                             o.
No.     Time           Source                Destination           Protocol Length Info
      4 0.001261114    10.2.73.5             10.73.14.5            SSHv2    98     Encrypted request packet len=32

Frame 4: 98 bytes on wire (784 bits), 98 bytes captured (784 bits) on interface 0
    Interface id: 0
    Encapsulation type: Ethernet (1)
    Arrival Time: Oct 26, 2022 14:16:21.542633999 MSK
    [Time shift for this packet: 0.000000000 seconds]
    Epoch Time: 1666782981.542633999 seconds
    [Time delta from previous captured frame: 0.000676144 seconds]
    [Time delta from previous displayed frame: 0.000676144 seconds]
    [Time since reference or first frame: 0.001261114 seconds]
    Frame Number: 4
    Frame Length: 98 bytes (784 bits)
    Capture Length: 98 bytes (784 bits)
    [Frame is marked: False]
    [Frame is ignored: False]
    [Protocols in frame: eth:ip:tcp:ssh]
    [Coloring Rule Name: TCP]
    [Coloring Rule String: tcp]
Ethernet II, Src: CadmusCo_62:0e:57 (08:00:27:62:0e:57), Dst: CadmusCo_41:0f:d0 (08:00:27:41:0f:d0)
    Destination: CadmusCo_41:0f:d0 (08:00:27:41:0f:d0)
        Address: CadmusCo_41:0f:d0 (08:00:27:41:0f:d0)
        .... ..0. .... .... .... .... = LG bit: Globally unique address (factory default)
        .... ...0 .... .... .... .... = IG bit: Individual address (unicast)
    Source: CadmusCo_62:0e:57 (08:00:27:62:0e:57)
        Address: CadmusCo_62:0e:57 (08:00:27:62:0e:57)
        .... ..0. .... .... .... .... = LG bit: Globally unique address (factory default)
        .... ...0 .... .... .... .... = IG bit: Individual address (unicast)
    Type: IP (0x0800)
Internet Protocol Version 4, Src: 10.2.73.5 (10.2.73.5), Dst: 10.73.14.5 (10.73.14.5)
    Version: 4
    Header length: 20 bytes
    Differentiated Services Field: 0x10 (DSCP 0x04: Unknown DSCP; ECN: 0x00: Not-ECT (Not ECN-Capable Transport))
        0001 00.. = Differentiated Services Codepoint: Unknown (0x04)
        .... ..00 = Explicit Congestion Notification: Not-ECT (Not ECN-Capable Transport) (0x00)
    Total Length: 84
    Identification: 0x46c7 (18119)
    Flags: 0x02 (Don't Fragment)
        0... .... = Reserved bit: Not set
        .1.. .... = Don't fragment: Set
        ..0. .... = More fragments: Not set
    Fragment offset: 0
    Time to live: 63
    Protocol: TCP (6)
    Header checksum: 0x8978 [validation disabled]
        [Good: False]
        [Bad: False]
    Source: 10.2.73.5 (10.2.73.5)
    Destination: 10.73.14.5 (10.73.14.5)
Transmission Control Protocol, Src Port: 57064 (57064), Dst Port: ssh (22), Seq: 1, Ack: 1, Len: 32
    Source port: 57064 (57064)
    Destination port: ssh (22)
    [Stream index: 0]
    Sequence number: 1    (relative sequence number)
    [Next sequence number: 33    (relative sequence number)]
    Acknowledgment number: 1    (relative ack number)
    Header length: 32 bytes
    Flags: 0x018 (PSH, ACK)
        000. .... .... = Reserved: Not set
        ...0 .... .... = Nonce: Not set
        .... 0... .... = Congestion Window Reduced (CWR): Not set
        .... .0.. .... = ECN-Echo: Not set
        .... ..0. .... = Urgent: Not set
        .... ...1 .... = Acknowledgment: Set
        .... .... 1... = Push: Set
        .... .... .0.. = Reset: Not set
        .... .... ..0. = Syn: Not set
        .... .... ...0 = Fin: Not set
    Window size value: 502
    [Calculated window size: 64256]
    [Window size scaling factor: 128]
    Checksum: 0xbe28 [validation disabled]
        [Good Checksum: False]
        [Bad Checksum: False]
    Options: (12 bytes), No-Operation (NOP), No-Operation (NOP), Timestamps
        No-Operation (NOP)
            Type: 1
                0... .... = Copy on fragmentation: No
                .00. .... = Class: Control (0)
                ...0 0001 = Number: No-Operation (NOP) (1)
        No-Operation (NOP)
            Type: 1
                0... .... = Copy on fragmentation: No
                .00. .... = Class: Control (0)
                ...0 0001 = Number: No-Operation (NOP) (1)
        Timestamps: TSval 368421472, TSecr 2125703
            Kind: Timestamp (8)
            Length: 10
            Timestamp value: 368421472
            Timestamp echo reply: 2125703
    [SEQ/ACK analysis]
        [Bytes in flight: 32]
SSH Protocol
    SSH Version 2 (encryption:chacha20-poly1305@openssh.com mac:umac-64-etm@openssh.com compression:none)
        Encrypted Packet: 5353482d322e302d4f70656e5353485f382e397031205562...

0000  08 00 27 41 0f d0 08 00 27 62 0e 57 08 00 45 10   ..'A....'b.W..E.
0010  00 54 46 c7 40 00 3f 06 89 78 0a 02 49 05 0a 49   .TF.@.?..x..I..I
0020  0e 05 de e8 00 16 b7 d9 4c de d9 66 f3 57 80 18   ........L..f.W..
0030  01 f6 be 28 00 00 01 01 08 0a 15 f5 aa 60 00 20   ...(.........`. 
0040  6f 87 53 53 48 2d 32 2e 30 2d 4f 70 65 6e 53 53   o.SSH-2.0-OpenSS
0050  48 5f 38 2e 39 70 31 20 55 62 75 6e 74 75 2d 33   H_8.9p1 Ubuntu-3
0060  0d 0a                                             ..
No.     Time           Source                Destination           Protocol Length Info
      5 0.001305461    10.73.14.5            10.2.73.5             TCP      66     ssh > 57064 [ACK] Seq=1 Ack=33 Win=29056 Len=0 TSval=2125705 TSecr=368421472

Frame 5: 66 bytes on wire (528 bits), 66 bytes captured (528 bits) on interface 0
    Interface id: 0
    Encapsulation type: Ethernet (1)
    Arrival Time: Oct 26, 2022 14:16:21.542678346 MSK
    [Time shift for this packet: 0.000000000 seconds]
    Epoch Time: 1666782981.542678346 seconds
    [Time delta from previous captured frame: 0.000044347 seconds]
    [Time delta from previous displayed frame: 0.000044347 seconds]
    [Time since reference or first frame: 0.001305461 seconds]
    Frame Number: 5
    Frame Length: 66 bytes (528 bits)
    Capture Length: 66 bytes (528 bits)
    [Frame is marked: False]
    [Frame is ignored: False]
    [Protocols in frame: eth:ip:tcp]
    [Coloring Rule Name: TCP]
    [Coloring Rule String: tcp]
Ethernet II, Src: CadmusCo_41:0f:d0 (08:00:27:41:0f:d0), Dst: CadmusCo_62:0e:57 (08:00:27:62:0e:57)
    Destination: CadmusCo_62:0e:57 (08:00:27:62:0e:57)
        Address: CadmusCo_62:0e:57 (08:00:27:62:0e:57)
        .... ..0. .... .... .... .... = LG bit: Globally unique address (factory default)
        .... ...0 .... .... .... .... = IG bit: Individual address (unicast)
    Source: CadmusCo_41:0f:d0 (08:00:27:41:0f:d0)
        Address: CadmusCo_41:0f:d0 (08:00:27:41:0f:d0)
        .... ..0. .... .... .... .... = LG bit: Globally unique address (factory default)
        .... ...0 .... .... .... .... = IG bit: Individual address (unicast)
    Type: IP (0x0800)
Internet Protocol Version 4, Src: 10.73.14.5 (10.73.14.5), Dst: 10.2.73.5 (10.2.73.5)
    Version: 4
    Header length: 20 bytes
    Differentiated Services Field: 0x00 (DSCP 0x00: Default; ECN: 0x00: Not-ECT (Not ECN-Capable Transport))
        0000 00.. = Differentiated Services Codepoint: Default (0x00)
        .... ..00 = Explicit Congestion Notification: Not-ECT (Not ECN-Capable Transport) (0x00)
    Total Length: 52
    Identification: 0x9cdf (40159)
    Flags: 0x02 (Don't Fragment)
        0... .... = Reserved bit: Not set
        .1.. .... = Don't fragment: Set
        ..0. .... = More fragments: Not set
    Fragment offset: 0
    Time to live: 64
    Protocol: TCP (6)
    Header checksum: 0x3290 [validation disabled]
        [Good: False]
        [Bad: False]
    Source: 10.73.14.5 (10.73.14.5)
    Destination: 10.2.73.5 (10.2.73.5)
Transmission Control Protocol, Src Port: ssh (22), Dst Port: 57064 (57064), Seq: 1, Ack: 33, Len: 0
    Source port: ssh (22)
    Destination port: 57064 (57064)
    [Stream index: 0]
    Sequence number: 1    (relative sequence number)
    Acknowledgment number: 33    (relative ack number)
    Header length: 32 bytes
    Flags: 0x010 (ACK)
        000. .... .... = Reserved: Not set
        ...0 .... .... = Nonce: Not set
        .... 0... .... = Congestion Window Reduced (CWR): Not set
        .... .0.. .... = ECN-Echo: Not set
        .... ..0. .... = Urgent: Not set
        .... ...1 .... = Acknowledgment: Set
        .... .... 0... = Push: Not set
        .... .... .0.. = Reset: Not set
        .... .... ..0. = Syn: Not set
        .... .... ...0 = Fin: Not set
    Window size value: 227
    [Calculated window size: 29056]
    [Window size scaling factor: 128]
    Checksum: 0x6b7b [validation disabled]
        [Good Checksum: False]
        [Bad Checksum: False]
    Options: (12 bytes), No-Operation (NOP), No-Operation (NOP), Timestamps
        No-Operation (NOP)
            Type: 1
                0... .... = Copy on fragmentation: No
                .00. .... = Class: Control (0)
                ...0 0001 = Number: No-Operation (NOP) (1)
        No-Operation (NOP)
            Type: 1
                0... .... = Copy on fragmentation: No
                .00. .... = Class: Control (0)
                ...0 0001 = Number: No-Operation (NOP) (1)
        Timestamps: TSval 2125705, TSecr 368421472
            Kind: Timestamp (8)
            Length: 10
            Timestamp value: 2125705
            Timestamp echo reply: 368421472
    [SEQ/ACK analysis]
        [This is an ACK to the segment in frame: 4]
        [The RTT to ACK the segment was: 0.000044347 seconds]

0000  08 00 27 62 0e 57 08 00 27 41 0f d0 08 00 45 00   ..'b.W..'A....E.
0010  00 34 9c df 40 00 40 06 32 90 0a 49 0e 05 0a 02   .4..@.@.2..I....
0020  49 05 00 16 de e8 d9 66 f3 57 b7 d9 4c fe 80 10   I......f.W..L...
0030  00 e3 6b 7b 00 00 01 01 08 0a 00 20 6f 89 15 f5   ..k{....... o...
0040  aa 60                                             .`
No.     Time           Source                Destination           Protocol Length Info
      6 0.432415900    10.73.14.5            10.2.73.5             SSHv2    87     Encrypted response packet len=21

Frame 6: 87 bytes on wire (696 bits), 87 bytes captured (696 bits) on interface 0
    Interface id: 0
    Encapsulation type: Ethernet (1)
    Arrival Time: Oct 26, 2022 14:16:21.973788785 MSK
    [Time shift for this packet: 0.000000000 seconds]
    Epoch Time: 1666782981.973788785 seconds
    [Time delta from previous captured frame: 0.431110439 seconds]
    [Time delta from previous displayed frame: 0.431110439 seconds]
    [Time since reference or first frame: 0.432415900 seconds]
    Frame Number: 6
    Frame Length: 87 bytes (696 bits)
    Capture Length: 87 bytes (696 bits)
    [Frame is marked: False]
    [Frame is ignored: False]
    [Protocols in frame: eth:ip:tcp:ssh]
    [Coloring Rule Name: TCP]
    [Coloring Rule String: tcp]
Ethernet II, Src: CadmusCo_41:0f:d0 (08:00:27:41:0f:d0), Dst: CadmusCo_62:0e:57 (08:00:27:62:0e:57)
    Destination: CadmusCo_62:0e:57 (08:00:27:62:0e:57)
        Address: CadmusCo_62:0e:57 (08:00:27:62:0e:57)
        .... ..0. .... .... .... .... = LG bit: Globally unique address (factory default)
        .... ...0 .... .... .... .... = IG bit: Individual address (unicast)
    Source: CadmusCo_41:0f:d0 (08:00:27:41:0f:d0)
        Address: CadmusCo_41:0f:d0 (08:00:27:41:0f:d0)
        .... ..0. .... .... .... .... = LG bit: Globally unique address (factory default)
        .... ...0 .... .... .... .... = IG bit: Individual address (unicast)
    Type: IP (0x0800)
Internet Protocol Version 4, Src: 10.73.14.5 (10.73.14.5), Dst: 10.2.73.5 (10.2.73.5)
    Version: 4
    Header length: 20 bytes
    Differentiated Services Field: 0x00 (DSCP 0x00: Default; ECN: 0x00: Not-ECT (Not ECN-Capable Transport))
        0000 00.. = Differentiated Services Codepoint: Default (0x00)
        .... ..00 = Explicit Congestion Notification: Not-ECT (Not ECN-Capable Transport) (0x00)
    Total Length: 73
    Identification: 0x9ce0 (40160)
    Flags: 0x02 (Don't Fragment)
        0... .... = Reserved bit: Not set
        .1.. .... = Don't fragment: Set
        ..0. .... = More fragments: Not set
    Fragment offset: 0
    Time to live: 64
    Protocol: TCP (6)
    Header checksum: 0x327a [validation disabled]
        [Good: False]
        [Bad: False]
    Source: 10.73.14.5 (10.73.14.5)
    Destination: 10.2.73.5 (10.2.73.5)
Transmission Control Protocol, Src Port: ssh (22), Dst Port: 57064 (57064), Seq: 1, Ack: 33, Len: 21
    Source port: ssh (22)
    Destination port: 57064 (57064)
    [Stream index: 0]
    Sequence number: 1    (relative sequence number)
    [Next sequence number: 22    (relative sequence number)]
    Acknowledgment number: 33    (relative ack number)
    Header length: 32 bytes
    Flags: 0x018 (PSH, ACK)
        000. .... .... = Reserved: Not set
        ...0 .... .... = Nonce: Not set
        .... 0... .... = Congestion Window Reduced (CWR): Not set
        .... .0.. .... = ECN-Echo: Not set
        .... ..0. .... = Urgent: Not set
        .... ...1 .... = Acknowledgment: Set
        .... .... 1... = Push: Set
        .... .... .0.. = Reset: Not set
        .... .... ..0. = Syn: Not set
        .... .... ...0 = Fin: Not set
    Window size value: 227
    [Calculated window size: 29056]
    [Window size scaling factor: 128]
    Checksum: 0x6b90 [validation disabled]
        [Good Checksum: False]
        [Bad Checksum: False]
    Options: (12 bytes), No-Operation (NOP), No-Operation (NOP), Timestamps
        No-Operation (NOP)
            Type: 1
                0... .... = Copy on fragmentation: No
                .00. .... = Class: Control (0)
                ...0 0001 = Number: No-Operation (NOP) (1)
        No-Operation (NOP)
            Type: 1
                0... .... = Copy on fragmentation: No
                .00. .... = Class: Control (0)
                ...0 0001 = Number: No-Operation (NOP) (1)
        Timestamps: TSval 2126136, TSecr 368421472
            Kind: Timestamp (8)
            Length: 10
            Timestamp value: 2126136
            Timestamp echo reply: 368421472
    [SEQ/ACK analysis]
        [Bytes in flight: 21]
SSH Protocol
    SSH Version 2 (encryption:chacha20-poly1305@openssh.com mac:umac-64-etm@openssh.com compression:none)
        Encrypted Packet: 5353482d322e302d4f70656e5353485f372e340d0a

0000  08 00 27 62 0e 57 08 00 27 41 0f d0 08 00 45 00   ..'b.W..'A....E.
0010  00 49 9c e0 40 00 40 06 32 7a 0a 49 0e 05 0a 02   .I..@.@.2z.I....
0020  49 05 00 16 de e8 d9 66 f3 57 b7 d9 4c fe 80 18   I......f.W..L...
0030  00 e3 6b 90 00 00 01 01 08 0a 00 20 71 38 15 f5   ..k........ q8..
0040  aa 60 53 53 48 2d 32 2e 30 2d 4f 70 65 6e 53 53   .`SSH-2.0-OpenSS
0050  48 5f 37 2e 34 0d 0a                              H_7.4..
No.     Time           Source                Destination           Protocol Length Info
      7 0.432907640    10.2.73.5             10.73.14.5            TCP      66     57064 > ssh [ACK] Seq=33 Ack=22 Win=64256 Len=0 TSval=368421904 TSecr=2126136

Frame 7: 66 bytes on wire (528 bits), 66 bytes captured (528 bits) on interface 0
    Interface id: 0
    Encapsulation type: Ethernet (1)
    Arrival Time: Oct 26, 2022 14:16:21.974280525 MSK
    [Time shift for this packet: 0.000000000 seconds]
    Epoch Time: 1666782981.974280525 seconds
    [Time delta from previous captured frame: 0.000491740 seconds]
    [Time delta from previous displayed frame: 0.000491740 seconds]
    [Time since reference or first frame: 0.432907640 seconds]
    Frame Number: 7
    Frame Length: 66 bytes (528 bits)
    Capture Length: 66 bytes (528 bits)
    [Frame is marked: False]
    [Frame is ignored: False]
    [Protocols in frame: eth:ip:tcp]
Ethernet II, Src: CadmusCo_62:0e:57 (08:00:27:62:0e:57), Dst: CadmusCo_41:0f:d0 (08:00:27:41:0f:d0)
    Destination: CadmusCo_41:0f:d0 (08:00:27:41:0f:d0)
        Address: CadmusCo_41:0f:d0 (08:00:27:41:0f:d0)
        .... ..0. .... .... .... .... = LG bit: Globally unique address (factory default)
        .... ...0 .... .... .... .... = IG bit: Individual address (unicast)
    Source: CadmusCo_62:0e:57 (08:00:27:62:0e:57)
        Address: CadmusCo_62:0e:57 (08:00:27:62:0e:57)
        .... ..0. .... .... .... .... = LG bit: Globally unique address (factory default)
        .... ...0 .... .... .... .... = IG bit: Individual address (unicast)
    Type: IP (0x0800)
Internet Protocol Version 4, Src: 10.2.73.5 (10.2.73.5), Dst: 10.73.14.5 (10.73.14.5)
    Version: 4
    Header length: 20 bytes
    Differentiated Services Field: 0x10 (DSCP 0x04: Unknown DSCP; ECN: 0x00: Not-ECT (Not ECN-Capable Transport))
        0001 00.. = Differentiated Services Codepoint: Unknown (0x04)
        .... ..00 = Explicit Congestion Notification: Not-ECT (Not ECN-Capable Transport) (0x00)
    Total Length: 52
    Identification: 0x46c8 (18120)
    Flags: 0x02 (Don't Fragment)
        0... .... = Reserved bit: Not set
        .1.. .... = Don't fragment: Set
        ..0. .... = More fragments: Not set
    Fragment offset: 0
    Time to live: 63
    Protocol: TCP (6)
    Header checksum: 0x8997 [validation disabled]
        [Good: False]
        [Bad: False]
    Source: 10.2.73.5 (10.2.73.5)
    Destination: 10.73.14.5 (10.73.14.5)
Transmission Control Protocol, Src Port: 57064 (57064), Dst Port: ssh (22), Seq: 33, Ack: 22, Len: 0
    Source port: 57064 (57064)
    Destination port: ssh (22)
    [Stream index: 0]
    Sequence number: 33    (relative sequence number)
    Acknowledgment number: 22    (relative ack number)
    Header length: 32 bytes
    Flags: 0x010 (ACK)
        000. .... .... = Reserved: Not set
        ...0 .... .... = Nonce: Not set
        .... 0... .... = Congestion Window Reduced (CWR): Not set
        .... .0.. .... = ECN-Echo: Not set
        .... ..0. .... = Urgent: Not set
        .... ...1 .... = Acknowledgment: Set
        .... .... 0... = Push: Not set
        .... .... .0.. = Reset: Not set
        .... .... ..0. = Syn: Not set
        .... .... ...0 = Fin: Not set
    Window size value: 502
    [Calculated window size: 64256]
    [Window size scaling factor: 128]
    Checksum: 0x256a [validation disabled]
        [Good Checksum: False]
        [Bad Checksum: False]
    Options: (12 bytes), No-Operation (NOP), No-Operation (NOP), Timestamps
        No-Operation (NOP)
            Type: 1
                0... .... = Copy on fragmentation: No
                .00. .... = Class: Control (0)
                ...0 0001 = Number: No-Operation (NOP) (1)
        No-Operation (NOP)
            Type: 1
                0... .... = Copy on fragmentation: No
                .00. .... = Class: Control (0)
                ...0 0001 = Number: No-Operation (NOP) (1)
        Timestamps: TSval 368421904, TSecr 2126136
            Kind: Timestamp (8)
            Length: 10
            Timestamp value: 368421904
            Timestamp echo reply: 2126136
    [SEQ/ACK analysis]
        [This is an ACK to the segment in frame: 6]
        [The RTT to ACK the segment was: 0.000491740 seconds]

0000  08 00 27 41 0f d0 08 00 27 62 0e 57 08 00 45 10   ..'A....'b.W..E.
0010  00 34 46 c8 40 00 3f 06 89 97 0a 02 49 05 0a 49   .4F.@.?.....I..I
0020  0e 05 de e8 00 16 b7 d9 4c fe d9 66 f3 6c 80 10   ........L..f.l..
0030  01 f6 25 6a 00 00 01 01 08 0a 15 f5 ac 10 00 20   ..%j........... 
0040  71 38                                             q8
No.     Time           Source                Destination           Protocol Length Info
      8 0.442736921    10.2.73.5             10.73.14.5            SSHv2    1570   Client: Key Exchange Init

Frame 8: 1570 bytes on wire (12560 bits), 1570 bytes captured (12560 bits) on interface 0
    Interface id: 0
    Encapsulation type: Ethernet (1)
    Arrival Time: Oct 26, 2022 14:16:21.984109806 MSK
    [Time shift for this packet: 0.000000000 seconds]
    Epoch Time: 1666782981.984109806 seconds
    [Time delta from previous captured frame: 0.009829281 seconds]
    [Time delta from previous displayed frame: 0.009829281 seconds]
    [Time since reference or first frame: 0.442736921 seconds]
    Frame Number: 8
    Frame Length: 1570 bytes (12560 bits)
    Capture Length: 1570 bytes (12560 bits)
    [Frame is marked: False]
    [Frame is ignored: False]
    [Protocols in frame: eth:ip:tcp:ssh]
Ethernet II, Src: CadmusCo_62:0e:57 (08:00:27:62:0e:57), Dst: CadmusCo_41:0f:d0 (08:00:27:41:0f:d0)
    Destination: CadmusCo_41:0f:d0 (08:00:27:41:0f:d0)
        Address: CadmusCo_41:0f:d0 (08:00:27:41:0f:d0)
        .... ..0. .... .... .... .... = LG bit: Globally unique address (factory default)
        .... ...0 .... .... .... .... = IG bit: Individual address (unicast)
    Source: CadmusCo_62:0e:57 (08:00:27:62:0e:57)
        Address: CadmusCo_62:0e:57 (08:00:27:62:0e:57)
        .... ..0. .... .... .... .... = LG bit: Globally unique address (factory default)
        .... ...0 .... .... .... .... = IG bit: Individual address (unicast)
    Type: IP (0x0800)
Internet Protocol Version 4, Src: 10.2.73.5 (10.2.73.5), Dst: 10.73.14.5 (10.73.14.5)
    Version: 4
    Header length: 20 bytes
    Differentiated Services Field: 0x10 (DSCP 0x04: Unknown DSCP; ECN: 0x00: Not-ECT (Not ECN-Capable Transport))
        0001 00.. = Differentiated Services Codepoint: Unknown (0x04)
        .... ..00 = Explicit Congestion Notification: Not-ECT (Not ECN-Capable Transport) (0x00)
    Total Length: 1556
    Identification: 0x46c9 (18121)
    Flags: 0x02 (Don't Fragment)
        0... .... = Reserved bit: Not set
        .1.. .... = Don't fragment: Set
        ..0. .... = More fragments: Not set
    Fragment offset: 0
    Time to live: 63
    Protocol: TCP (6)
    Header checksum: 0x83b6 [validation disabled]
        [Good: False]
        [Bad: False]
    Source: 10.2.73.5 (10.2.73.5)
    Destination: 10.73.14.5 (10.73.14.5)
Transmission Control Protocol, Src Port: 57064 (57064), Dst Port: ssh (22), Seq: 33, Ack: 22, Len: 1504
    Source port: 57064 (57064)
    Destination port: ssh (22)
    [Stream index: 0]
    Sequence number: 33    (relative sequence number)
    [Next sequence number: 1537    (relative sequence number)]
    Acknowledgment number: 22    (relative ack number)
    Header length: 32 bytes
    Flags: 0x018 (PSH, ACK)
        000. .... .... = Reserved: Not set
        ...0 .... .... = Nonce: Not set
        .... 0... .... = Congestion Window Reduced (CWR): Not set
        .... .0.. .... = ECN-Echo: Not set
        .... ..0. .... = Urgent: Not set
        .... ...1 .... = Acknowledgment: Set
        .... .... 1... = Push: Set
        .... .... .0.. = Reset: Not set
        .... .... ..0. = Syn: Not set
        .... .... ...0 = Fin: Not set
    Window size value: 502
    [Calculated window size: 64256]
    [Window size scaling factor: 128]
    Checksum: 0x715b [validation disabled]
        [Good Checksum: False]
        [Bad Checksum: False]
    Options: (12 bytes), No-Operation (NOP), No-Operation (NOP), Timestamps
        No-Operation (NOP)
            Type: 1
                0... .... = Copy on fragmentation: No
                .00. .... = Class: Control (0)
                ...0 0001 = Number: No-Operation (NOP) (1)
        No-Operation (NOP)
            Type: 1
                0... .... = Copy on fragmentation: No
                .00. .... = Class: Control (0)
                ...0 0001 = Number: No-Operation (NOP) (1)
        Timestamps: TSval 368421913, TSecr 2126136
            Kind: Timestamp (8)
            Length: 10
            Timestamp value: 368421913
            Timestamp echo reply: 2126136
    [SEQ/ACK analysis]
        [Bytes in flight: 1504]
SSH Protocol
    SSH Version 2 (encryption:chacha20-poly1305@openssh.com mac:umac-64-etm@openssh.com compression:none)
        Packet Length: 1500
        Padding Length: 4
        Key Exchange
            Message Code: Key Exchange Init (20)
            Algorithms
                Cookie: 930e42afbbf4a1955de2b0aeab43d389
                kex_algorithms length: 276
                kex_algorithms string [truncated]: curve25519-sha256,curve25519-sha256@libssh.org,ecdh-sha2-nistp256,ecdh-sha2-nistp384,ecdh-sha2-nistp521,sntrup761x25519-sha512@openssh.com,diffie-hellman-group-exchange-sha256,diffie-hellman-group16-sha51
                server_host_key_algorithms length: 463
                server_host_key_algorithms string [truncated]: ssh-ed25519-cert-v01@openssh.com,ecdsa-sha2-nistp256-cert-v01@openssh.com,ecdsa-sha2-nistp384-cert-v01@openssh.com,ecdsa-sha2-nistp521-cert-v01@openssh.com,sk-ssh-ed25519-cert-v01@openssh.com,
                encryption_algorithms_client_to_server length: 108
                encryption_algorithms_client_to_server string: chacha20-poly1305@openssh.com,aes128-ctr,aes192-ctr,aes256-ctr,aes128-gcm@openssh.com,aes256-gcm@openssh.com
                encryption_algorithms_server_to_client length: 108
                encryption_algorithms_server_to_client string: chacha20-poly1305@openssh.com,aes128-ctr,aes192-ctr,aes256-ctr,aes128-gcm@openssh.com,aes256-gcm@openssh.com
                mac_algorithms_client_to_server length: 213
                mac_algorithms_client_to_server string [truncated]: umac-64-etm@openssh.com,umac-128-etm@openssh.com,hmac-sha2-256-etm@openssh.com,hmac-sha2-512-etm@openssh.com,hmac-sha1-etm@openssh.com,umac-64@openssh.com,umac-128@openssh.com,hmac-sha2-2
                mac_algorithms_server_to_client length: 213
