No.     Time           Source                Destination           Protocol Length Info
      1 0.000000000    10.73.14.5            10.73.14.254          TCP      74     35588 > 7314 [SYN] Seq=0 Win=29200 Len=0 MSS=1460 SACK_PERM=1 TSval=199828 TSecr=0 WS=128

Frame 1: 74 bytes on wire (592 bits), 74 bytes captured (592 bits) on interface 0
    Interface id: 0
    Encapsulation type: Ethernet (1)
    Arrival Time: Oct 25, 2022 18:32:49.661144469 MSK
    [Time shift for this packet: 0.000000000 seconds]
    Epoch Time: 1666711969.661144469 seconds
    [Time delta from previous captured frame: 0.000000000 seconds]
    [Time delta from previous displayed frame: 0.000000000 seconds]
    [Time since reference or first frame: 0.000000000 seconds]
    Frame Number: 1
    Frame Length: 74 bytes (592 bits)
    Capture Length: 74 bytes (592 bits)
    [Frame is marked: False]
    [Frame is ignored: False]
    [Protocols in frame: eth:ip:tcp]
    [Coloring Rule Name: TCP SYN/FIN]
    [Coloring Rule String: tcp.flags & 0x02 || tcp.flags.fin == 1]
Ethernet II, Src: CadmusCo_41:0f:d0 (08:00:27:41:0f:d0), Dst: CadmusCo_62:0e:57 (08:00:27:62:0e:57)
    Destination: CadmusCo_62:0e:57 (08:00:27:62:0e:57)
        Address: CadmusCo_62:0e:57 (08:00:27:62:0e:57)
        .... ..0. .... .... .... .... = LG bit: Globally unique address (factory default)
        .... ...0 .... .... .... .... = IG bit: Individual address (unicast)
    Source: CadmusCo_41:0f:d0 (08:00:27:41:0f:d0)
        Address: CadmusCo_41:0f:d0 (08:00:27:41:0f:d0)
        .... ..0. .... .... .... .... = LG bit: Globally unique address (factory default)
        .... ...0 .... .... .... .... = IG bit: Individual address (unicast)
    Type: IP (0x0800)
Internet Protocol Version 4, Src: 10.73.14.5 (10.73.14.5), Dst: 10.73.14.254 (10.73.14.254)
    Version: 4
    Header length: 20 bytes
    Differentiated Services Field: 0x00 (DSCP 0x00: Default; ECN: 0x00: Not-ECT (Not ECN-Capable Transport))
        0000 00.. = Differentiated Services Codepoint: Default (0x00)
        .... ..00 = Explicit Congestion Notification: Not-ECT (Not ECN-Capable Transport) (0x00)
    Total Length: 60
    Identification: 0x3e63 (15971)
    Flags: 0x02 (Don't Fragment)
        0... .... = Reserved bit: Not set
        .1.. .... = Don't fragment: Set
        ..0. .... = More fragments: Not set
    Fragment offset: 0
    Time to live: 64
    Protocol: TCP (6)
    Header checksum: 0xcac4 [validation disabled]
        [Good: False]
        [Bad: False]
    Source: 10.73.14.5 (10.73.14.5)
    Destination: 10.73.14.254 (10.73.14.254)
Transmission Control Protocol, Src Port: 35588 (35588), Dst Port: 7314 (7314), Seq: 0, Len: 0
    Source port: 35588 (35588)
    Destination port: 7314 (7314)
    [Stream index: 0]
    Sequence number: 0    (relative sequence number)
    Header length: 40 bytes
    Flags: 0x002 (SYN)
        000. .... .... = Reserved: Not set
        ...0 .... .... = Nonce: Not set
        .... 0... .... = Congestion Window Reduced (CWR): Not set
        .... .0.. .... = ECN-Echo: Not set
        .... ..0. .... = Urgent: Not set
        .... ...0 .... = Acknowledgment: Not set
        .... .... 0... = Push: Not set
        .... .... .0.. = Reset: Not set
        .... .... ..1. = Syn: Set
            [Expert Info (Chat/Sequence): Connection establish request (SYN): server port 7314]
                [Message: Connection establish request (SYN): server port 7314]
                [Severity level: Chat]
                [Group: Sequence]
        .... .... ...0 = Fin: Not set
    Window size value: 29200
    [Calculated window size: 29200]
    Checksum: 0x31c3 [validation disabled]
        [Good Checksum: False]
        [Bad Checksum: False]
    Options: (20 bytes), Maximum segment size, SACK permitted, Timestamps, No-Operation (NOP), Window scale
        Maximum segment size: 1460 bytes
            Kind: MSS size (2)
            Length: 4
            MSS Value: 1460
        TCP SACK Permitted Option: True
            Kind: SACK Permission (4)
            Length: 2
        Timestamps: TSval 199828, TSecr 0
            Kind: Timestamp (8)
            Length: 10
            Timestamp value: 199828
            Timestamp echo reply: 0
        No-Operation (NOP)
            Type: 1
                0... .... = Copy on fragmentation: No
                .00. .... = Class: Control (0)
                ...0 0001 = Number: No-Operation (NOP) (1)
        Window scale: 7 (multiply by 128)
            Kind: Window Scale (3)
            Length: 3
            Shift count: 7
            [Multiplier: 128]

0000  08 00 27 62 0e 57 08 00 27 41 0f d0 08 00 45 00   ..'b.W..'A....E.
0010  00 3c 3e 63 40 00 40 06 ca c4 0a 49 0e 05 0a 49   .<>c@.@....I...I
0020  0e fe 8b 04 1c 92 8f b3 32 f7 00 00 00 00 a0 02   ........2.......
0030  72 10 31 c3 00 00 02 04 05 b4 04 02 08 0a 00 03   r.1.............
0040  0c 94 00 00 00 00 01 03 03 07                     ..........
No.     Time           Source                Destination           Protocol Length Info
      2 0.000376450    10.73.14.254          10.73.14.5            TCP      74     7314 > 35588 [SYN, ACK] Seq=0 Ack=1 Win=65160 Len=0 MSS=1460 SACK_PERM=1 TSval=1241141781 TSecr=199828 WS=128

Frame 2: 74 bytes on wire (592 bits), 74 bytes captured (592 bits) on interface 0
    Interface id: 0
    Encapsulation type: Ethernet (1)
    Arrival Time: Oct 25, 2022 18:32:49.661520919 MSK
    [Time shift for this packet: 0.000000000 seconds]
    Epoch Time: 1666711969.661520919 seconds
    [Time delta from previous captured frame: 0.000376450 seconds]
    [Time delta from previous displayed frame: 0.000376450 seconds]
    [Time since reference or first frame: 0.000376450 seconds]
    Frame Number: 2
    Frame Length: 74 bytes (592 bits)
    Capture Length: 74 bytes (592 bits)
    [Frame is marked: False]
    [Frame is ignored: False]
    [Protocols in frame: eth:ip:tcp]
    [Coloring Rule Name: TCP SYN/FIN]
    [Coloring Rule String: tcp.flags & 0x02 || tcp.flags.fin == 1]
Ethernet II, Src: CadmusCo_62:0e:57 (08:00:27:62:0e:57), Dst: CadmusCo_41:0f:d0 (08:00:27:41:0f:d0)
    Destination: CadmusCo_41:0f:d0 (08:00:27:41:0f:d0)
        Address: CadmusCo_41:0f:d0 (08:00:27:41:0f:d0)
        .... ..0. .... .... .... .... = LG bit: Globally unique address (factory default)
        .... ...0 .... .... .... .... = IG bit: Individual address (unicast)
    Source: CadmusCo_62:0e:57 (08:00:27:62:0e:57)
        Address: CadmusCo_62:0e:57 (08:00:27:62:0e:57)
        .... ..0. .... .... .... .... = LG bit: Globally unique address (factory default)
        .... ...0 .... .... .... .... = IG bit: Individual address (unicast)
    Type: IP (0x0800)
Internet Protocol Version 4, Src: 10.73.14.254 (10.73.14.254), Dst: 10.73.14.5 (10.73.14.5)
    Version: 4
    Header length: 20 bytes
    Differentiated Services Field: 0x00 (DSCP 0x00: Default; ECN: 0x00: Not-ECT (Not ECN-Capable Transport))
        0000 00.. = Differentiated Services Codepoint: Default (0x00)
        .... ..00 = Explicit Congestion Notification: Not-ECT (Not ECN-Capable Transport) (0x00)
    Total Length: 60
    Identification: 0x0000 (0)
    Flags: 0x02 (Don't Fragment)
        0... .... = Reserved bit: Not set
        .1.. .... = Don't fragment: Set
        ..0. .... = More fragments: Not set
    Fragment offset: 0
    Time to live: 64
    Protocol: TCP (6)
    Header checksum: 0x0928 [validation disabled]
        [Good: False]
        [Bad: False]
    Source: 10.73.14.254 (10.73.14.254)
    Destination: 10.73.14.5 (10.73.14.5)
Transmission Control Protocol, Src Port: 7314 (7314), Dst Port: 35588 (35588), Seq: 0, Ack: 1, Len: 0
    Source port: 7314 (7314)
    Destination port: 35588 (35588)
    [Stream index: 0]
    Sequence number: 0    (relative sequence number)
    Acknowledgment number: 1    (relative ack number)
    Header length: 40 bytes
    Flags: 0x012 (SYN, ACK)
        000. .... .... = Reserved: Not set
        ...0 .... .... = Nonce: Not set
        .... 0... .... = Congestion Window Reduced (CWR): Not set
        .... .0.. .... = ECN-Echo: Not set
        .... ..0. .... = Urgent: Not set
        .... ...1 .... = Acknowledgment: Set
        .... .... 0... = Push: Not set
        .... .... .0.. = Reset: Not set
        .... .... ..1. = Syn: Set
            [Expert Info (Chat/Sequence): Connection establish acknowledge (SYN+ACK): server port 7314]
                [Message: Connection establish acknowledge (SYN+ACK): server port 7314]
                [Severity level: Chat]
                [Group: Sequence]
        .... .... ...0 = Fin: Not set
    Window size value: 65160
    [Calculated window size: 65160]
    Checksum: 0x330b [validation disabled]
        [Good Checksum: False]
        [Bad Checksum: False]
    Options: (20 bytes), Maximum segment size, SACK permitted, Timestamps, No-Operation (NOP), Window scale
        Maximum segment size: 1460 bytes
            Kind: MSS size (2)
            Length: 4
            MSS Value: 1460
        TCP SACK Permitted Option: True
            Kind: SACK Permission (4)
            Length: 2
        Timestamps: TSval 1241141781, TSecr 199828
            Kind: Timestamp (8)
            Length: 10
            Timestamp value: 1241141781
            Timestamp echo reply: 199828
        No-Operation (NOP)
            Type: 1
                0... .... = Copy on fragmentation: No
                .00. .... = Class: Control (0)
                ...0 0001 = Number: No-Operation (NOP) (1)
        Window scale: 7 (multiply by 128)
            Kind: Window Scale (3)
            Length: 3
            Shift count: 7
            [Multiplier: 128]
    [SEQ/ACK analysis]
        [This is an ACK to the segment in frame: 1]
        [The RTT to ACK the segment was: 0.000376450 seconds]

0000  08 00 27 41 0f d0 08 00 27 62 0e 57 08 00 45 00   ..'A....'b.W..E.
0010  00 3c 00 00 40 00 40 06 09 28 0a 49 0e fe 0a 49   .<..@.@..(.I...I
0020  0e 05 1c 92 8b 04 74 55 5d 89 8f b3 32 f8 a0 12   ......tU]...2...
0030  fe 88 33 0b 00 00 02 04 05 b4 04 02 08 0a 49 fa   ..3...........I.
0040  52 15 00 03 0c 94 01 03 03 07                     R.........
No.     Time           Source                Destination           Protocol Length Info
      3 0.000412852    10.73.14.5            10.73.14.254          TCP      66     35588 > 7314 [ACK] Seq=1 Ack=1 Win=29312 Len=0 TSval=199829 TSecr=1241141781

Frame 3: 66 bytes on wire (528 bits), 66 bytes captured (528 bits) on interface 0
    Interface id: 0
    Encapsulation type: Ethernet (1)
    Arrival Time: Oct 25, 2022 18:32:49.661557321 MSK
    [Time shift for this packet: 0.000000000 seconds]
    Epoch Time: 1666711969.661557321 seconds
    [Time delta from previous captured frame: 0.000036402 seconds]
    [Time delta from previous displayed frame: 0.000036402 seconds]
    [Time since reference or first frame: 0.000412852 seconds]
    Frame Number: 3
    Frame Length: 66 bytes (528 bits)
    Capture Length: 66 bytes (528 bits)
    [Frame is marked: False]
    [Frame is ignored: False]
    [Protocols in frame: eth:ip:tcp]
    [Coloring Rule Name: TCP]
    [Coloring Rule String: tcp]
Ethernet II, Src: CadmusCo_41:0f:d0 (08:00:27:41:0f:d0), Dst: CadmusCo_62:0e:57 (08:00:27:62:0e:57)
    Destination: CadmusCo_62:0e:57 (08:00:27:62:0e:57)
        Address: CadmusCo_62:0e:57 (08:00:27:62:0e:57)
        .... ..0. .... .... .... .... = LG bit: Globally unique address (factory default)
        .... ...0 .... .... .... .... = IG bit: Individual address (unicast)
    Source: CadmusCo_41:0f:d0 (08:00:27:41:0f:d0)
        Address: CadmusCo_41:0f:d0 (08:00:27:41:0f:d0)
        .... ..0. .... .... .... .... = LG bit: Globally unique address (factory default)
        .... ...0 .... .... .... .... = IG bit: Individual address (unicast)
    Type: IP (0x0800)
Internet Protocol Version 4, Src: 10.73.14.5 (10.73.14.5), Dst: 10.73.14.254 (10.73.14.254)
    Version: 4
    Header length: 20 bytes
    Differentiated Services Field: 0x00 (DSCP 0x00: Default; ECN: 0x00: Not-ECT (Not ECN-Capable Transport))
        0000 00.. = Differentiated Services Codepoint: Default (0x00)
        .... ..00 = Explicit Congestion Notification: Not-ECT (Not ECN-Capable Transport) (0x00)
    Total Length: 52
    Identification: 0x3e64 (15972)
    Flags: 0x02 (Don't Fragment)
        0... .... = Reserved bit: Not set
        .1.. .... = Don't fragment: Set
        ..0. .... = More fragments: Not set
    Fragment offset: 0
    Time to live: 64
    Protocol: TCP (6)
    Header checksum: 0xcacb [validation disabled]
        [Good: False]
        [Bad: False]
    Source: 10.73.14.5 (10.73.14.5)
    Destination: 10.73.14.254 (10.73.14.254)
Transmission Control Protocol, Src Port: 35588 (35588), Dst Port: 7314 (7314), Seq: 1, Ack: 1, Len: 0
    Source port: 35588 (35588)
    Destination port: 7314 (7314)
    [Stream index: 0]
    Sequence number: 1    (relative sequence number)
    Acknowledgment number: 1    (relative ack number)
    Header length: 32 bytes
    Flags: 0x010 (ACK)
        000. .... .... = Reserved: Not set
        ...0 .... .... = Nonce: Not set
        .... 0... .... = Congestion Window Reduced (CWR): Not set
        .... .0.. .... = ECN-Echo: Not set
        .... ..0. .... = Urgent: Not set
        .... ...1 .... = Acknowledgment: Set
        .... .... 0... = Push: Not set
        .... .... .0.. = Reset: Not set
        .... .... ..0. = Syn: Not set
        .... .... ...0 = Fin: Not set
    Window size value: 229
    [Calculated window size: 29312]
    [Window size scaling factor: 128]
    Checksum: 0x31bb [validation disabled]
        [Good Checksum: False]
        [Bad Checksum: False]
    Options: (12 bytes), No-Operation (NOP), No-Operation (NOP), Timestamps
        No-Operation (NOP)
            Type: 1
                0... .... = Copy on fragmentation: No
                .00. .... = Class: Control (0)
                ...0 0001 = Number: No-Operation (NOP) (1)
        No-Operation (NOP)
            Type: 1
                0... .... = Copy on fragmentation: No
                .00. .... = Class: Control (0)
                ...0 0001 = Number: No-Operation (NOP) (1)
        Timestamps: TSval 199829, TSecr 1241141781
            Kind: Timestamp (8)
            Length: 10
            Timestamp value: 199829
            Timestamp echo reply: 1241141781
    [SEQ/ACK analysis]
        [This is an ACK to the segment in frame: 2]
        [The RTT to ACK the segment was: 0.000036402 seconds]

0000  08 00 27 62 0e 57 08 00 27 41 0f d0 08 00 45 00   ..'b.W..'A....E.
0010  00 34 3e 64 40 00 40 06 ca cb 0a 49 0e 05 0a 49   .4>d@.@....I...I
0020  0e fe 8b 04 1c 92 8f b3 32 f8 74 55 5d 8a 80 10   ........2.tU]...
0030  00 e5 31 bb 00 00 01 01 08 0a 00 03 0c 95 49 fa   ..1...........I.
0040  52 15                                             R.
No.     Time           Source                Destination           Protocol Length Info
      4 0.010350519    10.73.14.5            10.73.14.254          TCP      87     35588 > 7314 [PSH, ACK] Seq=1 Ack=1 Win=29312 Len=21 TSval=199838 TSecr=1241141781

Frame 4: 87 bytes on wire (696 bits), 87 bytes captured (696 bits) on interface 0
    Interface id: 0
    Encapsulation type: Ethernet (1)
    Arrival Time: Oct 25, 2022 18:32:49.671494988 MSK
    [Time shift for this packet: 0.000000000 seconds]
    Epoch Time: 1666711969.671494988 seconds
    [Time delta from previous captured frame: 0.009937667 seconds]
    [Time delta from previous displayed frame: 0.009937667 seconds]
    [Time since reference or first frame: 0.010350519 seconds]
    Frame Number: 4
    Frame Length: 87 bytes (696 bits)
    Capture Length: 87 bytes (696 bits)
    [Frame is marked: False]
    [Frame is ignored: False]
    [Protocols in frame: eth:ip:tcp:data]
    [Coloring Rule Name: TCP]
    [Coloring Rule String: tcp]
Ethernet II, Src: CadmusCo_41:0f:d0 (08:00:27:41:0f:d0), Dst: CadmusCo_62:0e:57 (08:00:27:62:0e:57)
    Destination: CadmusCo_62:0e:57 (08:00:27:62:0e:57)
        Address: CadmusCo_62:0e:57 (08:00:27:62:0e:57)
        .... ..0. .... .... .... .... = LG bit: Globally unique address (factory default)
        .... ...0 .... .... .... .... = IG bit: Individual address (unicast)
    Source: CadmusCo_41:0f:d0 (08:00:27:41:0f:d0)
        Address: CadmusCo_41:0f:d0 (08:00:27:41:0f:d0)
        .... ..0. .... .... .... .... = LG bit: Globally unique address (factory default)
        .... ...0 .... .... .... .... = IG bit: Individual address (unicast)
    Type: IP (0x0800)
Internet Protocol Version 4, Src: 10.73.14.5 (10.73.14.5), Dst: 10.73.14.254 (10.73.14.254)
    Version: 4
    Header length: 20 bytes
    Differentiated Services Field: 0x00 (DSCP 0x00: Default; ECN: 0x00: Not-ECT (Not ECN-Capable Transport))
        0000 00.. = Differentiated Services Codepoint: Default (0x00)
        .... ..00 = Explicit Congestion Notification: Not-ECT (Not ECN-Capable Transport) (0x00)
    Total Length: 73
    Identification: 0x3e65 (15973)
    Flags: 0x02 (Don't Fragment)
        0... .... = Reserved bit: Not set
        .1.. .... = Don't fragment: Set
        ..0. .... = More fragments: Not set
    Fragment offset: 0
    Time to live: 64
    Protocol: TCP (6)
    Header checksum: 0xcab5 [validation disabled]
        [Good: False]
        [Bad: False]
    Source: 10.73.14.5 (10.73.14.5)
    Destination: 10.73.14.254 (10.73.14.254)
Transmission Control Protocol, Src Port: 35588 (35588), Dst Port: 7314 (7314), Seq: 1, Ack: 1, Len: 21
    Source port: 35588 (35588)
    Destination port: 7314 (7314)
    [Stream index: 0]
    Sequence number: 1    (relative sequence number)
    [Next sequence number: 22    (relative sequence number)]
    Acknowledgment number: 1    (relative ack number)
    Header length: 32 bytes
    Flags: 0x018 (PSH, ACK)
        000. .... .... = Reserved: Not set
        ...0 .... .... = Nonce: Not set
        .... 0... .... = Congestion Window Reduced (CWR): Not set
        .... .0.. .... = ECN-Echo: Not set
        .... ..0. .... = Urgent: Not set
        .... ...1 .... = Acknowledgment: Set
        .... .... 1... = Push: Set
        .... .... .0.. = Reset: Not set
        .... .... ..0. = Syn: Not set
        .... .... ...0 = Fin: Not set
    Window size value: 229
    [Calculated window size: 29312]
    [Window size scaling factor: 128]
    Checksum: 0x31d0 [validation disabled]
        [Good Checksum: False]
        [Bad Checksum: False]
    Options: (12 bytes), No-Operation (NOP), No-Operation (NOP), Timestamps
        No-Operation (NOP)
            Type: 1
                0... .... = Copy on fragmentation: No
                .00. .... = Class: Control (0)
                ...0 0001 = Number: No-Operation (NOP) (1)
        No-Operation (NOP)
            Type: 1
                0... .... = Copy on fragmentation: No
                .00. .... = Class: Control (0)
                ...0 0001 = Number: No-Operation (NOP) (1)
        Timestamps: TSval 199838, TSecr 1241141781
            Kind: Timestamp (8)
            Length: 10
            Timestamp value: 199838
            Timestamp echo reply: 1241141781
    [SEQ/ACK analysis]
        [Bytes in flight: 21]
Data (21 bytes)
    Data: 5353482d322e302d4f70656e5353485f372e340d0a
    [Length: 21]

0000  08 00 27 62 0e 57 08 00 27 41 0f d0 08 00 45 00   ..'b.W..'A....E.
0010  00 49 3e 65 40 00 40 06 ca b5 0a 49 0e 05 0a 49   .I>e@.@....I...I
0020  0e fe 8b 04 1c 92 8f b3 32 f8 74 55 5d 8a 80 18   ........2.tU]...
0030  00 e5 31 d0 00 00 01 01 08 0a 00 03 0c 9e 49 fa   ..1...........I.
0040  52 15 53 53 48 2d 32 2e 30 2d 4f 70 65 6e 53 53   R.SSH-2.0-OpenSS
0050  48 5f 37 2e 34 0d 0a                              H_7.4..
No.     Time           Source                Destination           Protocol Length Info
      5 0.010587544    10.73.14.254          10.73.14.5            TCP      66     7314 > 35588 [ACK] Seq=1 Ack=22 Win=65152 Len=0 TSval=1241141792 TSecr=199838

Frame 5: 66 bytes on wire (528 bits), 66 bytes captured (528 bits) on interface 0
    Interface id: 0
    Encapsulation type: Ethernet (1)
    Arrival Time: Oct 25, 2022 18:32:49.671732013 MSK
    [Time shift for this packet: 0.000000000 seconds]
    Epoch Time: 1666711969.671732013 seconds
    [Time delta from previous captured frame: 0.000237025 seconds]
    [Time delta from previous displayed frame: 0.000237025 seconds]
    [Time since reference or first frame: 0.010587544 seconds]
    Frame Number: 5
    Frame Length: 66 bytes (528 bits)
    Capture Length: 66 bytes (528 bits)
    [Frame is marked: False]
    [Frame is ignored: False]
    [Protocols in frame: eth:ip:tcp]
    [Coloring Rule Name: TCP]
    [Coloring Rule String: tcp]
Ethernet II, Src: CadmusCo_62:0e:57 (08:00:27:62:0e:57), Dst: CadmusCo_41:0f:d0 (08:00:27:41:0f:d0)
    Destination: CadmusCo_41:0f:d0 (08:00:27:41:0f:d0)
        Address: CadmusCo_41:0f:d0 (08:00:27:41:0f:d0)
        .... ..0. .... .... .... .... = LG bit: Globally unique address (factory default)
        .... ...0 .... .... .... .... = IG bit: Individual address (unicast)
    Source: CadmusCo_62:0e:57 (08:00:27:62:0e:57)
        Address: CadmusCo_62:0e:57 (08:00:27:62:0e:57)
        .... ..0. .... .... .... .... = LG bit: Globally unique address (factory default)
        .... ...0 .... .... .... .... = IG bit: Individual address (unicast)
    Type: IP (0x0800)
Internet Protocol Version 4, Src: 10.73.14.254 (10.73.14.254), Dst: 10.73.14.5 (10.73.14.5)
    Version: 4
    Header length: 20 bytes
    Differentiated Services Field: 0x00 (DSCP 0x00: Default; ECN: 0x00: Not-ECT (Not ECN-Capable Transport))
        0000 00.. = Differentiated Services Codepoint: Default (0x00)
        .... ..00 = Explicit Congestion Notification: Not-ECT (Not ECN-Capable Transport) (0x00)
    Total Length: 52
    Identification: 0x8ce9 (36073)
    Flags: 0x02 (Don't Fragment)
        0... .... = Reserved bit: Not set
        .1.. .... = Don't fragment: Set
        ..0. .... = More fragments: Not set
    Fragment offset: 0
    Time to live: 64
    Protocol: TCP (6)
    Header checksum: 0x7c46 [validation disabled]
        [Good: False]
        [Bad: False]
    Source: 10.73.14.254 (10.73.14.254)
    Destination: 10.73.14.5 (10.73.14.5)
Transmission Control Protocol, Src Port: 7314 (7314), Dst Port: 35588 (35588), Seq: 1, Ack: 22, Len: 0
    Source port: 7314 (7314)
    Destination port: 35588 (35588)
    [Stream index: 0]
    Sequence number: 1    (relative sequence number)
    Acknowledgment number: 22    (relative ack number)
    Header length: 32 bytes
    Flags: 0x010 (ACK)
        000. .... .... = Reserved: Not set
        ...0 .... .... = Nonce: Not set
        .... 0... .... = Congestion Window Reduced (CWR): Not set
        .... .0.. .... = ECN-Echo: Not set
        .... ..0. .... = Urgent: Not set
        .... ...1 .... = Acknowledgment: Set
        .... .... 0... = Push: Not set
        .... .... .0.. = Reset: Not set
        .... .... ..0. = Syn: Not set
        .... .... ...0 = Fin: Not set
    Window size value: 509
    [Calculated window size: 65152]
    [Window size scaling factor: 128]
    Checksum: 0x5e39 [validation disabled]
        [Good Checksum: False]
        [Bad Checksum: False]
    Options: (12 bytes), No-Operation (NOP), No-Operation (NOP), Timestamps
        No-Operation (NOP)
            Type: 1
                0... .... = Copy on fragmentation: No
                .00. .... = Class: Control (0)
                ...0 0001 = Number: No-Operation (NOP) (1)
        No-Operation (NOP)
            Type: 1
                0... .... = Copy on fragmentation: No
                .00. .... = Class: Control (0)
                ...0 0001 = Number: No-Operation (NOP) (1)
        Timestamps: TSval 1241141792, TSecr 199838
            Kind: Timestamp (8)
            Length: 10
            Timestamp value: 1241141792
            Timestamp echo reply: 199838
    [SEQ/ACK analysis]
        [This is an ACK to the segment in frame: 4]
        [The RTT to ACK the segment was: 0.000237025 seconds]

0000  08 00 27 41 0f d0 08 00 27 62 0e 57 08 00 45 00   ..'A....'b.W..E.
0010  00 34 8c e9 40 00 40 06 7c 46 0a 49 0e fe 0a 49   .4..@.@.|F.I...I
0020  0e 05 1c 92 8b 04 74 55 5d 8a 8f b3 33 0d 80 10   ......tU]...3...
0030  01 fd 5e 39 00 00 01 01 08 0a 49 fa 52 20 00 03   ..^9......I.R ..
0040  0c 9e                                             ..
No.     Time           Source                Destination           Protocol Length Info
      6 0.027073474    10.73.14.254          10.73.14.5            TCP      98     7314 > 35588 [PSH, ACK] Seq=1 Ack=22 Win=65152 Len=32 TSval=1241141808 TSecr=199838

Frame 6: 98 bytes on wire (784 bits), 98 bytes captured (784 bits) on interface 0
    Interface id: 0
    Encapsulation type: Ethernet (1)
    Arrival Time: Oct 25, 2022 18:32:49.688217943 MSK
    [Time shift for this packet: 0.000000000 seconds]
    Epoch Time: 1666711969.688217943 seconds
    [Time delta from previous captured frame: 0.016485930 seconds]
    [Time delta from previous displayed frame: 0.016485930 seconds]
    [Time since reference or first frame: 0.027073474 seconds]
    Frame Number: 6
    Frame Length: 98 bytes (784 bits)
    Capture Length: 98 bytes (784 bits)
    [Frame is marked: False]
    [Frame is ignored: False]
    [Protocols in frame: eth:ip:tcp:data]
    [Coloring Rule Name: TCP]
    [Coloring Rule String: tcp]
Ethernet II, Src: CadmusCo_62:0e:57 (08:00:27:62:0e:57), Dst: CadmusCo_41:0f:d0 (08:00:27:41:0f:d0)
    Destination: CadmusCo_41:0f:d0 (08:00:27:41:0f:d0)
        Address: CadmusCo_41:0f:d0 (08:00:27:41:0f:d0)
        .... ..0. .... .... .... .... = LG bit: Globally unique address (factory default)
        .... ...0 .... .... .... .... = IG bit: Individual address (unicast)
    Source: CadmusCo_62:0e:57 (08:00:27:62:0e:57)
        Address: CadmusCo_62:0e:57 (08:00:27:62:0e:57)
        .... ..0. .... .... .... .... = LG bit: Globally unique address (factory default)
        .... ...0 .... .... .... .... = IG bit: Individual address (unicast)
    Type: IP (0x0800)
Internet Protocol Version 4, Src: 10.73.14.254 (10.73.14.254), Dst: 10.73.14.5 (10.73.14.5)
    Version: 4
    Header length: 20 bytes
    Differentiated Services Field: 0x00 (DSCP 0x00: Default; ECN: 0x00: Not-ECT (Not ECN-Capable Transport))
        0000 00.. = Differentiated Services Codepoint: Default (0x00)
        .... ..00 = Explicit Congestion Notification: Not-ECT (Not ECN-Capable Transport) (0x00)
    Total Length: 84
    Identification: 0x8cea (36074)
    Flags: 0x02 (Don't Fragment)
        0... .... = Reserved bit: Not set
        .1.. .... = Don't fragment: Set
        ..0. .... = More fragments: Not set
    Fragment offset: 0
    Time to live: 64
    Protocol: TCP (6)
    Header checksum: 0x7c25 [validation disabled]
        [Good: False]
        [Bad: False]
    Source: 10.73.14.254 (10.73.14.254)
    Destination: 10.73.14.5 (10.73.14.5)
Transmission Control Protocol, Src Port: 7314 (7314), Dst Port: 35588 (35588), Seq: 1, Ack: 22, Len: 32
    Source port: 7314 (7314)
    Destination port: 35588 (35588)
    [Stream index: 0]
    Sequence number: 1    (relative sequence number)
    [Next sequence number: 33    (relative sequence number)]
    Acknowledgment number: 22    (relative ack number)
    Header length: 32 bytes
    Flags: 0x018 (PSH, ACK)
        000. .... .... = Reserved: Not set
        ...0 .... .... = Nonce: Not set
        .... 0... .... = Congestion Window Reduced (CWR): Not set
        .... .0.. .... = ECN-Echo: Not set
        .... ..0. .... = Urgent: Not set
        .... ...1 .... = Acknowledgment: Set
        .... .... 1... = Push: Set
        .... .... .0.. = Reset: Not set
        .... .... ..0. = Syn: Not set
        .... .... ...0 = Fin: Not set
    Window size value: 509
    [Calculated window size: 65152]
    [Window size scaling factor: 128]
    Checksum: 0xf351 [validation disabled]
        [Good Checksum: False]
        [Bad Checksum: False]
    Options: (12 bytes), No-Operation (NOP), No-Operation (NOP), Timestamps
        No-Operation (NOP)
            Type: 1
                0... .... = Copy on fragmentation: No
                .00. .... = Class: Control (0)
                ...0 0001 = Number: No-Operation (NOP) (1)
        No-Operation (NOP)
            Type: 1
                0... .... = Copy on fragmentation: No
                .00. .... = Class: Control (0)
                ...0 0001 = Number: No-Operation (NOP) (1)
        Timestamps: TSval 1241141808, TSecr 199838
            Kind: Timestamp (8)
            Length: 10
            Timestamp value: 1241141808
            Timestamp echo reply: 199838
    [SEQ/ACK analysis]
        [Bytes in flight: 32]
Data (32 bytes)
    Data: 5353482d322e302d4f70656e5353485f382e397031205562...
    [Length: 32]

0000  08 00 27 41 0f d0 08 00 27 62 0e 57 08 00 45 00   ..'A....'b.W..E.
0010  00 54 8c ea 40 00 40 06 7c 25 0a 49 0e fe 0a 49   .T..@.@.|%.I...I
0020  0e 05 1c 92 8b 04 74 55 5d 8a 8f b3 33 0d 80 18   ......tU]...3...
0030  01 fd f3 51 00 00 01 01 08 0a 49 fa 52 30 00 03   ...Q......I.R0..
0040  0c 9e 53 53 48 2d 32 2e 30 2d 4f 70 65 6e 53 53   ..SSH-2.0-OpenSS
0050  48 5f 38 2e 39 70 31 20 55 62 75 6e 74 75 2d 33   H_8.9p1 Ubuntu-3
0060  0d 0a                                             ..
No.     Time           Source                Destination           Protocol Length Info
      7 0.027121860    10.73.14.5            10.73.14.254          TCP      66     35588 > 7314 [ACK] Seq=22 Ack=33 Win=29312 Len=0 TSval=199855 TSecr=1241141808

Frame 7: 66 bytes on wire (528 bits), 66 bytes captured (528 bits) on interface 0
    Interface id: 0
    Encapsulation type: Ethernet (1)
    Arrival Time: Oct 25, 2022 18:32:49.688266329 MSK
    [Time shift for this packet: 0.000000000 seconds]
    Epoch Time: 1666711969.688266329 seconds
    [Time delta from previous captured frame: 0.000048386 seconds]
    [Time delta from previous displayed frame: 0.000048386 seconds]
    [Time since reference or first frame: 0.027121860 seconds]
    Frame Number: 7
    Frame Length: 66 bytes (528 bits)
    Capture Length: 66 bytes (528 bits)
    [Frame is marked: False]
    [Frame is ignored: False]
    [Protocols in frame: eth:ip:tcp]
    [Coloring Rule Name: TCP]
    [Coloring Rule String: tcp]
Ethernet II, Src: CadmusCo_41:0f:d0 (08:00:27:41:0f:d0), Dst: CadmusCo_62:0e:57 (08:00:27:62:0e:57)
    Destination: CadmusCo_62:0e:57 (08:00:27:62:0e:57)
        Address: CadmusCo_62:0e:57 (08:00:27:62:0e:57)
        .... ..0. .... .... .... .... = LG bit: Globally unique address (factory default)
        .... ...0 .... .... .... .... = IG bit: Individual address (unicast)
    Source: CadmusCo_41:0f:d0 (08:00:27:41:0f:d0)
        Address: CadmusCo_41:0f:d0 (08:00:27:41:0f:d0)
        .... ..0. .... .... .... .... = LG bit: Globally unique address (factory default)
        .... ...0 .... .... .... .... = IG bit: Individual address (unicast)
    Type: IP (0x0800)
Internet Protocol Version 4, Src: 10.73.14.5 (10.73.14.5), Dst: 10.73.14.254 (10.73.14.254)
    Version: 4
    Header length: 20 bytes
    Differentiated Services Field: 0x00 (DSCP 0x00: Default; ECN: 0x00: Not-ECT (Not ECN-Capable Transport))
        0000 00.. = Differentiated Services Codepoint: Default (0x00)
        .... ..00 = Explicit Congestion Notification: Not-ECT (Not ECN-Capable Transport) (0x00)
    Total Length: 52
    Identification: 0x3e66 (15974)
    Flags: 0x02 (Don't Fragment)
        0... .... = Reserved bit: Not set
        .1.. .... = Don't fragment: Set
        ..0. .... = More fragments: Not set
    Fragment offset: 0
    Time to live: 64
    Protocol: TCP (6)
    Header checksum: 0xcac9 [validation disabled]
        [Good: False]
        [Bad: False]
    Source: 10.73.14.5 (10.73.14.5)
    Destination: 10.73.14.254 (10.73.14.254)
Transmission Control Protocol, Src Port: 35588 (35588), Dst Port: 7314 (7314), Seq: 22, Ack: 33, Len: 0
    Source port: 35588 (35588)
    Destination port: 7314 (7314)
    [Stream index: 0]
    Sequence number: 22    (relative sequence number)
    Acknowledgment number: 33    (relative ack number)
    Header length: 32 bytes
    Flags: 0x010 (ACK)
        000. .... .... = Reserved: Not set
        ...0 .... .... = Nonce: Not set
        .... 0... .... = Congestion Window Reduced (CWR): Not set
        .... .0.. .... = ECN-Echo: Not set
        .... ..0. .... = Urgent: Not set
        .... ...1 .... = Acknowledgment: Set
        .... .... 0... = Push: Not set
        .... .... .0.. = Reset: Not set
        .... .... ..0. = Syn: Not set
        .... .... ...0 = Fin: Not set
    Window size value: 229
    [Calculated window size: 29312]
    [Window size scaling factor: 128]
    Checksum: 0x31bb [validation disabled]
        [Good Checksum: False]
        [Bad Checksum: False]
    Options: (12 bytes), No-Operation (NOP), No-Operation (NOP), Timestamps
        No-Operation (NOP)
            Type: 1
                0... .... = Copy on fragmentation: No
                .00. .... = Class: Control (0)
                ...0 0001 = Number: No-Operation (NOP) (1)
        No-Operation (NOP)
            Type: 1
                0... .... = Copy on fragmentation: No
                .00. .... = Class: Control (0)
                ...0 0001 = Number: No-Operation (NOP) (1)
        Timestamps: TSval 199855, TSecr 1241141808
            Kind: Timestamp (8)
            Length: 10
            Timestamp value: 199855
            Timestamp echo reply: 1241141808
    [SEQ/ACK analysis]
        [This is an ACK to the segment in frame: 6]
        [The RTT to ACK the segment was: 0.000048386 seconds]

0000  08 00 27 62 0e 57 08 00 27 41 0f d0 08 00 45 00   ..'b.W..'A....E.
0010  00 34 3e 66 40 00 40 06 ca c9 0a 49 0e 05 0a 49   .4>f@.@....I...I
0020  0e fe 8b 04 1c 92 8f b3 33 0d 74 55 5d aa 80 10   ........3.tU]...
0030  00 e5 31 bb 00 00 01 01 08 0a 00 03 0c af 49 fa   ..1...........I.
0040  52 30                                             R0
No.     Time           Source                Destination           Protocol Length Info
      8 0.036955033    10.73.14.5            10.73.14.254          TCP      1562   35588 > 7314 [PSH, ACK] Seq=22 Ack=33 Win=29312 Len=1496 TSval=199865 TSecr=1241141808

Frame 8: 1562 bytes on wire (12496 bits), 1562 bytes captured (12496 bits) on interface 0
    Interface id: 0
    Encapsulation type: Ethernet (1)
    Arrival Time: Oct 25, 2022 18:32:49.698099502 MSK
    [Time shift for this packet: 0.000000000 seconds]
    Epoch Time: 1666711969.698099502 seconds
    [Time delta from previous captured frame: 0.009833173 seconds]
    [Time delta from previous displayed frame: 0.009833173 seconds]
    [Time since reference or first frame: 0.036955033 seconds]
    Frame Number: 8
    Frame Length: 1562 bytes (12496 bits)
    Capture Length: 1562 bytes (12496 bits)
    [Frame is marked: False]
    [Frame is ignored: False]
    [Protocols in frame: eth:ip:tcp:data]
    [Coloring Rule Name: TCP]
    [Coloring Rule String: tcp]
Ethernet II, Src: CadmusCo_41:0f:d0 (08:00:27:41:0f:d0), Dst: CadmusCo_62:0e:57 (08:00:27:62:0e:57)
    Destination: CadmusCo_62:0e:57 (08:00:27:62:0e:57)
        Address: CadmusCo_62:0e:57 (08:00:27:62:0e:57)
        .... ..0. .... .... .... .... = LG bit: Globally unique address (factory default)
        .... ...0 .... .... .... .... = IG bit: Individual address (unicast)
    Source: CadmusCo_41:0f:d0 (08:00:27:41:0f:d0)
        Address: CadmusCo_41:0f:d0 (08:00:27:41:0f:d0)
        .... ..0. .... .... .... .... = LG bit: Globally unique address (factory default)
        .... ...0 .... .... .... .... = IG bit: Individual address (unicast)
    Type: IP (0x0800)
Internet Protocol Version 4, Src: 10.73.14.5 (10.73.14.5), Dst: 10.73.14.254 (10.73.14.254)
    Version: 4
    Header length: 20 bytes
    Differentiated Services Field: 0x00 (DSCP 0x00: Default; ECN: 0x00: Not-ECT (Not ECN-Capable Transport))
        0000 00.. = Differentiated Services Codepoint: Default (0x00)
        .... ..00 = Explicit Congestion Notification: Not-ECT (Not ECN-Capable Transport) (0x00)
    Total Length: 1548
    Identification: 0x3e67 (15975)
    Flags: 0x02 (Don't Fragment)
        0... .... = Reserved bit: Not set
        .1.. .... = Don't fragment: Set
        ..0. .... = More fragments: Not set
    Fragment offset: 0
    Time to live: 64
    Protocol: TCP (6)
    Header checksum: 0xc4f0 [validation disabled]
        [Good: False]
        [Bad: False]
    Source: 10.73.14.5 (10.73.14.5)
    Destination: 10.73.14.254 (10.73.14.254)
Transmission Control Protocol, Src Port: 35588 (35588), Dst Port: 7314 (7314), Seq: 22, Ack: 33, Len: 1496
    Source port: 35588 (35588)
    Destination port: 7314 (7314)
    [Stream index: 0]
    Sequence number: 22    (relative sequence number)
    [Next sequence number: 1518    (relative sequence number)]
    Acknowledgment number: 33    (relative ack number)
    Header length: 32 bytes
    Flags: 0x018 (PSH, ACK)
        000. .... .... = Reserved: Not set
        ...0 .... .... = Nonce: Not set
        .... 0... .... = Congestion Window Reduced (CWR): Not set
        .... .0.. .... = ECN-Echo: Not set
        .... ..0. .... = Urgent: Not set
        .... ...1 .... = Acknowledgment: Set
        .... .... 1... = Push: Set
        .... .... .0.. = Reset: Not set
        .... .... ..0. = Syn: Not set
        .... .... ...0 = Fin: Not set
    Window size value: 229
    [Calculated window size: 29312]
    [Window size scaling factor: 128]
    Checksum: 0x3793 [validation disabled]
        [Good Checksum: False]
        [Bad Checksum: False]
    Options: (12 bytes), No-Operation (NOP), No-Operation (NOP), Timestamps
        No-Operation (NOP)
            Type: 1
                0... .... = Copy on fragmentation: No
                .00. .... = Class: Control (0)
                ...0 0001 = Number: No-Operation (NOP) (1)
        No-Operation (NOP)
            Type: 1
                0... .... = Copy on fragmentation: No
                .00. .... = Class: Control (0)
                ...0 0001 = Number: No-Operation (NOP) (1)
        Timestamps: TSval 199865, TSecr 1241141808
            Kind: Timestamp (8)
            Length: 10
            Timestamp value: 199865
            Timestamp echo reply: 1241141808
    [SEQ/ACK analysis]
        [Bytes in flight: 1496]
Data (1496 bytes)
    Data: 000005d40b14931141abbfba035d7a150e5efdd516b00000...
    [Length: 1496]

0000  08 00 27 62 0e 57 08 00 27 41 0f d0 08 00 45 00   ..'b.W..'A....E.
0010  06 0c 3e 67 40 00 40 06 c4 f0 0a 49 0e 05 0a 49   ..>g@.@....I...I
0020  0e fe 8b 04 1c 92 8f b3 33 0d 74 55 5d aa 80 18   ........3.tU]...
0030  00 e5 37 93 00 00 01 01 08 0a 00 03 0c b9 49 fa   ..7...........I.
0040  52 30 00 00 05 d4 0b 14 93 11 41 ab bf ba 03 5d   R0........A....]
0050  7a 15 0e 5e fd d5 16 b0 00 00 01 4b 63 75 72 76   z..^.......Kcurv
0060  65 32 35 35 31 39 2d 73 68 61 32 35 36 2c 63 75   e25519-sha256,cu
0070  72 76 65 32 35 35 31 39 2d 73 68 61 32 35 36 40   rve25519-sha256@
0080  6c 69 62 73 73 68 2e 6f 72 67 2c 65 63 64 68 2d   libssh.org,ecdh-
0090  73 68 61 32 2d 6e 69 73 74 70 32 35 36 2c 65 63   sha2-nistp256,ec
00a0  64 68 2d 73 68 61 32 2d 6e 69 73 74 70 33 38 34   dh-sha2-nistp384
00b0  2c 65 63 64 68 2d 73 68 61 32 2d 6e 69 73 74 70   ,ecdh-sha2-nistp
00c0  35 32 31 2c 64 69 66 66 69 65 2d 68 65 6c 6c 6d   521,diffie-hellm
00d0  61 6e 2d 67 72 6f 75 70 2d 65 78 63 68 61 6e 67   an-group-exchang
00e0  65 2d 73 68 61 32 35 36 2c 64 69 66 66 69 65 2d   e-sha256,diffie-
00f0  68 65 6c 6c 6d 61 6e 2d 67 72 6f 75 70 31 36 2d   hellman-group16-
0100  73 68 61 35 31 32 2c 64 69 66 66 69 65 2d 68 65   sha512,diffie-he
0110  6c 6c 6d 61 6e 2d 67 72 6f 75 70 31 38 2d 73 68   llman-group18-sh
0120  61 35 31 32 2c 64 69 66 66 69 65 2d 68 65 6c 6c   a512,diffie-hell
0130  6d 61 6e 2d 67 72 6f 75 70 2d 65 78 63 68 61 6e   man-group-exchan
0140  67 65 2d 73 68 61 31 2c 64 69 66 66 69 65 2d 68   ge-sha1,diffie-h
