No.     Time           Source                Destination           Protocol Length Info
      1 0.000000000    10.2.73.5             10.2.73.254           TCP      74     33534 → 7314 [SYN] Seq=0 Win=64240 Len=0 MSS=1460 SACK_PERM=1 TSval=2302645301 TSecr=0 WS=128

Frame 1: 74 bytes on wire (592 bits), 74 bytes captured (592 bits) on interface enp0s9, id 0
    Interface id: 0 (enp0s9)
        Interface name: enp0s9
    Encapsulation type: Ethernet (1)
    Arrival Time: Oct 25, 2022 18:45:27.797993465 EEST
    [Time shift for this packet: 0.000000000 seconds]
    Epoch Time: 1666712727.797993465 seconds
    [Time delta from previous captured frame: 0.000000000 seconds]
    [Time delta from previous displayed frame: 0.000000000 seconds]
    [Time since reference or first frame: 0.000000000 seconds]
    Frame Number: 1
    Frame Length: 74 bytes (592 bits)
    Capture Length: 74 bytes (592 bits)
    [Frame is marked: False]
    [Frame is ignored: False]
    [Protocols in frame: eth:ethertype:ip:tcp]
    [Coloring Rule Name: TCP SYN/FIN]
    [Coloring Rule String: tcp.flags & 0x02 || tcp.flags.fin == 1]
Ethernet II, Src: PcsCompu_57:5f:a0 (08:00:27:57:5f:a0), Dst: PcsCompu_9f:a5:ba (08:00:27:9f:a5:ba)
    Destination: PcsCompu_9f:a5:ba (08:00:27:9f:a5:ba)
        Address: PcsCompu_9f:a5:ba (08:00:27:9f:a5:ba)
        .... ..0. .... .... .... .... = LG bit: Globally unique address (factory default)
        .... ...0 .... .... .... .... = IG bit: Individual address (unicast)
    Source: PcsCompu_57:5f:a0 (08:00:27:57:5f:a0)
        Address: PcsCompu_57:5f:a0 (08:00:27:57:5f:a0)
        .... ..0. .... .... .... .... = LG bit: Globally unique address (factory default)
        .... ...0 .... .... .... .... = IG bit: Individual address (unicast)
    Type: IPv4 (0x0800)
Internet Protocol Version 4, Src: 10.2.73.5, Dst: 10.2.73.254
    0100 .... = Version: 4
    .... 0101 = Header Length: 20 bytes (5)
    Differentiated Services Field: 0x10 (DSCP: Unknown, ECN: Not-ECT)
        0001 00.. = Differentiated Services Codepoint: Unknown (4)
        .... ..00 = Explicit Congestion Notification: Not ECN-Capable Transport (0)
    Total Length: 60
    Identification: 0x79d1 (31185)
    Flags: 0x40, Don't fragment
        0... .... = Reserved bit: Not set
        .1.. .... = Don't fragment: Set
        ..0. .... = More fragments: Not set
    ...0 0000 0000 0000 = Fragment Offset: 0
    Time to Live: 64
    Protocol: TCP (6)
    Header Checksum: 0x19d4 [validation disabled]
    [Header checksum status: Unverified]
    Source Address: 10.2.73.5
    Destination Address: 10.2.73.254
Transmission Control Protocol, Src Port: 33534, Dst Port: 7314, Seq: 0, Len: 0
    Source Port: 33534
    Destination Port: 7314
    [Stream index: 0]
    [Conversation completeness: Incomplete, DATA (15)]
    [TCP Segment Len: 0]
    Sequence Number: 0    (relative sequence number)
    Sequence Number (raw): 2967450955
    [Next Sequence Number: 1    (relative sequence number)]
    Acknowledgment Number: 0
    Acknowledgment number (raw): 0
    1010 .... = Header Length: 40 bytes (10)
    Flags: 0x002 (SYN)
        000. .... .... = Reserved: Not set
        ...0 .... .... = Nonce: Not set
        .... 0... .... = Congestion Window Reduced (CWR): Not set
        .... .0.. .... = ECN-Echo: Not set
        .... ..0. .... = Urgent: Not set
        .... ...0 .... = Acknowledgment: Not set
        .... .... 0... = Push: Not set
        .... .... .0.. = Reset: Not set
        .... .... ..1. = Syn: Set
            [Expert Info (Chat/Sequence): Connection establish request (SYN): server port 7314]
                [Connection establish request (SYN): server port 7314]
                [Severity level: Chat]
                [Group: Sequence]
        .... .... ...0 = Fin: Not set
        [TCP Flags: ··········S·]
    Window: 64240
    [Calculated window size: 64240]
    Checksum: 0x82d7 [unverified]
    [Checksum Status: Unverified]
    Urgent Pointer: 0
    Options: (20 bytes), Maximum segment size, SACK permitted, Timestamps, No-Operation (NOP), Window scale
        TCP Option - Maximum segment size: 1460 bytes
            Kind: Maximum Segment Size (2)
            Length: 4
            MSS Value: 1460
        TCP Option - SACK permitted
            Kind: SACK Permitted (4)
            Length: 2
        TCP Option - Timestamps: TSval 2302645301, TSecr 0
            Kind: Time Stamp Option (8)
            Length: 10
            Timestamp value: 2302645301
            Timestamp echo reply: 0
        TCP Option - No-Operation (NOP)
            Kind: No-Operation (1)
        TCP Option - Window scale: 7 (multiply by 128)
            Kind: Window Scale (3)
            Length: 3
            Shift count: 7
            [Multiplier: 128]
    [Timestamps]
        [Time since first frame in this TCP stream: 0.000000000 seconds]
        [Time since previous frame in this TCP stream: 0.000000000 seconds]

0000  08 00 27 9f a5 ba 08 00 27 57 5f a0 08 00 45 10   ..'.....'W_...E.
0010  00 3c 79 d1 40 00 40 06 19 d4 0a 02 49 05 0a 02   .<y.@.@.....I...
0020  49 fe 82 fe 1c 92 b0 df b5 4b 00 00 00 00 a0 02   I........K......
0030  fa f0 82 d7 00 00 02 04 05 b4 04 02 08 0a 89 3f   ...............?
0040  94 35 00 00 00 00 01 03 03 07                     .5........

No.     Time           Source                Destination           Protocol Length Info
      2 0.000044290    10.2.73.254           10.2.73.5             TCP      74     7314 → 33534 [SYN, ACK] Seq=0 Ack=1 Win=65160 Len=0 MSS=1460 SACK_PERM=1 TSval=4158925857 TSecr=2302645301 WS=128

Frame 2: 74 bytes on wire (592 bits), 74 bytes captured (592 bits) on interface enp0s9, id 0
    Interface id: 0 (enp0s9)
        Interface name: enp0s9
    Encapsulation type: Ethernet (1)
    Arrival Time: Oct 25, 2022 18:45:27.798037755 EEST
    [Time shift for this packet: 0.000000000 seconds]
    Epoch Time: 1666712727.798037755 seconds
    [Time delta from previous captured frame: 0.000044290 seconds]
    [Time delta from previous displayed frame: 0.000044290 seconds]
    [Time since reference or first frame: 0.000044290 seconds]
    Frame Number: 2
    Frame Length: 74 bytes (592 bits)
    Capture Length: 74 bytes (592 bits)
    [Frame is marked: False]
    [Frame is ignored: False]
    [Protocols in frame: eth:ethertype:ip:tcp]
    [Coloring Rule Name: TCP SYN/FIN]
    [Coloring Rule String: tcp.flags & 0x02 || tcp.flags.fin == 1]
Ethernet II, Src: PcsCompu_9f:a5:ba (08:00:27:9f:a5:ba), Dst: PcsCompu_57:5f:a0 (08:00:27:57:5f:a0)
    Destination: PcsCompu_57:5f:a0 (08:00:27:57:5f:a0)
        Address: PcsCompu_57:5f:a0 (08:00:27:57:5f:a0)
        .... ..0. .... .... .... .... = LG bit: Globally unique address (factory default)
        .... ...0 .... .... .... .... = IG bit: Individual address (unicast)
    Source: PcsCompu_9f:a5:ba (08:00:27:9f:a5:ba)
        Address: PcsCompu_9f:a5:ba (08:00:27:9f:a5:ba)
        .... ..0. .... .... .... .... = LG bit: Globally unique address (factory default)
        .... ...0 .... .... .... .... = IG bit: Individual address (unicast)
    Type: IPv4 (0x0800)
Internet Protocol Version 4, Src: 10.2.73.254, Dst: 10.2.73.5
    0100 .... = Version: 4
    .... 0101 = Header Length: 20 bytes (5)
    Differentiated Services Field: 0x00 (DSCP: CS0, ECN: Not-ECT)
        0000 00.. = Differentiated Services Codepoint: Default (0)
        .... ..00 = Explicit Congestion Notification: Not ECN-Capable Transport (0)
    Total Length: 60
    Identification: 0x0000 (0)
    Flags: 0x40, Don't fragment
        0... .... = Reserved bit: Not set
        .1.. .... = Don't fragment: Set
        ..0. .... = More fragments: Not set
    ...0 0000 0000 0000 = Fragment Offset: 0
    Time to Live: 64
    Protocol: TCP (6)
    Header Checksum: 0x93b5 [validation disabled]
    [Header checksum status: Unverified]
    Source Address: 10.2.73.254
    Destination Address: 10.2.73.5
Transmission Control Protocol, Src Port: 7314, Dst Port: 33534, Seq: 0, Ack: 1, Len: 0
    Source Port: 7314
    Destination Port: 33534
    [Stream index: 0]
    [Conversation completeness: Incomplete, DATA (15)]
    [TCP Segment Len: 0]
    Sequence Number: 0    (relative sequence number)
    Sequence Number (raw): 3944899253
    [Next Sequence Number: 1    (relative sequence number)]
    Acknowledgment Number: 1    (relative ack number)
    Acknowledgment number (raw): 2967450956
    1010 .... = Header Length: 40 bytes (10)
    Flags: 0x012 (SYN, ACK)
        000. .... .... = Reserved: Not set
        ...0 .... .... = Nonce: Not set
        .... 0... .... = Congestion Window Reduced (CWR): Not set
        .... .0.. .... = ECN-Echo: Not set
        .... ..0. .... = Urgent: Not set
        .... ...1 .... = Acknowledgment: Set
        .... .... 0... = Push: Not set
        .... .... .0.. = Reset: Not set
        .... .... ..1. = Syn: Set
            [Expert Info (Chat/Sequence): Connection establish acknowledge (SYN+ACK): server port 7314]
                [Connection establish acknowledge (SYN+ACK): server port 7314]
                [Severity level: Chat]
                [Group: Sequence]
        .... .... ...0 = Fin: Not set
        [TCP Flags: ·······A··S·]
    Window: 65160
    [Calculated window size: 65160]
    Checksum: 0xa735 [unverified]
    [Checksum Status: Unverified]
    Urgent Pointer: 0
    Options: (20 bytes), Maximum segment size, SACK permitted, Timestamps, No-Operation (NOP), Window scale
        TCP Option - Maximum segment size: 1460 bytes
            Kind: Maximum Segment Size (2)
            Length: 4
            MSS Value: 1460
        TCP Option - SACK permitted
            Kind: SACK Permitted (4)
            Length: 2
        TCP Option - Timestamps: TSval 4158925857, TSecr 2302645301
            Kind: Time Stamp Option (8)
            Length: 10
            Timestamp value: 4158925857
            Timestamp echo reply: 2302645301
        TCP Option - No-Operation (NOP)
            Kind: No-Operation (1)
        TCP Option - Window scale: 7 (multiply by 128)
            Kind: Window Scale (3)
            Length: 3
            Shift count: 7
            [Multiplier: 128]
    [Timestamps]
        [Time since first frame in this TCP stream: 0.000044290 seconds]
        [Time since previous frame in this TCP stream: 0.000044290 seconds]
    [SEQ/ACK analysis]
        [This is an ACK to the segment in frame: 1]
        [The RTT to ACK the segment was: 0.000044290 seconds]
        [iRTT: 0.000245667 seconds]

0000  08 00 27 57 5f a0 08 00 27 9f a5 ba 08 00 45 00   ..'W_...'.....E.
0010  00 3c 00 00 40 00 40 06 93 b5 0a 02 49 fe 0a 02   .<..@.@.....I...
0020  49 05 1c 92 82 fe eb 22 62 b5 b0 df b5 4c a0 12   I......"b....L..
0030  fe 88 a7 35 00 00 02 04 05 b4 04 02 08 0a f7 e4   ...5............
0040  2c 21 89 3f 94 35 01 03 03 07                     ,!.?.5....

No.     Time           Source                Destination           Protocol Length Info
      3 0.000245667    10.2.73.5             10.2.73.254           TCP      66     33534 → 7314 [ACK] Seq=1 Ack=1 Win=64256 Len=0 TSval=2302645302 TSecr=4158925857

Frame 3: 66 bytes on wire (528 bits), 66 bytes captured (528 bits) on interface enp0s9, id 0
    Interface id: 0 (enp0s9)
        Interface name: enp0s9
    Encapsulation type: Ethernet (1)
    Arrival Time: Oct 25, 2022 18:45:27.798239132 EEST
    [Time shift for this packet: 0.000000000 seconds]
    Epoch Time: 1666712727.798239132 seconds
    [Time delta from previous captured frame: 0.000201377 seconds]
    [Time delta from previous displayed frame: 0.000201377 seconds]
    [Time since reference or first frame: 0.000245667 seconds]
    Frame Number: 3
    Frame Length: 66 bytes (528 bits)
    Capture Length: 66 bytes (528 bits)
    [Frame is marked: False]
    [Frame is ignored: False]
    [Protocols in frame: eth:ethertype:ip:tcp]
    [Coloring Rule Name: TCP]
    [Coloring Rule String: tcp]
Ethernet II, Src: PcsCompu_57:5f:a0 (08:00:27:57:5f:a0), Dst: PcsCompu_9f:a5:ba (08:00:27:9f:a5:ba)
    Destination: PcsCompu_9f:a5:ba (08:00:27:9f:a5:ba)
        Address: PcsCompu_9f:a5:ba (08:00:27:9f:a5:ba)
        .... ..0. .... .... .... .... = LG bit: Globally unique address (factory default)
        .... ...0 .... .... .... .... = IG bit: Individual address (unicast)
    Source: PcsCompu_57:5f:a0 (08:00:27:57:5f:a0)
        Address: PcsCompu_57:5f:a0 (08:00:27:57:5f:a0)
        .... ..0. .... .... .... .... = LG bit: Globally unique address (factory default)
        .... ...0 .... .... .... .... = IG bit: Individual address (unicast)
    Type: IPv4 (0x0800)
Internet Protocol Version 4, Src: 10.2.73.5, Dst: 10.2.73.254
    0100 .... = Version: 4
    .... 0101 = Header Length: 20 bytes (5)
    Differentiated Services Field: 0x10 (DSCP: Unknown, ECN: Not-ECT)
        0001 00.. = Differentiated Services Codepoint: Unknown (4)
        .... ..00 = Explicit Congestion Notification: Not ECN-Capable Transport (0)
    Total Length: 52
    Identification: 0x79d2 (31186)
    Flags: 0x40, Don't fragment
        0... .... = Reserved bit: Not set
        .1.. .... = Don't fragment: Set
        ..0. .... = More fragments: Not set
    ...0 0000 0000 0000 = Fragment Offset: 0
    Time to Live: 64
    Protocol: TCP (6)
    Header Checksum: 0x19db [validation disabled]
    [Header checksum status: Unverified]
    Source Address: 10.2.73.5
    Destination Address: 10.2.73.254
Transmission Control Protocol, Src Port: 33534, Dst Port: 7314, Seq: 1, Ack: 1, Len: 0
    Source Port: 33534
    Destination Port: 7314
    [Stream index: 0]
    [Conversation completeness: Incomplete, DATA (15)]
    [TCP Segment Len: 0]
    Sequence Number: 1    (relative sequence number)
    Sequence Number (raw): 2967450956
    [Next Sequence Number: 1    (relative sequence number)]
    Acknowledgment Number: 1    (relative ack number)
    Acknowledgment number (raw): 3944899254
    1000 .... = Header Length: 32 bytes (8)
    Flags: 0x010 (ACK)
        000. .... .... = Reserved: Not set
        ...0 .... .... = Nonce: Not set
        .... 0... .... = Congestion Window Reduced (CWR): Not set
        .... .0.. .... = ECN-Echo: Not set
        .... ..0. .... = Urgent: Not set
        .... ...1 .... = Acknowledgment: Set
        .... .... 0... = Push: Not set
        .... .... .0.. = Reset: Not set
        .... .... ..0. = Syn: Not set
        .... .... ...0 = Fin: Not set
        [TCP Flags: ·······A····]
    Window: 502
    [Calculated window size: 64256]
    [Window size scaling factor: 128]
    Checksum: 0x38ae [unverified]
    [Checksum Status: Unverified]
    Urgent Pointer: 0
    Options: (12 bytes), No-Operation (NOP), No-Operation (NOP), Timestamps
        TCP Option - No-Operation (NOP)
            Kind: No-Operation (1)
        TCP Option - No-Operation (NOP)
            Kind: No-Operation (1)
        TCP Option - Timestamps: TSval 2302645302, TSecr 4158925857
            Kind: Time Stamp Option (8)
            Length: 10
            Timestamp value: 2302645302
            Timestamp echo reply: 4158925857
    [Timestamps]
        [Time since first frame in this TCP stream: 0.000245667 seconds]
        [Time since previous frame in this TCP stream: 0.000201377 seconds]
    [SEQ/ACK analysis]
        [This is an ACK to the segment in frame: 2]
        [The RTT to ACK the segment was: 0.000201377 seconds]
        [iRTT: 0.000245667 seconds]

0000  08 00 27 9f a5 ba 08 00 27 57 5f a0 08 00 45 10   ..'.....'W_...E.
0010  00 34 79 d2 40 00 40 06 19 db 0a 02 49 05 0a 02   .4y.@.@.....I...
0020  49 fe 82 fe 1c 92 b0 df b5 4c eb 22 62 b6 80 10   I........L."b...
0030  01 f6 38 ae 00 00 01 01 08 0a 89 3f 94 36 f7 e4   ..8........?.6..
0040  2c 21                                             ,!

No.     Time           Source                Destination           Protocol Length Info
      4 0.010863159    10.2.73.5             10.2.73.254           TCP      98     33534 → 7314 [PSH, ACK] Seq=1 Ack=1 Win=64256 Len=32 TSval=2302645312 TSecr=4158925857

Frame 4: 98 bytes on wire (784 bits), 98 bytes captured (784 bits) on interface enp0s9, id 0
    Interface id: 0 (enp0s9)
        Interface name: enp0s9
    Encapsulation type: Ethernet (1)
    Arrival Time: Oct 25, 2022 18:45:27.808856624 EEST
    [Time shift for this packet: 0.000000000 seconds]
    Epoch Time: 1666712727.808856624 seconds
    [Time delta from previous captured frame: 0.010617492 seconds]
    [Time delta from previous displayed frame: 0.010617492 seconds]
    [Time since reference or first frame: 0.010863159 seconds]
    Frame Number: 4
    Frame Length: 98 bytes (784 bits)
    Capture Length: 98 bytes (784 bits)
    [Frame is marked: False]
    [Frame is ignored: False]
    [Protocols in frame: eth:ethertype:ip:tcp:data]
    [Coloring Rule Name: TCP]
    [Coloring Rule String: tcp]
Ethernet II, Src: PcsCompu_57:5f:a0 (08:00:27:57:5f:a0), Dst: PcsCompu_9f:a5:ba (08:00:27:9f:a5:ba)
    Destination: PcsCompu_9f:a5:ba (08:00:27:9f:a5:ba)
        Address: PcsCompu_9f:a5:ba (08:00:27:9f:a5:ba)
        .... ..0. .... .... .... .... = LG bit: Globally unique address (factory default)
        .... ...0 .... .... .... .... = IG bit: Individual address (unicast)
    Source: PcsCompu_57:5f:a0 (08:00:27:57:5f:a0)
        Address: PcsCompu_57:5f:a0 (08:00:27:57:5f:a0)
        .... ..0. .... .... .... .... = LG bit: Globally unique address (factory default)
        .... ...0 .... .... .... .... = IG bit: Individual address (unicast)
    Type: IPv4 (0x0800)
Internet Protocol Version 4, Src: 10.2.73.5, Dst: 10.2.73.254
    0100 .... = Version: 4
    .... 0101 = Header Length: 20 bytes (5)
    Differentiated Services Field: 0x10 (DSCP: Unknown, ECN: Not-ECT)
        0001 00.. = Differentiated Services Codepoint: Unknown (4)
        .... ..00 = Explicit Congestion Notification: Not ECN-Capable Transport (0)
    Total Length: 84
    Identification: 0x79d3 (31187)
    Flags: 0x40, Don't fragment
        0... .... = Reserved bit: Not set
        .1.. .... = Don't fragment: Set
        ..0. .... = More fragments: Not set
    ...0 0000 0000 0000 = Fragment Offset: 0
    Time to Live: 64
    Protocol: TCP (6)
    Header Checksum: 0x19ba [validation disabled]
    [Header checksum status: Unverified]
    Source Address: 10.2.73.5
    Destination Address: 10.2.73.254
Transmission Control Protocol, Src Port: 33534, Dst Port: 7314, Seq: 1, Ack: 1, Len: 32
    Source Port: 33534
    Destination Port: 7314
    [Stream index: 0]
    [Conversation completeness: Incomplete, DATA (15)]
    [TCP Segment Len: 32]
    Sequence Number: 1    (relative sequence number)
    Sequence Number (raw): 2967450956
    [Next Sequence Number: 33    (relative sequence number)]
    Acknowledgment Number: 1    (relative ack number)
    Acknowledgment number (raw): 3944899254
    1000 .... = Header Length: 32 bytes (8)
    Flags: 0x018 (PSH, ACK)
        000. .... .... = Reserved: Not set
        ...0 .... .... = Nonce: Not set
        .... 0... .... = Congestion Window Reduced (CWR): Not set
        .... .0.. .... = ECN-Echo: Not set
        .... ..0. .... = Urgent: Not set
        .... ...1 .... = Acknowledgment: Set
        .... .... 1... = Push: Set
        .... .... .0.. = Reset: Not set
        .... .... ..0. = Syn: Not set
        .... .... ...0 = Fin: Not set
        [TCP Flags: ·······AP···]
    Window: 502
    [Calculated window size: 64256]
    [Window size scaling factor: 128]
    Checksum: 0xcdcc [unverified]
    [Checksum Status: Unverified]
    Urgent Pointer: 0
    Options: (12 bytes), No-Operation (NOP), No-Operation (NOP), Timestamps
        TCP Option - No-Operation (NOP)
            Kind: No-Operation (1)
        TCP Option - No-Operation (NOP)
            Kind: No-Operation (1)
        TCP Option - Timestamps: TSval 2302645312, TSecr 4158925857
            Kind: Time Stamp Option (8)
            Length: 10
            Timestamp value: 2302645312
            Timestamp echo reply: 4158925857
    [Timestamps]
        [Time since first frame in this TCP stream: 0.010863159 seconds]
        [Time since previous frame in this TCP stream: 0.010617492 seconds]
    [SEQ/ACK analysis]
        [iRTT: 0.000245667 seconds]
        [Bytes in flight: 32]
        [Bytes sent since last PSH flag: 32]
    TCP payload (32 bytes)
Data (32 bytes)
    Data: 5353482d322e302d4f70656e5353485f382e397031205562756e74752d330d0a
    [Length: 32]

0000  08 00 27 9f a5 ba 08 00 27 57 5f a0 08 00 45 10   ..'.....'W_...E.
0010  00 54 79 d3 40 00 40 06 19 ba 0a 02 49 05 0a 02   .Ty.@.@.....I...
0020  49 fe 82 fe 1c 92 b0 df b5 4c eb 22 62 b6 80 18   I........L."b...
0030  01 f6 cd cc 00 00 01 01 08 0a 89 3f 94 40 f7 e4   ...........?.@..
0040  2c 21 53 53 48 2d 32 2e 30 2d 4f 70 65 6e 53 53   ,!SSH-2.0-OpenSS
0050  48 5f 38 2e 39 70 31 20 55 62 75 6e 74 75 2d 33   H_8.9p1 Ubuntu-3
0060  0d 0a                                             ..

No.     Time           Source                Destination           Protocol Length Info
      5 0.010878277    10.2.73.254           10.2.73.5             TCP      66     7314 → 33534 [ACK] Seq=1 Ack=33 Win=65152 Len=0 TSval=4158925868 TSecr=2302645312

Frame 5: 66 bytes on wire (528 bits), 66 bytes captured (528 bits) on interface enp0s9, id 0
    Interface id: 0 (enp0s9)
        Interface name: enp0s9
    Encapsulation type: Ethernet (1)
    Arrival Time: Oct 25, 2022 18:45:27.808871742 EEST
    [Time shift for this packet: 0.000000000 seconds]
    Epoch Time: 1666712727.808871742 seconds
    [Time delta from previous captured frame: 0.000015118 seconds]
    [Time delta from previous displayed frame: 0.000015118 seconds]
    [Time since reference or first frame: 0.010878277 seconds]
    Frame Number: 5
    Frame Length: 66 bytes (528 bits)
    Capture Length: 66 bytes (528 bits)
    [Frame is marked: False]
    [Frame is ignored: False]
    [Protocols in frame: eth:ethertype:ip:tcp]
    [Coloring Rule Name: TCP]
    [Coloring Rule String: tcp]
Ethernet II, Src: PcsCompu_9f:a5:ba (08:00:27:9f:a5:ba), Dst: PcsCompu_57:5f:a0 (08:00:27:57:5f:a0)
    Destination: PcsCompu_57:5f:a0 (08:00:27:57:5f:a0)
        Address: PcsCompu_57:5f:a0 (08:00:27:57:5f:a0)
        .... ..0. .... .... .... .... = LG bit: Globally unique address (factory default)
        .... ...0 .... .... .... .... = IG bit: Individual address (unicast)
    Source: PcsCompu_9f:a5:ba (08:00:27:9f:a5:ba)
        Address: PcsCompu_9f:a5:ba (08:00:27:9f:a5:ba)
        .... ..0. .... .... .... .... = LG bit: Globally unique address (factory default)
        .... ...0 .... .... .... .... = IG bit: Individual address (unicast)
    Type: IPv4 (0x0800)
Internet Protocol Version 4, Src: 10.2.73.254, Dst: 10.2.73.5
    0100 .... = Version: 4
    .... 0101 = Header Length: 20 bytes (5)
    Differentiated Services Field: 0x00 (DSCP: CS0, ECN: Not-ECT)
        0000 00.. = Differentiated Services Codepoint: Default (0)
        .... ..00 = Explicit Congestion Notification: Not ECN-Capable Transport (0)
    Total Length: 52
    Identification: 0xf28d (62093)
    Flags: 0x40, Don't fragment
        0... .... = Reserved bit: Not set
        .1.. .... = Don't fragment: Set
        ..0. .... = More fragments: Not set
    ...0 0000 0000 0000 = Fragment Offset: 0
    Time to Live: 64
    Protocol: TCP (6)
    Header Checksum: 0xa12f [validation disabled]
    [Header checksum status: Unverified]
    Source Address: 10.2.73.254
    Destination Address: 10.2.73.5
Transmission Control Protocol, Src Port: 7314, Dst Port: 33534, Seq: 1, Ack: 33, Len: 0
    Source Port: 7314
    Destination Port: 33534
    [Stream index: 0]
    [Conversation completeness: Incomplete, DATA (15)]
    [TCP Segment Len: 0]
    Sequence Number: 1    (relative sequence number)
    Sequence Number (raw): 3944899254
    [Next Sequence Number: 1    (relative sequence number)]
    Acknowledgment Number: 33    (relative ack number)
    Acknowledgment number (raw): 2967450988
    1000 .... = Header Length: 32 bytes (8)
    Flags: 0x010 (ACK)
        000. .... .... = Reserved: Not set
        ...0 .... .... = Nonce: Not set
        .... 0... .... = Congestion Window Reduced (CWR): Not set
        .... .0.. .... = ECN-Echo: Not set
        .... ..0. .... = Urgent: Not set
        .... ...1 .... = Acknowledgment: Set
        .... .... 0... = Push: Not set
        .... .... .0.. = Reset: Not set
        .... .... ..0. = Syn: Not set
        .... .... ...0 = Fin: Not set
        [TCP Flags: ·······A····]
    Window: 509
    [Calculated window size: 65152]
    [Window size scaling factor: 128]
    Checksum: 0xa72d [unverified]
    [Checksum Status: Unverified]
    Urgent Pointer: 0
    Options: (12 bytes), No-Operation (NOP), No-Operation (NOP), Timestamps
        TCP Option - No-Operation (NOP)
            Kind: No-Operation (1)
        TCP Option - No-Operation (NOP)
            Kind: No-Operation (1)
        TCP Option - Timestamps: TSval 4158925868, TSecr 2302645312
            Kind: Time Stamp Option (8)
            Length: 10
            Timestamp value: 4158925868
            Timestamp echo reply: 2302645312
    [Timestamps]
        [Time since first frame in this TCP stream: 0.010878277 seconds]
        [Time since previous frame in this TCP stream: 0.000015118 seconds]
    [SEQ/ACK analysis]
        [This is an ACK to the segment in frame: 4]
        [The RTT to ACK the segment was: 0.000015118 seconds]
        [iRTT: 0.000245667 seconds]

0000  08 00 27 57 5f a0 08 00 27 9f a5 ba 08 00 45 00   ..'W_...'.....E.
0010  00 34 f2 8d 40 00 40 06 a1 2f 0a 02 49 fe 0a 02   .4..@.@../..I...
0020  49 05 1c 92 82 fe eb 22 62 b6 b0 df b5 6c 80 10   I......"b....l..
0030  01 fd a7 2d 00 00 01 01 08 0a f7 e4 2c 2c 89 3f   ...-........,,.?
0040  94 40                                             .@

No.     Time           Source                Destination           Protocol Length Info
      6 0.177136756    10.2.73.254           10.2.73.5             TCP      98     7314 → 33534 [PSH, ACK] Seq=1 Ack=33 Win=65152 Len=32 TSval=4158926035 TSecr=2302645312

Frame 6: 98 bytes on wire (784 bits), 98 bytes captured (784 bits) on interface enp0s9, id 0
    Interface id: 0 (enp0s9)
        Interface name: enp0s9
    Encapsulation type: Ethernet (1)
    Arrival Time: Oct 25, 2022 18:45:27.975130221 EEST
    [Time shift for this packet: 0.000000000 seconds]
    Epoch Time: 1666712727.975130221 seconds
    [Time delta from previous captured frame: 0.166258479 seconds]
    [Time delta from previous displayed frame: 0.166258479 seconds]
    [Time since reference or first frame: 0.177136756 seconds]
    Frame Number: 6
    Frame Length: 98 bytes (784 bits)
    Capture Length: 98 bytes (784 bits)
    [Frame is marked: False]
    [Frame is ignored: False]
    [Protocols in frame: eth:ethertype:ip:tcp:data]
    [Coloring Rule Name: TCP]
    [Coloring Rule String: tcp]
Ethernet II, Src: PcsCompu_9f:a5:ba (08:00:27:9f:a5:ba), Dst: PcsCompu_57:5f:a0 (08:00:27:57:5f:a0)
    Destination: PcsCompu_57:5f:a0 (08:00:27:57:5f:a0)
        Address: PcsCompu_57:5f:a0 (08:00:27:57:5f:a0)
        .... ..0. .... .... .... .... = LG bit: Globally unique address (factory default)
        .... ...0 .... .... .... .... = IG bit: Individual address (unicast)
    Source: PcsCompu_9f:a5:ba (08:00:27:9f:a5:ba)
        Address: PcsCompu_9f:a5:ba (08:00:27:9f:a5:ba)
        .... ..0. .... .... .... .... = LG bit: Globally unique address (factory default)
        .... ...0 .... .... .... .... = IG bit: Individual address (unicast)
    Type: IPv4 (0x0800)
Internet Protocol Version 4, Src: 10.2.73.254, Dst: 10.2.73.5
    0100 .... = Version: 4
    .... 0101 = Header Length: 20 bytes (5)
    Differentiated Services Field: 0x00 (DSCP: CS0, ECN: Not-ECT)
        0000 00.. = Differentiated Services Codepoint: Default (0)
        .... ..00 = Explicit Congestion Notification: Not ECN-Capable Transport (0)
    Total Length: 84
    Identification: 0xf28e (62094)
    Flags: 0x40, Don't fragment
        0... .... = Reserved bit: Not set
        .1.. .... = Don't fragment: Set
        ..0. .... = More fragments: Not set
    ...0 0000 0000 0000 = Fragment Offset: 0
    Time to Live: 64
    Protocol: TCP (6)
    Header Checksum: 0xa10e [validation disabled]
    [Header checksum status: Unverified]
    Source Address: 10.2.73.254
    Destination Address: 10.2.73.5
Transmission Control Protocol, Src Port: 7314, Dst Port: 33534, Seq: 1, Ack: 33, Len: 32
    Source Port: 7314
    Destination Port: 33534
    [Stream index: 0]
    [Conversation completeness: Incomplete, DATA (15)]
    [TCP Segment Len: 32]
    Sequence Number: 1    (relative sequence number)
    Sequence Number (raw): 3944899254
    [Next Sequence Number: 33    (relative sequence number)]
    Acknowledgment Number: 33    (relative ack number)
    Acknowledgment number (raw): 2967450988
    1000 .... = Header Length: 32 bytes (8)
    Flags: 0x018 (PSH, ACK)
        000. .... .... = Reserved: Not set
        ...0 .... .... = Nonce: Not set
        .... 0... .... = Congestion Window Reduced (CWR): Not set
        .... .0.. .... = ECN-Echo: Not set
        .... ..0. .... = Urgent: Not set
        .... ...1 .... = Acknowledgment: Set
        .... .... 1... = Push: Set
        .... .... .0.. = Reset: Not set
        .... .... ..0. = Syn: Not set
        .... .... ...0 = Fin: Not set
        [TCP Flags: ·······AP···]
    Window: 509
    [Calculated window size: 65152]
    [Window size scaling factor: 128]
    Checksum: 0xa74d [unverified]
    [Checksum Status: Unverified]
    Urgent Pointer: 0
    Options: (12 bytes), No-Operation (NOP), No-Operation (NOP), Timestamps
        TCP Option - No-Operation (NOP)
            Kind: No-Operation (1)
        TCP Option - No-Operation (NOP)
            Kind: No-Operation (1)
        TCP Option - Timestamps: TSval 4158926035, TSecr 2302645312
            Kind: Time Stamp Option (8)
            Length: 10
            Timestamp value: 4158926035
            Timestamp echo reply: 2302645312
    [Timestamps]
        [Time since first frame in this TCP stream: 0.177136756 seconds]
        [Time since previous frame in this TCP stream: 0.166258479 seconds]
    [SEQ/ACK analysis]
        [iRTT: 0.000245667 seconds]
        [Bytes in flight: 32]
        [Bytes sent since last PSH flag: 32]
    TCP payload (32 bytes)
Data (32 bytes)
    Data: 5353482d322e302d4f70656e5353485f382e397031205562756e74752d330d0a
    [Length: 32]

0000  08 00 27 57 5f a0 08 00 27 9f a5 ba 08 00 45 00   ..'W_...'.....E.
0010  00 54 f2 8e 40 00 40 06 a1 0e 0a 02 49 fe 0a 02   .T..@.@.....I...
0020  49 05 1c 92 82 fe eb 22 62 b6 b0 df b5 6c 80 18   I......"b....l..
0030  01 fd a7 4d 00 00 01 01 08 0a f7 e4 2c d3 89 3f   ...M........,..?
0040  94 40 53 53 48 2d 32 2e 30 2d 4f 70 65 6e 53 53   .@SSH-2.0-OpenSS
0050  48 5f 38 2e 39 70 31 20 55 62 75 6e 74 75 2d 33   H_8.9p1 Ubuntu-3
0060  0d 0a                                             ..

No.     Time           Source                Destination           Protocol Length Info
      7 0.177615544    10.2.73.5             10.2.73.254           TCP      66     33534 → 7314 [ACK] Seq=33 Ack=33 Win=64256 Len=0 TSval=2302645479 TSecr=4158926035

Frame 7: 66 bytes on wire (528 bits), 66 bytes captured (528 bits) on interface enp0s9, id 0
    Interface id: 0 (enp0s9)
        Interface name: enp0s9
    Encapsulation type: Ethernet (1)
    Arrival Time: Oct 25, 2022 18:45:27.975609009 EEST
    [Time shift for this packet: 0.000000000 seconds]
    Epoch Time: 1666712727.975609009 seconds
    [Time delta from previous captured frame: 0.000478788 seconds]
    [Time delta from previous displayed frame: 0.000478788 seconds]
    [Time since reference or first frame: 0.177615544 seconds]
    Frame Number: 7
    Frame Length: 66 bytes (528 bits)
    Capture Length: 66 bytes (528 bits)
    [Frame is marked: False]
    [Frame is ignored: False]
    [Protocols in frame: eth:ethertype:ip:tcp]
    [Coloring Rule Name: TCP]
    [Coloring Rule String: tcp]
Ethernet II, Src: PcsCompu_57:5f:a0 (08:00:27:57:5f:a0), Dst: PcsCompu_9f:a5:ba (08:00:27:9f:a5:ba)
    Destination: PcsCompu_9f:a5:ba (08:00:27:9f:a5:ba)
        Address: PcsCompu_9f:a5:ba (08:00:27:9f:a5:ba)
        .... ..0. .... .... .... .... = LG bit: Globally unique address (factory default)
        .... ...0 .... .... .... .... = IG bit: Individual address (unicast)
    Source: PcsCompu_57:5f:a0 (08:00:27:57:5f:a0)
        Address: PcsCompu_57:5f:a0 (08:00:27:57:5f:a0)
        .... ..0. .... .... .... .... = LG bit: Globally unique address (factory default)
        .... ...0 .... .... .... .... = IG bit: Individual address (unicast)
    Type: IPv4 (0x0800)
Internet Protocol Version 4, Src: 10.2.73.5, Dst: 10.2.73.254
    0100 .... = Version: 4
    .... 0101 = Header Length: 20 bytes (5)
    Differentiated Services Field: 0x10 (DSCP: Unknown, ECN: Not-ECT)
        0001 00.. = Differentiated Services Codepoint: Unknown (4)
        .... ..00 = Explicit Congestion Notification: Not ECN-Capable Transport (0)
    Total Length: 52
    Identification: 0x79d4 (31188)
    Flags: 0x40, Don't fragment
        0... .... = Reserved bit: Not set
        .1.. .... = Don't fragment: Set
        ..0. .... = More fragments: Not set
    ...0 0000 0000 0000 = Fragment Offset: 0
    Time to Live: 64
    Protocol: TCP (6)
    Header Checksum: 0x19d9 [validation disabled]
    [Header checksum status: Unverified]
    Source Address: 10.2.73.5
    Destination Address: 10.2.73.254
Transmission Control Protocol, Src Port: 33534, Dst Port: 7314, Seq: 33, Ack: 33, Len: 0
    Source Port: 33534
    Destination Port: 7314
    [Stream index: 0]
    [Conversation completeness: Incomplete, DATA (15)]
    [TCP Segment Len: 0]
    Sequence Number: 33    (relative sequence number)
    Sequence Number (raw): 2967450988
    [Next Sequence Number: 33    (relative sequence number)]
    Acknowledgment Number: 33    (relative ack number)
    Acknowledgment number (raw): 3944899286
    1000 .... = Header Length: 32 bytes (8)
    Flags: 0x010 (ACK)
        000. .... .... = Reserved: Not set
        ...0 .... .... = Nonce: Not set
        .... 0... .... = Congestion Window Reduced (CWR): Not set
        .... .0.. .... = ECN-Echo: Not set
        .... ..0. .... = Urgent: Not set
        .... ...1 .... = Acknowledgment: Set
        .... .... 0... = Push: Not set
        .... .... .0.. = Reset: Not set
        .... .... ..0. = Syn: Not set
        .... .... ...0 = Fin: Not set
        [TCP Flags: ·······A····]
    Window: 502
    [Calculated window size: 64256]
    [Window size scaling factor: 128]
    Checksum: 0x370b [unverified]
    [Checksum Status: Unverified]
    Urgent Pointer: 0
    Options: (12 bytes), No-Operation (NOP), No-Operation (NOP), Timestamps
        TCP Option - No-Operation (NOP)
            Kind: No-Operation (1)
        TCP Option - No-Operation (NOP)
            Kind: No-Operation (1)
        TCP Option - Timestamps: TSval 2302645479, TSecr 4158926035
            Kind: Time Stamp Option (8)
            Length: 10
            Timestamp value: 2302645479
            Timestamp echo reply: 4158926035
    [Timestamps]
        [Time since first frame in this TCP stream: 0.177615544 seconds]
        [Time since previous frame in this TCP stream: 0.000478788 seconds]
    [SEQ/ACK analysis]
        [This is an ACK to the segment in frame: 6]
        [The RTT to ACK the segment was: 0.000478788 seconds]
        [iRTT: 0.000245667 seconds]

0000  08 00 27 9f a5 ba 08 00 27 57 5f a0 08 00 45 10   ..'.....'W_...E.
0010  00 34 79 d4 40 00 40 06 19 d9 0a 02 49 05 0a 02   .4y.@.@.....I...
0020  49 fe 82 fe 1c 92 b0 df b5 6c eb 22 62 d6 80 10   I........l."b...
0030  01 f6 37 0b 00 00 01 01 08 0a 89 3f 94 e7 f7 e4   ..7........?....
0040  2c d3                                             ,.

No.     Time           Source                Destination           Protocol Length Info
      8 0.179415182    10.2.73.254           10.2.73.5             TCP      1146   7314 → 33534 [PSH, ACK] Seq=33 Ack=33 Win=65152 Len=1080 TSval=4158926037 TSecr=2302645479

Frame 8: 1146 bytes on wire (9168 bits), 1146 bytes captured (9168 bits) on interface enp0s9, id 0
    Interface id: 0 (enp0s9)
        Interface name: enp0s9
    Encapsulation type: Ethernet (1)
    Arrival Time: Oct 25, 2022 18:45:27.977408647 EEST
    [Time shift for this packet: 0.000000000 seconds]
    Epoch Time: 1666712727.977408647 seconds
    [Time delta from previous captured frame: 0.001799638 seconds]
    [Time delta from previous displayed frame: 0.001799638 seconds]
    [Time since reference or first frame: 0.179415182 seconds]
    Frame Number: 8
    Frame Length: 1146 bytes (9168 bits)
    Capture Length: 1146 bytes (9168 bits)
    [Frame is marked: False]
    [Frame is ignored: False]
    [Protocols in frame: eth:ethertype:ip:tcp:data]
    [Coloring Rule Name: TCP]
    [Coloring Rule String: tcp]
Ethernet II, Src: PcsCompu_9f:a5:ba (08:00:27:9f:a5:ba), Dst: PcsCompu_57:5f:a0 (08:00:27:57:5f:a0)
    Destination: PcsCompu_57:5f:a0 (08:00:27:57:5f:a0)
        Address: PcsCompu_57:5f:a0 (08:00:27:57:5f:a0)
        .... ..0. .... .... .... .... = LG bit: Globally unique address (factory default)
        .... ...0 .... .... .... .... = IG bit: Individual address (unicast)
    Source: PcsCompu_9f:a5:ba (08:00:27:9f:a5:ba)
        Address: PcsCompu_9f:a5:ba (08:00:27:9f:a5:ba)
        .... ..0. .... .... .... .... = LG bit: Globally unique address (factory default)
        .... ...0 .... .... .... .... = IG bit: Individual address (unicast)
    Type: IPv4 (0x0800)
Internet Protocol Version 4, Src: 10.2.73.254, Dst: 10.2.73.5
    0100 .... = Version: 4
    .... 0101 = Header Length: 20 bytes (5)
    Differentiated Services Field: 0x00 (DSCP: CS0, ECN: Not-ECT)
        0000 00.. = Differentiated Services Codepoint: Default (0)
        .... ..00 = Explicit Congestion Notification: Not ECN-Capable Transport (0)
    Total Length: 1132
    Identification: 0xf28f (62095)
    Flags: 0x40, Don't fragment
        0... .... = Reserved bit: Not set
        .1.. .... = Don't fragment: Set
        ..0. .... = More fragments: Not set
    ...0 0000 0000 0000 = Fragment Offset: 0
    Time to Live: 64
    Protocol: TCP (6)
    Header Checksum: 0x9cf5 [validation disabled]
    [Header checksum status: Unverified]
    Source Address: 10.2.73.254
    Destination Address: 10.2.73.5
Transmission Control Protocol, Src Port: 7314, Dst Port: 33534, Seq: 33, Ack: 33, Len: 1080
    Source Port: 7314
    Destination Port: 33534
    [Stream index: 0]
    [Conversation completeness: Incomplete, DATA (15)]
    [TCP Segment Len: 1080]
    Sequence Number: 33    (relative sequence number)
    Sequence Number (raw): 3944899286
    [Next Sequence Number: 1113    (relative sequence number)]
    Acknowledgment Number: 33    (relative ack number)
    Acknowledgment number (raw): 2967450988
    1000 .... = Header Length: 32 bytes (8)
    Flags: 0x018 (PSH, ACK)
        000. .... .... = Reserved: Not set
        ...0 .... .... = Nonce: Not set
        .... 0... .... = Congestion Window Reduced (CWR): Not set
        .... .0.. .... = ECN-Echo: Not set
        .... ..0. .... = Urgent: Not set
        .... ...1 .... = Acknowledgment: Set
        .... .... 1... = Push: Set
        .... .... .0.. = Reset: Not set
        .... .... ..0. = Syn: Not set
        .... .... ...0 = Fin: Not set
        [TCP Flags: ·······AP···]
    Window: 509
    [Calculated window size: 65152]
    [Window size scaling factor: 128]
    Checksum: 0xab65 [unverified]
    [Checksum Status: Unverified]
    Urgent Pointer: 0
    Options: (12 bytes), No-Operation (NOP), No-Operation (NOP), Timestamps
        TCP Option - No-Operation (NOP)
            Kind: No-Operation (1)
        TCP Option - No-Operation (NOP)
            Kind: No-Operation (1)
        TCP Option - Timestamps: TSval 4158926037, TSecr 2302645479
            Kind: Time Stamp Option (8)
            Length: 10
            Timestamp value: 4158926037
