No.     Time           Source                Destination           Protocol Length Info
      1 0.000000000    10.73.14.5            10.73.14.254          TCP      74     35588 → 7314 [SYN] Seq=0 Win=29200 Len=0 MSS=1460 SACK_PERM=1 TSval=199828 TSecr=0 WS=128

Frame 1: 74 bytes on wire (592 bits), 74 bytes captured (592 bits) on interface enp0s8, id 0
    Interface id: 0 (enp0s8)
        Interface name: enp0s8
    Encapsulation type: Ethernet (1)
    Arrival Time: Oct 25, 2022 18:33:14.840858223 EEST
    [Time shift for this packet: 0.000000000 seconds]
    Epoch Time: 1666711994.840858223 seconds
    [Time delta from previous captured frame: 0.000000000 seconds]
    [Time delta from previous displayed frame: 0.000000000 seconds]
    [Time since reference or first frame: 0.000000000 seconds]
    Frame Number: 1
    Frame Length: 74 bytes (592 bits)
    Capture Length: 74 bytes (592 bits)
    [Frame is marked: False]
    [Frame is ignored: False]
    [Protocols in frame: eth:ethertype:ip:tcp]
    [Coloring Rule Name: TCP SYN/FIN]
    [Coloring Rule String: tcp.flags & 0x02 || tcp.flags.fin == 1]
Ethernet II, Src: PcsCompu_41:0f:d0 (08:00:27:41:0f:d0), Dst: PcsCompu_62:0e:57 (08:00:27:62:0e:57)
    Destination: PcsCompu_62:0e:57 (08:00:27:62:0e:57)
        Address: PcsCompu_62:0e:57 (08:00:27:62:0e:57)
        .... ..0. .... .... .... .... = LG bit: Globally unique address (factory default)
        .... ...0 .... .... .... .... = IG bit: Individual address (unicast)
    Source: PcsCompu_41:0f:d0 (08:00:27:41:0f:d0)
        Address: PcsCompu_41:0f:d0 (08:00:27:41:0f:d0)
        .... ..0. .... .... .... .... = LG bit: Globally unique address (factory default)
        .... ...0 .... .... .... .... = IG bit: Individual address (unicast)
    Type: IPv4 (0x0800)
Internet Protocol Version 4, Src: 10.73.14.5, Dst: 10.73.14.254
    0100 .... = Version: 4
    .... 0101 = Header Length: 20 bytes (5)
    Differentiated Services Field: 0x00 (DSCP: CS0, ECN: Not-ECT)
        0000 00.. = Differentiated Services Codepoint: Default (0)
        .... ..00 = Explicit Congestion Notification: Not ECN-Capable Transport (0)
    Total Length: 60
    Identification: 0x3e63 (15971)
    Flags: 0x40, Don't fragment
        0... .... = Reserved bit: Not set
        .1.. .... = Don't fragment: Set
        ..0. .... = More fragments: Not set
    ...0 0000 0000 0000 = Fragment Offset: 0
    Time to Live: 64
    Protocol: TCP (6)
    Header Checksum: 0xcac4 [validation disabled]
    [Header checksum status: Unverified]
    Source Address: 10.73.14.5
    Destination Address: 10.73.14.254
Transmission Control Protocol, Src Port: 35588, Dst Port: 7314, Seq: 0, Len: 0
    Source Port: 35588
    Destination Port: 7314
    [Stream index: 0]
    [Conversation completeness: Incomplete, DATA (15)]
    [TCP Segment Len: 0]
    Sequence Number: 0    (relative sequence number)
    Sequence Number (raw): 2410885879
    [Next Sequence Number: 1    (relative sequence number)]
    Acknowledgment Number: 0
    Acknowledgment number (raw): 0
    1010 .... = Header Length: 40 bytes (10)
    Flags: 0x002 (SYN)
        000. .... .... = Reserved: Not set
        ...0 .... .... = Nonce: Not set
        .... 0... .... = Congestion Window Reduced (CWR): Not set
        .... .0.. .... = ECN-Echo: Not set
        .... ..0. .... = Urgent: Not set
        .... ...0 .... = Acknowledgment: Not set
        .... .... 0... = Push: Not set
        .... .... .0.. = Reset: Not set
        .... .... ..1. = Syn: Set
            [Expert Info (Chat/Sequence): Connection establish request (SYN): server port 7314]
                [Connection establish request (SYN): server port 7314]
                [Severity level: Chat]
                [Group: Sequence]
        .... .... ...0 = Fin: Not set
        [TCP Flags: ··········S·]
    Window: 29200
    [Calculated window size: 29200]
    Checksum: 0x2d83 [unverified]
    [Checksum Status: Unverified]
    Urgent Pointer: 0
    Options: (20 bytes), Maximum segment size, SACK permitted, Timestamps, No-Operation (NOP), Window scale
        TCP Option - Maximum segment size: 1460 bytes
            Kind: Maximum Segment Size (2)
            Length: 4
            MSS Value: 1460
        TCP Option - SACK permitted
            Kind: SACK Permitted (4)
            Length: 2
        TCP Option - Timestamps: TSval 199828, TSecr 0
            Kind: Time Stamp Option (8)
            Length: 10
            Timestamp value: 199828
            Timestamp echo reply: 0
        TCP Option - No-Operation (NOP)
            Kind: No-Operation (1)
        TCP Option - Window scale: 7 (multiply by 128)
            Kind: Window Scale (3)
            Length: 3
            Shift count: 7
            [Multiplier: 128]
    [Timestamps]
        [Time since first frame in this TCP stream: 0.000000000 seconds]
        [Time since previous frame in this TCP stream: 0.000000000 seconds]

0000  08 00 27 62 0e 57 08 00 27 41 0f d0 08 00 45 00   ..'b.W..'A....E.
0010  00 3c 3e 63 40 00 40 06 ca c4 0a 49 0e 05 0a 49   .<>c@.@....I...I
0020  0e fe 8b 04 1c 92 8f b3 32 f7 00 00 00 00 a0 02   ........2.......
0030  72 10 2d 83 00 00 02 04 05 b4 04 02 08 0a 00 03   r.-.............
0040  0c 94 00 00 00 00 01 03 03 07                     ..........

No.     Time           Source                Destination           Protocol Length Info
      2 0.000052091    10.73.14.254          10.73.14.5            TCP      74     7314 → 35588 [SYN, ACK] Seq=0 Ack=1 Win=65160 Len=0 MSS=1460 SACK_PERM=1 TSval=1241141781 TSecr=199828 WS=128

Frame 2: 74 bytes on wire (592 bits), 74 bytes captured (592 bits) on interface enp0s8, id 0
    Interface id: 0 (enp0s8)
        Interface name: enp0s8
    Encapsulation type: Ethernet (1)
    Arrival Time: Oct 25, 2022 18:33:14.840910314 EEST
    [Time shift for this packet: 0.000000000 seconds]
    Epoch Time: 1666711994.840910314 seconds
    [Time delta from previous captured frame: 0.000052091 seconds]
    [Time delta from previous displayed frame: 0.000052091 seconds]
    [Time since reference or first frame: 0.000052091 seconds]
    Frame Number: 2
    Frame Length: 74 bytes (592 bits)
    Capture Length: 74 bytes (592 bits)
    [Frame is marked: False]
    [Frame is ignored: False]
    [Protocols in frame: eth:ethertype:ip:tcp]
    [Coloring Rule Name: TCP SYN/FIN]
    [Coloring Rule String: tcp.flags & 0x02 || tcp.flags.fin == 1]
Ethernet II, Src: PcsCompu_62:0e:57 (08:00:27:62:0e:57), Dst: PcsCompu_41:0f:d0 (08:00:27:41:0f:d0)
    Destination: PcsCompu_41:0f:d0 (08:00:27:41:0f:d0)
        Address: PcsCompu_41:0f:d0 (08:00:27:41:0f:d0)
        .... ..0. .... .... .... .... = LG bit: Globally unique address (factory default)
        .... ...0 .... .... .... .... = IG bit: Individual address (unicast)
    Source: PcsCompu_62:0e:57 (08:00:27:62:0e:57)
        Address: PcsCompu_62:0e:57 (08:00:27:62:0e:57)
        .... ..0. .... .... .... .... = LG bit: Globally unique address (factory default)
        .... ...0 .... .... .... .... = IG bit: Individual address (unicast)
    Type: IPv4 (0x0800)
Internet Protocol Version 4, Src: 10.73.14.254, Dst: 10.73.14.5
    0100 .... = Version: 4
    .... 0101 = Header Length: 20 bytes (5)
    Differentiated Services Field: 0x00 (DSCP: CS0, ECN: Not-ECT)
        0000 00.. = Differentiated Services Codepoint: Default (0)
        .... ..00 = Explicit Congestion Notification: Not ECN-Capable Transport (0)
    Total Length: 60
    Identification: 0x0000 (0)
    Flags: 0x40, Don't fragment
        0... .... = Reserved bit: Not set
        .1.. .... = Don't fragment: Set
        ..0. .... = More fragments: Not set
    ...0 0000 0000 0000 = Fragment Offset: 0
    Time to Live: 64
    Protocol: TCP (6)
    Header Checksum: 0x0928 [validation disabled]
    [Header checksum status: Unverified]
    Source Address: 10.73.14.254
    Destination Address: 10.73.14.5
Transmission Control Protocol, Src Port: 7314, Dst Port: 35588, Seq: 0, Ack: 1, Len: 0
    Source Port: 7314
    Destination Port: 35588
    [Stream index: 0]
    [Conversation completeness: Incomplete, DATA (15)]
    [TCP Segment Len: 0]
    Sequence Number: 0    (relative sequence number)
    Sequence Number (raw): 1951751561
    [Next Sequence Number: 1    (relative sequence number)]
    Acknowledgment Number: 1    (relative ack number)
    Acknowledgment number (raw): 2410885880
    1010 .... = Header Length: 40 bytes (10)
    Flags: 0x012 (SYN, ACK)
        000. .... .... = Reserved: Not set
        ...0 .... .... = Nonce: Not set
        .... 0... .... = Congestion Window Reduced (CWR): Not set
        .... .0.. .... = ECN-Echo: Not set
        .... ..0. .... = Urgent: Not set
        .... ...1 .... = Acknowledgment: Set
        .... .... 0... = Push: Not set
        .... .... .0.. = Reset: Not set
        .... .... ..1. = Syn: Set
            [Expert Info (Chat/Sequence): Connection establish acknowledge (SYN+ACK): server port 7314]
                [Connection establish acknowledge (SYN+ACK): server port 7314]
                [Severity level: Chat]
                [Group: Sequence]
        .... .... ...0 = Fin: Not set
        [TCP Flags: ·······A··S·]
    Window: 65160
    [Calculated window size: 65160]
    Checksum: 0x31c3 [unverified]
    [Checksum Status: Unverified]
    Urgent Pointer: 0
    Options: (20 bytes), Maximum segment size, SACK permitted, Timestamps, No-Operation (NOP), Window scale
        TCP Option - Maximum segment size: 1460 bytes
            Kind: Maximum Segment Size (2)
            Length: 4
            MSS Value: 1460
        TCP Option - SACK permitted
            Kind: SACK Permitted (4)
            Length: 2
        TCP Option - Timestamps: TSval 1241141781, TSecr 199828
            Kind: Time Stamp Option (8)
            Length: 10
            Timestamp value: 1241141781
            Timestamp echo reply: 199828
        TCP Option - No-Operation (NOP)
            Kind: No-Operation (1)
        TCP Option - Window scale: 7 (multiply by 128)
            Kind: Window Scale (3)
            Length: 3
            Shift count: 7
            [Multiplier: 128]
    [Timestamps]
        [Time since first frame in this TCP stream: 0.000052091 seconds]
        [Time since previous frame in this TCP stream: 0.000052091 seconds]
    [SEQ/ACK analysis]
        [This is an ACK to the segment in frame: 1]
        [The RTT to ACK the segment was: 0.000052091 seconds]
        [iRTT: 0.000270823 seconds]

0000  08 00 27 41 0f d0 08 00 27 62 0e 57 08 00 45 00   ..'A....'b.W..E.
0010  00 3c 00 00 40 00 40 06 09 28 0a 49 0e fe 0a 49   .<..@.@..(.I...I
0020  0e 05 1c 92 8b 04 74 55 5d 89 8f b3 32 f8 a0 12   ......tU]...2...
0030  fe 88 31 c3 00 00 02 04 05 b4 04 02 08 0a 49 fa   ..1...........I.
0040  52 15 00 03 0c 94 01 03 03 07                     R.........

No.     Time           Source                Destination           Protocol Length Info
      3 0.000270823    10.73.14.5            10.73.14.254          TCP      66     35588 → 7314 [ACK] Seq=1 Ack=1 Win=29312 Len=0 TSval=199829 TSecr=1241141781

Frame 3: 66 bytes on wire (528 bits), 66 bytes captured (528 bits) on interface enp0s8, id 0
    Interface id: 0 (enp0s8)
        Interface name: enp0s8
    Encapsulation type: Ethernet (1)
    Arrival Time: Oct 25, 2022 18:33:14.841129046 EEST
    [Time shift for this packet: 0.000000000 seconds]
    Epoch Time: 1666711994.841129046 seconds
    [Time delta from previous captured frame: 0.000218732 seconds]
    [Time delta from previous displayed frame: 0.000218732 seconds]
    [Time since reference or first frame: 0.000270823 seconds]
    Frame Number: 3
    Frame Length: 66 bytes (528 bits)
    Capture Length: 66 bytes (528 bits)
    [Frame is marked: False]
    [Frame is ignored: False]
    [Protocols in frame: eth:ethertype:ip:tcp]
    [Coloring Rule Name: TCP]
    [Coloring Rule String: tcp]
Ethernet II, Src: PcsCompu_41:0f:d0 (08:00:27:41:0f:d0), Dst: PcsCompu_62:0e:57 (08:00:27:62:0e:57)
    Destination: PcsCompu_62:0e:57 (08:00:27:62:0e:57)
        Address: PcsCompu_62:0e:57 (08:00:27:62:0e:57)
        .... ..0. .... .... .... .... = LG bit: Globally unique address (factory default)
        .... ...0 .... .... .... .... = IG bit: Individual address (unicast)
    Source: PcsCompu_41:0f:d0 (08:00:27:41:0f:d0)
        Address: PcsCompu_41:0f:d0 (08:00:27:41:0f:d0)
        .... ..0. .... .... .... .... = LG bit: Globally unique address (factory default)
        .... ...0 .... .... .... .... = IG bit: Individual address (unicast)
    Type: IPv4 (0x0800)
Internet Protocol Version 4, Src: 10.73.14.5, Dst: 10.73.14.254
    0100 .... = Version: 4
    .... 0101 = Header Length: 20 bytes (5)
    Differentiated Services Field: 0x00 (DSCP: CS0, ECN: Not-ECT)
        0000 00.. = Differentiated Services Codepoint: Default (0)
        .... ..00 = Explicit Congestion Notification: Not ECN-Capable Transport (0)
    Total Length: 52
    Identification: 0x3e64 (15972)
    Flags: 0x40, Don't fragment
        0... .... = Reserved bit: Not set
        .1.. .... = Don't fragment: Set
        ..0. .... = More fragments: Not set
    ...0 0000 0000 0000 = Fragment Offset: 0
    Time to Live: 64
    Protocol: TCP (6)
    Header Checksum: 0xcacb [validation disabled]
    [Header checksum status: Unverified]
    Source Address: 10.73.14.5
    Destination Address: 10.73.14.254
Transmission Control Protocol, Src Port: 35588, Dst Port: 7314, Seq: 1, Ack: 1, Len: 0
    Source Port: 35588
    Destination Port: 7314
    [Stream index: 0]
    [Conversation completeness: Incomplete, DATA (15)]
    [TCP Segment Len: 0]
    Sequence Number: 1    (relative sequence number)
    Sequence Number (raw): 2410885880
    [Next Sequence Number: 1    (relative sequence number)]
    Acknowledgment Number: 1    (relative ack number)
    Acknowledgment number (raw): 1951751562
    1000 .... = Header Length: 32 bytes (8)
    Flags: 0x010 (ACK)
        000. .... .... = Reserved: Not set
        ...0 .... .... = Nonce: Not set
        .... 0... .... = Congestion Window Reduced (CWR): Not set
        .... .0.. .... = ECN-Echo: Not set
        .... ..0. .... = Urgent: Not set
        .... ...1 .... = Acknowledgment: Set
        .... .... 0... = Push: Not set
        .... .... .0.. = Reset: Not set
        .... .... ..0. = Syn: Not set
        .... .... ...0 = Fin: Not set
        [TCP Flags: ·······A····]
    Window: 229
    [Calculated window size: 29312]
    [Window size scaling factor: 128]
    Checksum: 0x5f7a [unverified]
    [Checksum Status: Unverified]
    Urgent Pointer: 0
    Options: (12 bytes), No-Operation (NOP), No-Operation (NOP), Timestamps
        TCP Option - No-Operation (NOP)
            Kind: No-Operation (1)
        TCP Option - No-Operation (NOP)
            Kind: No-Operation (1)
        TCP Option - Timestamps: TSval 199829, TSecr 1241141781
            Kind: Time Stamp Option (8)
            Length: 10
            Timestamp value: 199829
            Timestamp echo reply: 1241141781
    [Timestamps]
        [Time since first frame in this TCP stream: 0.000270823 seconds]
        [Time since previous frame in this TCP stream: 0.000218732 seconds]
    [SEQ/ACK analysis]
        [This is an ACK to the segment in frame: 2]
        [The RTT to ACK the segment was: 0.000218732 seconds]
        [iRTT: 0.000270823 seconds]

0000  08 00 27 62 0e 57 08 00 27 41 0f d0 08 00 45 00   ..'b.W..'A....E.
0010  00 34 3e 64 40 00 40 06 ca cb 0a 49 0e 05 0a 49   .4>d@.@....I...I
0020  0e fe 8b 04 1c 92 8f b3 32 f8 74 55 5d 8a 80 10   ........2.tU]...
0030  00 e5 5f 7a 00 00 01 01 08 0a 00 03 0c 95 49 fa   .._z..........I.
0040  52 15                                             R.

No.     Time           Source                Destination           Protocol Length Info
      4 0.010249645    10.73.14.5            10.73.14.254          TCP      87     35588 → 7314 [PSH, ACK] Seq=1 Ack=1 Win=29312 Len=21 TSval=199838 TSecr=1241141781

Frame 4: 87 bytes on wire (696 bits), 87 bytes captured (696 bits) on interface enp0s8, id 0
    Interface id: 0 (enp0s8)
        Interface name: enp0s8
    Encapsulation type: Ethernet (1)
    Arrival Time: Oct 25, 2022 18:33:14.851107868 EEST
    [Time shift for this packet: 0.000000000 seconds]
    Epoch Time: 1666711994.851107868 seconds
    [Time delta from previous captured frame: 0.009978822 seconds]
    [Time delta from previous displayed frame: 0.009978822 seconds]
    [Time since reference or first frame: 0.010249645 seconds]
    Frame Number: 4
    Frame Length: 87 bytes (696 bits)
    Capture Length: 87 bytes (696 bits)
    [Frame is marked: False]
    [Frame is ignored: False]
    [Protocols in frame: eth:ethertype:ip:tcp:data]
    [Coloring Rule Name: TCP]
    [Coloring Rule String: tcp]
Ethernet II, Src: PcsCompu_41:0f:d0 (08:00:27:41:0f:d0), Dst: PcsCompu_62:0e:57 (08:00:27:62:0e:57)
    Destination: PcsCompu_62:0e:57 (08:00:27:62:0e:57)
        Address: PcsCompu_62:0e:57 (08:00:27:62:0e:57)
        .... ..0. .... .... .... .... = LG bit: Globally unique address (factory default)
        .... ...0 .... .... .... .... = IG bit: Individual address (unicast)
    Source: PcsCompu_41:0f:d0 (08:00:27:41:0f:d0)
        Address: PcsCompu_41:0f:d0 (08:00:27:41:0f:d0)
        .... ..0. .... .... .... .... = LG bit: Globally unique address (factory default)
        .... ...0 .... .... .... .... = IG bit: Individual address (unicast)
    Type: IPv4 (0x0800)
Internet Protocol Version 4, Src: 10.73.14.5, Dst: 10.73.14.254
    0100 .... = Version: 4
    .... 0101 = Header Length: 20 bytes (5)
    Differentiated Services Field: 0x00 (DSCP: CS0, ECN: Not-ECT)
        0000 00.. = Differentiated Services Codepoint: Default (0)
        .... ..00 = Explicit Congestion Notification: Not ECN-Capable Transport (0)
    Total Length: 73
    Identification: 0x3e65 (15973)
    Flags: 0x40, Don't fragment
        0... .... = Reserved bit: Not set
        .1.. .... = Don't fragment: Set
        ..0. .... = More fragments: Not set
    ...0 0000 0000 0000 = Fragment Offset: 0
    Time to Live: 64
    Protocol: TCP (6)
    Header Checksum: 0xcab5 [validation disabled]
    [Header checksum status: Unverified]
    Source Address: 10.73.14.5
    Destination Address: 10.73.14.254
Transmission Control Protocol, Src Port: 35588, Dst Port: 7314, Seq: 1, Ack: 1, Len: 21
    Source Port: 35588
    Destination Port: 7314
    [Stream index: 0]
    [Conversation completeness: Incomplete, DATA (15)]
    [TCP Segment Len: 21]
    Sequence Number: 1    (relative sequence number)
    Sequence Number (raw): 2410885880
    [Next Sequence Number: 22    (relative sequence number)]
    Acknowledgment Number: 1    (relative ack number)
    Acknowledgment number (raw): 1951751562
    1000 .... = Header Length: 32 bytes (8)
    Flags: 0x018 (PSH, ACK)
        000. .... .... = Reserved: Not set
        ...0 .... .... = Nonce: Not set
        .... 0... .... = Congestion Window Reduced (CWR): Not set
        .... .0.. .... = ECN-Echo: Not set
        .... ..0. .... = Urgent: Not set
        .... ...1 .... = Acknowledgment: Set
        .... .... 1... = Push: Set
        .... .... .0.. = Reset: Not set
        .... .... ..0. = Syn: Not set
        .... .... ...0 = Fin: Not set
        [TCP Flags: ·······AP···]
    Window: 229
    [Calculated window size: 29312]
    [Window size scaling factor: 128]
    Checksum: 0x9bab [unverified]
    [Checksum Status: Unverified]
    Urgent Pointer: 0
    Options: (12 bytes), No-Operation (NOP), No-Operation (NOP), Timestamps
        TCP Option - No-Operation (NOP)
            Kind: No-Operation (1)
        TCP Option - No-Operation (NOP)
            Kind: No-Operation (1)
        TCP Option - Timestamps: TSval 199838, TSecr 1241141781
            Kind: Time Stamp Option (8)
            Length: 10
            Timestamp value: 199838
            Timestamp echo reply: 1241141781
    [Timestamps]
        [Time since first frame in this TCP stream: 0.010249645 seconds]
        [Time since previous frame in this TCP stream: 0.009978822 seconds]
    [SEQ/ACK analysis]
        [iRTT: 0.000270823 seconds]
        [Bytes in flight: 21]
        [Bytes sent since last PSH flag: 21]
    TCP payload (21 bytes)
Data (21 bytes)
    Data: 5353482d322e302d4f70656e5353485f372e340d0a
    [Length: 21]

0000  08 00 27 62 0e 57 08 00 27 41 0f d0 08 00 45 00   ..'b.W..'A....E.
0010  00 49 3e 65 40 00 40 06 ca b5 0a 49 0e 05 0a 49   .I>e@.@....I...I
0020  0e fe 8b 04 1c 92 8f b3 32 f8 74 55 5d 8a 80 18   ........2.tU]...
0030  00 e5 9b ab 00 00 01 01 08 0a 00 03 0c 9e 49 fa   ..............I.
0040  52 15 53 53 48 2d 32 2e 30 2d 4f 70 65 6e 53 53   R.SSH-2.0-OpenSS
0050  48 5f 37 2e 34 0d 0a                              H_7.4..

No.     Time           Source                Destination           Protocol Length Info
      5 0.010274763    10.73.14.254          10.73.14.5            TCP      66     7314 → 35588 [ACK] Seq=1 Ack=22 Win=65152 Len=0 TSval=1241141792 TSecr=199838

Frame 5: 66 bytes on wire (528 bits), 66 bytes captured (528 bits) on interface enp0s8, id 0
    Interface id: 0 (enp0s8)
        Interface name: enp0s8
    Encapsulation type: Ethernet (1)
    Arrival Time: Oct 25, 2022 18:33:14.851132986 EEST
    [Time shift for this packet: 0.000000000 seconds]
    Epoch Time: 1666711994.851132986 seconds
    [Time delta from previous captured frame: 0.000025118 seconds]
    [Time delta from previous displayed frame: 0.000025118 seconds]
    [Time since reference or first frame: 0.010274763 seconds]
    Frame Number: 5
    Frame Length: 66 bytes (528 bits)
    Capture Length: 66 bytes (528 bits)
    [Frame is marked: False]
    [Frame is ignored: False]
    [Protocols in frame: eth:ethertype:ip:tcp]
    [Coloring Rule Name: TCP]
    [Coloring Rule String: tcp]
Ethernet II, Src: PcsCompu_62:0e:57 (08:00:27:62:0e:57), Dst: PcsCompu_41:0f:d0 (08:00:27:41:0f:d0)
    Destination: PcsCompu_41:0f:d0 (08:00:27:41:0f:d0)
        Address: PcsCompu_41:0f:d0 (08:00:27:41:0f:d0)
        .... ..0. .... .... .... .... = LG bit: Globally unique address (factory default)
        .... ...0 .... .... .... .... = IG bit: Individual address (unicast)
    Source: PcsCompu_62:0e:57 (08:00:27:62:0e:57)
        Address: PcsCompu_62:0e:57 (08:00:27:62:0e:57)
        .... ..0. .... .... .... .... = LG bit: Globally unique address (factory default)
        .... ...0 .... .... .... .... = IG bit: Individual address (unicast)
    Type: IPv4 (0x0800)
Internet Protocol Version 4, Src: 10.73.14.254, Dst: 10.73.14.5
    0100 .... = Version: 4
    .... 0101 = Header Length: 20 bytes (5)
    Differentiated Services Field: 0x00 (DSCP: CS0, ECN: Not-ECT)
        0000 00.. = Differentiated Services Codepoint: Default (0)
        .... ..00 = Explicit Congestion Notification: Not ECN-Capable Transport (0)
    Total Length: 52
    Identification: 0x8ce9 (36073)
    Flags: 0x40, Don't fragment
        0... .... = Reserved bit: Not set
        .1.. .... = Don't fragment: Set
        ..0. .... = More fragments: Not set
    ...0 0000 0000 0000 = Fragment Offset: 0
    Time to Live: 64
    Protocol: TCP (6)
    Header Checksum: 0x7c46 [validation disabled]
    [Header checksum status: Unverified]
    Source Address: 10.73.14.254
    Destination Address: 10.73.14.5
Transmission Control Protocol, Src Port: 7314, Dst Port: 35588, Seq: 1, Ack: 22, Len: 0
    Source Port: 7314
    Destination Port: 35588
    [Stream index: 0]
    [Conversation completeness: Incomplete, DATA (15)]
    [TCP Segment Len: 0]
    Sequence Number: 1    (relative sequence number)
    Sequence Number (raw): 1951751562
    [Next Sequence Number: 1    (relative sequence number)]
    Acknowledgment Number: 22    (relative ack number)
    Acknowledgment number (raw): 2410885901
    1000 .... = Header Length: 32 bytes (8)
    Flags: 0x010 (ACK)
        000. .... .... = Reserved: Not set
        ...0 .... .... = Nonce: Not set
        .... 0... .... = Congestion Window Reduced (CWR): Not set
        .... .0.. .... = ECN-Echo: Not set
        .... ..0. .... = Urgent: Not set
        .... ...1 .... = Acknowledgment: Set
        .... .... 0... = Push: Not set
        .... .... .0.. = Reset: Not set
        .... .... ..0. = Syn: Not set
        .... .... ...0 = Fin: Not set
        [TCP Flags: ·······A····]
    Window: 509
    [Calculated window size: 65152]
    [Window size scaling factor: 128]
    Checksum: 0x31bb [unverified]
    [Checksum Status: Unverified]
    Urgent Pointer: 0
    Options: (12 bytes), No-Operation (NOP), No-Operation (NOP), Timestamps
        TCP Option - No-Operation (NOP)
            Kind: No-Operation (1)
        TCP Option - No-Operation (NOP)
            Kind: No-Operation (1)
        TCP Option - Timestamps: TSval 1241141792, TSecr 199838
            Kind: Time Stamp Option (8)
            Length: 10
            Timestamp value: 1241141792
            Timestamp echo reply: 199838
    [Timestamps]
        [Time since first frame in this TCP stream: 0.010274763 seconds]
        [Time since previous frame in this TCP stream: 0.000025118 seconds]
    [SEQ/ACK analysis]
        [This is an ACK to the segment in frame: 4]
        [The RTT to ACK the segment was: 0.000025118 seconds]
        [iRTT: 0.000270823 seconds]

0000  08 00 27 41 0f d0 08 00 27 62 0e 57 08 00 45 00   ..'A....'b.W..E.
0010  00 34 8c e9 40 00 40 06 7c 46 0a 49 0e fe 0a 49   .4..@.@.|F.I...I
0020  0e 05 1c 92 8b 04 74 55 5d 8a 8f b3 33 0d 80 10   ......tU]...3...
0030  01 fd 31 bb 00 00 01 01 08 0a 49 fa 52 20 00 03   ..1.......I.R ..
0040  0c 9e                                             ..

No.     Time           Source                Destination           Protocol Length Info
      6 0.026745208    10.73.14.254          10.73.14.5            TCP      98     7314 → 35588 [PSH, ACK] Seq=1 Ack=22 Win=65152 Len=32 TSval=1241141808 TSecr=199838

Frame 6: 98 bytes on wire (784 bits), 98 bytes captured (784 bits) on interface enp0s8, id 0
    Interface id: 0 (enp0s8)
        Interface name: enp0s8
    Encapsulation type: Ethernet (1)
    Arrival Time: Oct 25, 2022 18:33:14.867603431 EEST
    [Time shift for this packet: 0.000000000 seconds]
    Epoch Time: 1666711994.867603431 seconds
    [Time delta from previous captured frame: 0.016470445 seconds]
    [Time delta from previous displayed frame: 0.016470445 seconds]
    [Time since reference or first frame: 0.026745208 seconds]
    Frame Number: 6
    Frame Length: 98 bytes (784 bits)
    Capture Length: 98 bytes (784 bits)
    [Frame is marked: False]
    [Frame is ignored: False]
    [Protocols in frame: eth:ethertype:ip:tcp:data]
    [Coloring Rule Name: TCP]
    [Coloring Rule String: tcp]
Ethernet II, Src: PcsCompu_62:0e:57 (08:00:27:62:0e:57), Dst: PcsCompu_41:0f:d0 (08:00:27:41:0f:d0)
    Destination: PcsCompu_41:0f:d0 (08:00:27:41:0f:d0)
        Address: PcsCompu_41:0f:d0 (08:00:27:41:0f:d0)
        .... ..0. .... .... .... .... = LG bit: Globally unique address (factory default)
        .... ...0 .... .... .... .... = IG bit: Individual address (unicast)
    Source: PcsCompu_62:0e:57 (08:00:27:62:0e:57)
        Address: PcsCompu_62:0e:57 (08:00:27:62:0e:57)
        .... ..0. .... .... .... .... = LG bit: Globally unique address (factory default)
        .... ...0 .... .... .... .... = IG bit: Individual address (unicast)
    Type: IPv4 (0x0800)
Internet Protocol Version 4, Src: 10.73.14.254, Dst: 10.73.14.5
    0100 .... = Version: 4
    .... 0101 = Header Length: 20 bytes (5)
    Differentiated Services Field: 0x00 (DSCP: CS0, ECN: Not-ECT)
        0000 00.. = Differentiated Services Codepoint: Default (0)
        .... ..00 = Explicit Congestion Notification: Not ECN-Capable Transport (0)
    Total Length: 84
    Identification: 0x8cea (36074)
    Flags: 0x40, Don't fragment
        0... .... = Reserved bit: Not set
        .1.. .... = Don't fragment: Set
        ..0. .... = More fragments: Not set
    ...0 0000 0000 0000 = Fragment Offset: 0
    Time to Live: 64
    Protocol: TCP (6)
    Header Checksum: 0x7c25 [validation disabled]
    [Header checksum status: Unverified]
    Source Address: 10.73.14.254
    Destination Address: 10.73.14.5
Transmission Control Protocol, Src Port: 7314, Dst Port: 35588, Seq: 1, Ack: 22, Len: 32
    Source Port: 7314
    Destination Port: 35588
    [Stream index: 0]
    [Conversation completeness: Incomplete, DATA (15)]
    [TCP Segment Len: 32]
    Sequence Number: 1    (relative sequence number)
    Sequence Number (raw): 1951751562
    [Next Sequence Number: 33    (relative sequence number)]
    Acknowledgment Number: 22    (relative ack number)
    Acknowledgment number (raw): 2410885901
    1000 .... = Header Length: 32 bytes (8)
    Flags: 0x018 (PSH, ACK)
        000. .... .... = Reserved: Not set
        ...0 .... .... = Nonce: Not set
        .... 0... .... = Congestion Window Reduced (CWR): Not set
        .... .0.. .... = ECN-Echo: Not set
        .... ..0. .... = Urgent: Not set
        .... ...1 .... = Acknowledgment: Set
        .... .... 1... = Push: Set
        .... .... .0.. = Reset: Not set
        .... .... ..0. = Syn: Not set
        .... .... ...0 = Fin: Not set
        [TCP Flags: ·······AP···]
    Window: 509
    [Calculated window size: 65152]
    [Window size scaling factor: 128]
    Checksum: 0x31db [unverified]
    [Checksum Status: Unverified]
    Urgent Pointer: 0
    Options: (12 bytes), No-Operation (NOP), No-Operation (NOP), Timestamps
        TCP Option - No-Operation (NOP)
            Kind: No-Operation (1)
        TCP Option - No-Operation (NOP)
            Kind: No-Operation (1)
        TCP Option - Timestamps: TSval 1241141808, TSecr 199838
            Kind: Time Stamp Option (8)
            Length: 10
            Timestamp value: 1241141808
            Timestamp echo reply: 199838
    [Timestamps]
        [Time since first frame in this TCP stream: 0.026745208 seconds]
        [Time since previous frame in this TCP stream: 0.016470445 seconds]
    [SEQ/ACK analysis]
        [iRTT: 0.000270823 seconds]
        [Bytes in flight: 32]
        [Bytes sent since last PSH flag: 32]
    TCP payload (32 bytes)
Data (32 bytes)
    Data: 5353482d322e302d4f70656e5353485f382e397031205562756e74752d330d0a
    [Length: 32]

0000  08 00 27 41 0f d0 08 00 27 62 0e 57 08 00 45 00   ..'A....'b.W..E.
0010  00 54 8c ea 40 00 40 06 7c 25 0a 49 0e fe 0a 49   .T..@.@.|%.I...I
0020  0e 05 1c 92 8b 04 74 55 5d 8a 8f b3 33 0d 80 18   ......tU]...3...
0030  01 fd 31 db 00 00 01 01 08 0a 49 fa 52 30 00 03   ..1.......I.R0..
0040  0c 9e 53 53 48 2d 32 2e 30 2d 4f 70 65 6e 53 53   ..SSH-2.0-OpenSS
0050  48 5f 38 2e 39 70 31 20 55 62 75 6e 74 75 2d 33   H_8.9p1 Ubuntu-3
0060  0d 0a                                             ..

No.     Time           Source                Destination           Protocol Length Info
      7 0.026983066    10.73.14.5            10.73.14.254          TCP      66     35588 → 7314 [ACK] Seq=22 Ack=33 Win=29312 Len=0 TSval=199855 TSecr=1241141808

Frame 7: 66 bytes on wire (528 bits), 66 bytes captured (528 bits) on interface enp0s8, id 0
    Interface id: 0 (enp0s8)
        Interface name: enp0s8
    Encapsulation type: Ethernet (1)
    Arrival Time: Oct 25, 2022 18:33:14.867841289 EEST
    [Time shift for this packet: 0.000000000 seconds]
    Epoch Time: 1666711994.867841289 seconds
    [Time delta from previous captured frame: 0.000237858 seconds]
    [Time delta from previous displayed frame: 0.000237858 seconds]
    [Time since reference or first frame: 0.026983066 seconds]
    Frame Number: 7
    Frame Length: 66 bytes (528 bits)
    Capture Length: 66 bytes (528 bits)
    [Frame is marked: False]
    [Frame is ignored: False]
    [Protocols in frame: eth:ethertype:ip:tcp]
    [Coloring Rule Name: TCP]
    [Coloring Rule String: tcp]
Ethernet II, Src: PcsCompu_41:0f:d0 (08:00:27:41:0f:d0), Dst: PcsCompu_62:0e:57 (08:00:27:62:0e:57)
    Destination: PcsCompu_62:0e:57 (08:00:27:62:0e:57)
        Address: PcsCompu_62:0e:57 (08:00:27:62:0e:57)
        .... ..0. .... .... .... .... = LG bit: Globally unique address (factory default)
        .... ...0 .... .... .... .... = IG bit: Individual address (unicast)
    Source: PcsCompu_41:0f:d0 (08:00:27:41:0f:d0)
        Address: PcsCompu_41:0f:d0 (08:00:27:41:0f:d0)
        .... ..0. .... .... .... .... = LG bit: Globally unique address (factory default)
        .... ...0 .... .... .... .... = IG bit: Individual address (unicast)
    Type: IPv4 (0x0800)
Internet Protocol Version 4, Src: 10.73.14.5, Dst: 10.73.14.254
    0100 .... = Version: 4
    .... 0101 = Header Length: 20 bytes (5)
    Differentiated Services Field: 0x00 (DSCP: CS0, ECN: Not-ECT)
        0000 00.. = Differentiated Services Codepoint: Default (0)
        .... ..00 = Explicit Congestion Notification: Not ECN-Capable Transport (0)
    Total Length: 52
    Identification: 0x3e66 (15974)
    Flags: 0x40, Don't fragment
        0... .... = Reserved bit: Not set
        .1.. .... = Don't fragment: Set
        ..0. .... = More fragments: Not set
    ...0 0000 0000 0000 = Fragment Offset: 0
    Time to Live: 64
    Protocol: TCP (6)
    Header Checksum: 0xcac9 [validation disabled]
    [Header checksum status: Unverified]
    Source Address: 10.73.14.5
    Destination Address: 10.73.14.254
Transmission Control Protocol, Src Port: 35588, Dst Port: 7314, Seq: 22, Ack: 33, Len: 0
    Source Port: 35588
    Destination Port: 7314
    [Stream index: 0]
    [Conversation completeness: Incomplete, DATA (15)]
    [TCP Segment Len: 0]
    Sequence Number: 22    (relative sequence number)
    Sequence Number (raw): 2410885901
    [Next Sequence Number: 22    (relative sequence number)]
    Acknowledgment Number: 33    (relative ack number)
    Acknowledgment number (raw): 1951751594
    1000 .... = Header Length: 32 bytes (8)
    Flags: 0x010 (ACK)
        000. .... .... = Reserved: Not set
        ...0 .... .... = Nonce: Not set
        .... 0... .... = Congestion Window Reduced (CWR): Not set
        .... .0.. .... = ECN-Echo: Not set
        .... ..0. .... = Urgent: Not set
        .... ...1 .... = Acknowledgment: Set
        .... .... 0... = Push: Not set
        .... .... .0.. = Reset: Not set
        .... .... ..0. = Syn: Not set
        .... .... ...0 = Fin: Not set
        [TCP Flags: ·······A····]
    Window: 229
    [Calculated window size: 29312]
    [Window size scaling factor: 128]
    Checksum: 0x5f10 [unverified]
    [Checksum Status: Unverified]
    Urgent Pointer: 0
    Options: (12 bytes), No-Operation (NOP), No-Operation (NOP), Timestamps
        TCP Option - No-Operation (NOP)
            Kind: No-Operation (1)
        TCP Option - No-Operation (NOP)
            Kind: No-Operation (1)
        TCP Option - Timestamps: TSval 199855, TSecr 1241141808
            Kind: Time Stamp Option (8)
            Length: 10
            Timestamp value: 199855
            Timestamp echo reply: 1241141808
    [Timestamps]
        [Time since first frame in this TCP stream: 0.026983066 seconds]
        [Time since previous frame in this TCP stream: 0.000237858 seconds]
    [SEQ/ACK analysis]
        [This is an ACK to the segment in frame: 6]
        [The RTT to ACK the segment was: 0.000237858 seconds]
        [iRTT: 0.000270823 seconds]

0000  08 00 27 62 0e 57 08 00 27 41 0f d0 08 00 45 00   ..'b.W..'A....E.
0010  00 34 3e 66 40 00 40 06 ca c9 0a 49 0e 05 0a 49   .4>f@.@....I...I
0020  0e fe 8b 04 1c 92 8f b3 33 0d 74 55 5d aa 80 10   ........3.tU]...
0030  00 e5 5f 10 00 00 01 01 08 0a 00 03 0c af 49 fa   .._...........I.
0040  52 30                                             R0

No.     Time           Source                Destination           Protocol Length Info
      8 0.036842590    10.73.14.5            10.73.14.254          TCP      1562   35588 → 7314 [PSH, ACK] Seq=22 Ack=33 Win=29312 Len=1496 TSval=199865 TSecr=1241141808

Frame 8: 1562 bytes on wire (12496 bits), 1562 bytes captured (12496 bits) on interface enp0s8, id 0
    Interface id: 0 (enp0s8)
        Interface name: enp0s8
    Encapsulation type: Ethernet (1)
    Arrival Time: Oct 25, 2022 18:33:14.877700813 EEST
    [Time shift for this packet: 0.000000000 seconds]
    Epoch Time: 1666711994.877700813 seconds
    [Time delta from previous captured frame: 0.009859524 seconds]
    [Time delta from previous displayed frame: 0.009859524 seconds]
    [Time since reference or first frame: 0.036842590 seconds]
    Frame Number: 8
    Frame Length: 1562 bytes (12496 bits)
    Capture Length: 1562 bytes (12496 bits)
    [Frame is marked: False]
    [Frame is ignored: False]
    [Protocols in frame: eth:ethertype:ip:tcp:data]
    [Coloring Rule Name: TCP]
    [Coloring Rule String: tcp]
Ethernet II, Src: PcsCompu_41:0f:d0 (08:00:27:41:0f:d0), Dst: PcsCompu_62:0e:57 (08:00:27:62:0e:57)
    Destination: PcsCompu_62:0e:57 (08:00:27:62:0e:57)
        Address: PcsCompu_62:0e:57 (08:00:27:62:0e:57)
        .... ..0. .... .... .... .... = LG bit: Globally unique address (factory default)
        .... ...0 .... .... .... .... = IG bit: Individual address (unicast)
    Source: PcsCompu_41:0f:d0 (08:00:27:41:0f:d0)
        Address: PcsCompu_41:0f:d0 (08:00:27:41:0f:d0)
        .... ..0. .... .... .... .... = LG bit: Globally unique address (factory default)
        .... ...0 .... .... .... .... = IG bit: Individual address (unicast)
    Type: IPv4 (0x0800)
Internet Protocol Version 4, Src: 10.73.14.5, Dst: 10.73.14.254
    0100 .... = Version: 4
    .... 0101 = Header Length: 20 bytes (5)
    Differentiated Services Field: 0x00 (DSCP: CS0, ECN: Not-ECT)
        0000 00.. = Differentiated Services Codepoint: Default (0)
        .... ..00 = Explicit Congestion Notification: Not ECN-Capable Transport (0)
    Total Length: 1548
    Identification: 0x3e67 (15975)
    Flags: 0x40, Don't fragment
        0... .... = Reserved bit: Not set
        .1.. .... = Don't fragment: Set
        ..0. .... = More fragments: Not set
    ...0 0000 0000 0000 = Fragment Offset: 0
    Time to Live: 64
    Protocol: TCP (6)
    Header Checksum: 0xc4f0 [validation disabled]
    [Header checksum status: Unverified]
    Source Address: 10.73.14.5
    Destination Address: 10.73.14.254
Transmission Control Protocol, Src Port: 35588, Dst Port: 7314, Seq: 22, Ack: 33, Len: 1496
    Source Port: 35588
    Destination Port: 7314
    [Stream index: 0]
    [Conversation completeness: Incomplete, DATA (15)]
    [TCP Segment Len: 1496]
    Sequence Number: 22    (relative sequence number)
    Sequence Number (raw): 2410885901
    [Next Sequence Number: 1518    (relative sequence number)]
    Acknowledgment Number: 33    (relative ack number)
    Acknowledgment number (raw): 1951751594
    1000 .... = Header Length: 32 bytes (8)
    Flags: 0x018 (PSH, ACK)
        000. .... .... = Reserved: Not set
        ...0 .... .... = Nonce: Not set
        .... 0... .... = Congestion Window Reduced (CWR): Not set
        .... .0.. .... = ECN-Echo: Not set
        .... ..0. .... = Urgent: Not set
        .... ...1 .... = Acknowledgment: Set
        .... .... 1... = Push: Set
        .... .... .0.. = Reset: Not set
        .... .... ..0. = Syn: Not set
        .... .... ...0 = Fin: Not set
        [TCP Flags: ·······AP···]
    Window: 229
    [Calculated window size: 29312]
    [Window size scaling factor: 128]
    Checksum: 0x3793 [unverified]
    [Checksum Status: Unverified]
    Urgent Pointer: 0
    Options: (12 bytes), No-Operation (NOP), No-Operation (NOP), Timestamps
        TCP Option - No-Operation (NOP)
            Kind: No-Operation (1)
        TCP Option - No-Operation (NOP)
            Kind: No-Operation (1)
        TCP Option - Timestamps: TSval 199865, TSecr 1241141808
            Kind: Time Stamp Option (8)
            Length: 10
            Timestamp value: 199865
            Timestamp echo reply: 1241141808
    [Timestamps]
        [Time since first frame in this TCP stream: 0.036842590 seconds]
